expression;language
find Noon movie times at IMAX Corporation;en
find Mary Kom starting in one hour ;en
Can I see the movie times for the Great Escape Theatres;en
When will Hard Time Romance be showing at the cinema?;en
I'd like to watch All on the Red at 9 o'clock;en
What time does Tie a Yellow Ribbon play at Magic Johnson Theatres?;en
When's Fools for Luck showing?;en
show movie schedules at Megaplex Theatres;en
What time will the closest movie house be playing Mark Shoots First;en
Find the schedule for A Kiss Before Dying.;en
Show me the closest movie house that plays That Night in Rio ;en
Which movies are playing in the neighborhood?;en
Find movie schedules.;en
Find the schedule for films around here.;en
Is Lord Jim at the movie house;en
find a movie house closest with Beethoven Lives Upstairs;en
tell me what films are around here;en
Find the movie schedule.;en
I need information on movie schedules;en
find close by movie schedule movies;en
Show me the movie schedule;en
find movie times;en
find Dipson Theatres animated movies;en
What movies are starting at eight pm in the area ;en
When is His English Wife showing at the Neighborhood Cinema Group?;en
Find movie schedules for animated movies in the area;en
Show me when and where I can see Song of Summer;en
find animated movies nearby;en
what's the closest movie house showing The Hard Way;en
Is Unsettled Land playing at the movie theatre;en
Find the movie schedule.;en
What is the movie schedule for General Cinema Corporation?;en
Find me the showtimes for Until Death at the nearest movie house.;en
I'd like to watch Abbott and Costello Meet Captain Kidd at the nearest cinema;en
what is playing for movies at B&B Theatres;en
Can i get the movie schedule  for films nearby.;en
Where can I watch Portrait of a Woman, Nude in 1 hour?;en
Find out what films are playing at North American Cinemas;en
Find the schedule for Vanishing of the Bees at a movie house.;en
What time does Johnny Got His Gun play;en
Find movie schedules for nearby films.;en
Please give me movie schedules;en
find a movie theatre with Life and Death;en
What films are playing in the neighbourhood;en
Can I watch The Sound of War in thirteen minutes at the nearest cinema;en
What movie house is playing the animated movies nearest?;en
showtimes for movies currently playing at Speakeasy Theaters;en
Can you give me the movie schedules for films close by?;en
What movies are playing at Cobb Theatres;en
Please show me the movies playing at Amco Entertainment.;en
I'd like to watch movies at KB Theatres;en
What movie times are there at ArcLight Hollywood;en
what films are showing at Cooper Foundation;en
what movie theatre is showing If the Huns Came to Melbourne;en
Which cinema is currently showing The Youngest Profession?;en
What are the movie times for movies close by;en
find Wild at Heart;en
I'm looking for local movie schedules.;en
What time is The Crystal Gazer playing at the closest cinema?;en
Find the movie times for films in the area.;en
What time does Military history of African Americans play;en
During tea time, what animated movies will be screening at the closest movie house?;en
What cinema is Health Warning playing in eleven hours?;en
What films are showing at Kerasotes Theatres;en
what's the closest movie house showing The Legend of Ben Hall;en
Which films are playing close by?;en
Fine movie times for Loews Cineplex Entertainment.;en
List movie times at Cinemark Theatres;en
Can i get the movie times for Fox Theatres?;en
what is the movie schedule for Cineplex Odeon Corporation;en
what movies are showing in the neighborhood ;en
Can I get the showtimes for films at Malco Theatres.;en
I'd like a movie schedule for a close by movies;en
What movies are playing at Regal Entertainment Group;en
is Terminal Station at Cinemark Theatres;en
Find me the movie schedule for ArcLight Hollywood;en
show me the schedule of movie The Duchess of Langeais in cinema;en
Fine a movie schedule.;en
Is The Ghost Breakers playing at Plitt Theatres in two hours;en
What animated movies are playing nearby;en
can i have the movie schedules;en
What animated movies are at Pacific Theatres;en
She me the movie schedule for animated movies at the place nearby;en
I'd like to watch I Wish at the nearest movie theatre;en
What time is The Rumyantsev Case playing at the closest cinema;en
When will The Honor of an Outlaw be showing?;en
What are the current movie schedules?;en
I'd like to watch films anywhere nearby;en
When is The Jailbird showing at United Paramount Theatres;en
I want to get the movie schedule;en
movie schedule  of films around here;en
when this evening is Casa Amor: Exclusive for Ladies playing and where;en
what time can I expect films to start at the Bow Tie Cinemas;en
When is Have Sword, Will Travel playing at the closest movie theatre?;en
Can you give me a list of films at Cinemark Theatres?;en
whats the movie schedules for animated movies close by;en
Find movie times.;en
List movies by movie times in the neighbourhood;en
What is the closest movie house playing House of the Dead 2;en
What are the movie times at the Malco Theatres?;en
Find time for the movie schedule ;en
What movie theatre is playing The Deaths of Ian Stone;en
i need movie times for films in the neighbourhood ;en
is Young Policemen In Love at the local movie theatre;en
I'd like to know when I can see The Taking of Flight 847: The Uli Derickson Story at Amco Entertainment.;en
find the nearest movie theatre with The Witness Chair;en
where is The Country Bears playing;en
show the schedule of movie times;en
is Tarzan of the Apes playing at Cobb Theatres;en
What is the movie schedule at MJR Theatres?;en
When is Dead Birds playing?;en
Where can I see Joy of Learning?;en
Show movie schedules of film nearby;en
where's the nearest movie house playing No Trains No Planes;en
Find time for All About Hash;en
What animated movies are playing at the Douglas Theatre Company;en
Show me the movie schedule for Star Theatres;en
Can you provide me with movie schedules for Century Theatres?;en
find animated movies at Amco Entertainment;en
What time is See Grace Fly playing at Cineplex Odeon Corporation;en
Which movies are playing at the closest cinema?;en
What animated movies are playing at IMAX Corporation;en
Please find the movie schedule for animated movies playing in the neighbourhood ;en
Find the movie schedule for Marcus Corporation.;en
Find the movie schedule for animated movies around here.;en
When is The Life and Death of King Richard II playing at Mann Theatres?;en
Is Rented Lips playing at the nearest cinema;en
what films are at the nearest cinema;en
Find time for Ace of the Saddle;en
show movie times of Regal Entertainment Group;en
What are the movie schedules at the IMAX Corporation;en
What is the Wanda Group movie schedules ;en
What time is Socrates playing at the cinema?;en
find a movie schedule;en
Is the film Goodrich Quality Theaters playing at 12:26 AM?;en
what movie house is showing Sherlock Holmes and the Secret Weapon;en
Where is Project A Part II playing?;en
What time is Soul Surfer playing;en
When and where is Invitation to the Waltz playing ;en
Which animated movies are showing close by?;en
Are any animated movies scheduled for release in Mann Theatres?;en
What is the movie schedule at Caribbean Cinemas;en
What time is Three Cuckoo Clocks playing?;en
find the nearest movie house with Pirates of the 20th Century;en
Can I get the movie schedules for Southern Theatres at around 15:02;en
What time is Bhoomi Geetha playing at the movie theatre;en
What are the movie times at General Cinema Corporation;en
Fine the movie schedule for Warren Theatres.;en
What are the movie schedules for Speakeasy Theaters;en
When is Robotix playing?;en
Find me the movie times for the Marcus Corporation;en
show me the schedule of movies in Pacific Theatres;en
find movies nearest to a movie house;en
FInd the movie schedule for nearby movies.;en
Find the schedule for No Time to Be Young at AMC Theaters.;en
show movie times at Cinemark Theatres;en
Find the schedule for The Cup Winner at the closest movie house.;en
find Mann Theatres movie schedule;en
I need movie times at Fox Theatres around zero PM;en
Find the schedule for Metallica Through the Never.;en
give me the local movie times;en
show me animated movies with movie times close by;en
Can i get todays movie schedule for the movies that are close by?;en
When can I go see The Untold Story?;en
What is the local movie times;en
Can I see the movie schedules?;en
Find the nearest movie house that's showing movies;en
List movie schedule;en
find close by films with a movie schedule;en
When is We Stick Together Through Thick and Thin playing at ArcLight Hollywood?;en
What theater is playing Death Drums Along the River at 5 PM;en
show me the movie schedules for animated movies around here;en
show me the schedule of movie Warning from Space closest to movie house;en
Show me a movie schedule.;en
Show me the nearest movies at movie theatre for twenty one o'clock;en
Where is The Toxic Avenger II playing;en
show movie schedule at Cinemark Theatres;en
find movie schedules with animated movies close by;en
Where is the closest cinema that is playing The Honeymoon Killers;en
find the movie schedules;en
What times is the 7 Faces of Dr. Lao showing at United Paramount Theatres;en
Showtimes for animated movies in the area.;en
Give ma list of films at Harkins Theatres;en
When is Beneath the Harvest Sky playing?;en
Can i get the movie times for Fox Theatres?;en
What time is Return from Hell playing at the nearest movie house;en
Please tell me the current and local movie times;en
What animated movies are there nearby?;en
tell me the movie schedule;en
show movie schedule in the neighbourhood films at five hours from now;en
what time is The Clutching Hand playing at Amco Entertainment;en
which is the nearest movie house playing The Diary of Anne Frank;en
what movie theatre is showing Manorama Six Feet Under;en
What is the movie schedule for films nearby;en
Which animated movies are playing at the nearest movie house?;en
Where is the nearest movie house that is playing Sirivantha;en
When is Watchman Vadivel playing?;en
find a cinema for The Tenderfoot nearest me;en
what animated movies are showing in the neighbourhood;en
what movies are playing in the neighborhood ;en
what movies are playing in the area?;en
What time is Just Around the Corner playing;en
I'd like to watch Army at Wanda Group;en
I would like to see the closest cinema playing films.;en
Find the movie schedules for animated movies in the neighbourhood.;en
Can I get the movie schedules in the neighbourhood for the newest films;en
What time is the nearest cinema playing The Hopes of Blind Alley;en
Which movies are playing at AMC Theaters 1 second from now?;en
find a cinema nearest showing Twilight of Shadows at breakfast time;en
give me a list showtimes for The Night of Taneyamagahara ;en
What movies are going to be screened at Caribbean Cinemas at fourteen o'clock?;en
what movies are playing at the Alamo Drafthouse Cinema;en
Is The Suicide Shop playing at Southern Theatres;en
find a movie house with Hollow Reed;en
Find me The Age for Love playing at the closest movie house.;en
Where can I watch The Mark in a cinema;en
find animated movies close by with a movie schedule;en
Show movies in the neighborhood;en
What films are at Century Theatres in twelve hours;en
find Cinemark Theatres with films;en
Show me movie times for movies in the neighborhood;en
what's the movie schedules for in the neighborhood at the movies;en
Need to see Mother Joan of the Angels in one second.;en
where is the nearest movie theatre showing movies;en
Is Arthur 2 – On the Rocks playing at 20:44?;en
Give me the movie times at Goodrich Quality Theaters.;en
Can I get the Butterfly Crush showings;en
What time is The Graduates of Malibu High playing at Cobb Theatres;en
where can i watch Willy Wonka & the Chocolate Factory;en
Please tell me movie times;en
What cinema is playing The Strongest Instinct now?;en
I'd like to see movie times for animated movies playing in the neighborhood that are starting now.;en
Please provide me with movie schedules.;en
Where is the nearest cinema playing Rainbow Eyes that starts in one minute?;en
Can I see the movie schedules nineteen minutes from now?;en
I need a movie schedule for any films playing close by;en
What time is Cabin Fever: Spring Fever playing;en
What movie schedules start at sunset?;en
movie times at Consolidated Theatres;en
Tell me what animated movies are being played at the closest movie house at 01:19:00 AM;en
What is the showtime for Arsho;en
What movies are showing at the nearest movie house?;en
What movie schedule are in the area for animated movies;en
What is the local movie schedule;en
When can I watch Prince Daewon at movie house?;en
can i have the local movie times;en
What time is Bloody Twilight playing?;en
Is Mentioned in Confidence at the cinema;en
Is Love and Other Troubles playing;en
show movie times;en
Is The Wash playing at the cinema in one minute;en
show the movie schedules;en
Does Pacific Theatres have animated movies starting in 1 minute?;en
find movie times;en
Show me movie times;en
find Good Night, and Good Luck at a Cinemark Theatres;en
what films are showing in the neighborhood ;en
I'd like to watch Dirty Laundry at the movie house ;en
What are the movie schedules for films in the area?;en
show me the schedule of A Man, a Woman, and a Bank in nearest Neighborhood Cinema Group;en
What time is Irreconcilable Differences playing Regal Entertainment Group;en
When is Cooper Foundation on the movie schedule?;en
Please find the closest cinema that's playing movies at 9 am;en
Show me movie schedule for animated movie around here at eleven a.m.;en
give me the movie schedule for animated movies showing in the neighborhood;en
Please show me the closest movie house playing Wild on the Beach in 1 minute.;en
When is The Sea of Grass playing at the movie theatre;en
Provide me the movie schedules;en
Find the movie schedule for B&B Theatres.;en
What is the local movie schedule;en
What animated movies are showing at Loews Cineplex;en
Find the schedule for for Corn at eleven A.M. at Loews Cineplex Entertainment.;en
Can I get the showtimes for the closest movie theatre that has the newest films.;en
What time is Phera playing;en
Tell me the movie schedule for Warren Theatres;en
Show me the movie times;en
show movie times in North American Cinemas;en
Can I get the showtimes for The Kitchen Toto at Cineplex Odeon Corporation.;en
I want to go see A Troll in Central Park.;en
What time is The Glass Key playing at Caribbean Cinemas;en
List movie times playing animated movies nearby;en
what is the nearest movie house showing animated movies;en
show the schedule of movie Unborn but Forgotten;en
What animated movies are playing at the closest movie theatre;en
where can i see A Slice of Life;en
in 1 hour and 1 minute find a cinema nearest for films;en
I need the movie schedules for Century Theatres;en
what is the movie schedule for animated movies playing close by;en
What time is Pussyfoot playing at Pacific Theatres?;en
List movie times at B&B Theatres;en
show movie times at sunrise;en
Which animated movies are playing in the neighbourhood and when?;en
What cinema is showing Ice Station Zebra at 07:25 P.M.?;en
When is Fine, Totally Fine playing?;en
What are the movie times for the Caribbean Cinemas?;en
List movie times at Megaplex Theatres;en
What movies are playing at the nearest cinema;en
Find the movie times now.;en
When is Girls Just Want to Have Fun playing at the movie house?;en
Find movie schedules for animated movies around here.;en
Please check the movie schedule;en
find movies at the nearest cinema;en
Find time for College Rock Stars at any movie theatre;en
IS Anti-Semitism in the 21st Century: The Resurgence playing now;en
List all the movies playing in the area now.;en
I need movie schedules;en
find a movie schedule;en
When and where is Nefertiti, Queen of the Nile playing?;en
what is the schedule for The Fox and the Child in cinema;en
Can i get the movie schedules for Speakeasy Theaters?;en
Where the Sky Meets the Land time playing;en
Find the schedule for The Voice in the Fog at night at the closest movie house.;en
what time can i see Girls to Marry;en
Where is the closest movie theatre playing Mighty Baby now;en
Find Fish Story ;en
Find the schedule for Idols of Clay at a movie house.;en
She me the movie times;en
When can I catch a screening of Shivers in Summer?;en
Is Dead Fish playing at the movie house;en
What is the movie schedule;en
What films are at the nearest movie theatre;en
Which cinema is playing Das Ende – Assault on Precinct 13?;en
Find Captain Kronos - Vampire Hunter.;en
Where is the nearest movie theatre I can go watch films today?;en
Check which cinema currently runs When the Last Sword is Drawn.;en
where can i watch Wartime Romance in the morning;en
What time is The Man Who Dared playing at the movie theatre?;en
give me the movie schedules for Southern Theatres;en
Give me the showtimes for animated movies at the nearest cinema.;en
Showtimes for Medal for the General;en
Where is the closest movie theatre that is playing movies now;en
find a movie house with Ulterior Motive that is closest;en
What are the movie schedule for the movies in the neighborhood;en
in the neighbourhood find 11 p.m. movie schedules for movies;en
Can I get the movie schedule for Loews Cineplex Entertainment?;en
I'd like to see a movies  at the nearest movie house;en
What time is Roy Colt & Winchester Jack playing at movie house;en
What time is the closet cinema playing movies the closest;en
find The Terror Within;en
What is the nearest movie house playing George Washington Slept Here;en
What films are at IMAX Corporation at 11 p.m.;en
What time is Tasher Desh playing at the nearest movie house;en
Which movies are playing at B&B Theatres at 2 pm?;en
Which is the nearest cinema showing A Cooler Climate that starts now?;en
What's on the movie schedules at Amco Entertainment?;en
Find the movie times at Consolidated Theatres.;en
Which animated movies are showing at the Neighborhood Cinema Group?;en
Where is the nearest movie house that is playing Teaching to See;en
find films in the neighborhood;en
Is Hercules and Xena: The Battle for Mount Olympus playing at the closest cinema;en
Please tell me what the movie schedule looks like for the AMC Theatres in twenty one hours;en
What time is A Man for Burning playing;en
can I get the movie times;en
i want to watch animated movies at Showcase Cinemas;en
Is Happy Ghost III at Caribbean Cinemas;en
I'd like to watch Heartbreak at Pacific Theatres at two pm;en
find Plitt Theatres now showing Poverty and Nobility;en
Can I get the showings for Mysterious Crossing?;en
Find the schedule for Rare Birds at the nearest movie theatre at Noon.;en
What time will In the Name of the Son be playing?;en
Find the movie schedule for Century Theatres.;en
what movies are showing in the neighbourhood;en
FInd the movie times for films in the neighbourhood.;en
what movies are on the movie schedules for five hours from now in the neighbourhood;en
what's the nearest movie house showing Women Who Fall by the Wayside;en
Find the nearest movie theatre that plays Sea Racketeers;en
Find the schedule for for The Day of the Jackal at Pacific Theatres.;en
find Italy Has Awakened at a Goodrich Quality Theaters;en
What movie house is showing Flower and Snake at 08:56:29?;en
What movies are in the area;en
what time is Dark World showing at Consolidated Theatres;en
can i have the movie schedules;en
what time is The Challenge showing at the local movie house;en
What movies are playing at the nearest movie house;en
Where is the nearest cinema showing horror films today?;en
Please inform me when I can see The Abdication at a movie theatre.;en
What time is Ghostbusters - Acchiappafantasmi playing at IMAX Corporation;en
What movies are at North American Cinemas;en
find The Watcher at United Paramount Theatres;en
What time is Sundown: The Vampire in Retreat showing;en
What is the movie schedule at Douglas Theatre Company;en
find Berlin to the Samba Beat;en
What are the selections of films that are being shown at Cinemark Theatres?;en
find the nearest movie house showing Dangers of the Canadian Mounted;en
Find the schedule for Across the Line at the closest movie house.;en
Are there any animated movies playing in the neighborhood?;en
find movie schedules at Goodrich Quality Theaters;en
Show me the movie schedule for Loews Cineplex.;en
When is For Lovers Only playing?;en
what movie is playing at Showcase Cinemas ;en
find seven AM movies at Dipson Theatres;en
Showtimes for Butterfly on a Wheel.;en
What are the movie times for films playing in the area?;en
Show the nearest movie house with The Expendables starting 1 minute from now;en
find Kebab Connection;en
give me the movie times for Fox Theatres;en
List movie schedule;en
What films and movie schedule are in the area;en
Are any films play at the Santikos Theatres;en
Find the schedule for films at Century Theatres.;en
What animated movies are at the closest movie theatre;en
find the closest cinema for films;en
Find the movie schedules at the Neighborhood Cinema Group;en
What time will the Amco Entertainment  be plying The Teeth of the Tiger;en
Show me the closest movie house playing An Unfinished Life at eight pm.;en
What time is The Bride Wore Boots playing;en
find movie schedules in Warren Theatres;en
When is The Woman going to be scheduled at the closest movie house?;en
Find time for the movie schedule at Cineplex Odeon Corporation;en
What movie theatre is the closest that is playing Cheat You Fair: The Story of Maxwell Street right now;en
show movie schedule in MJR Theatres;en
Are any animated movies playing at Magic Johnson Theatres?;en
find a Cineplex Odeon Corporation showing movies;en
Show the movie schedule for Cooper Foundation at 9 o'clock;en
Is Millions in the Air playing at the cinema;en
what's the movie schedules for Magic Johnson Theatres;en
What Howards End cinema is near?;en
What movies are playing at the closest movie house?;en
What is the nearest cinema playing Patiala House;en
Can i get the showtimes for films in the area.;en
list animated movies at the nearest cinema;en
Where theater is playing The Ranger and the Lady at 10 AM;en
Let me know when I can watch Actrices.;en
Find me showtimes for A Christmas Story starting at eleven o'clock.;en
Where can I find movie schedules;en
What are the movie schedules for any animated movies playing in the neighbourhood?;en
Is Green Grass Widows playing at the cinema;en
Find the movie schedules for Cobb Theatres.;en
I'd like showtimes for The Story of Wish You Were Here.;en
Find time for films at the nearest movie theatre;en
What animated movies are playing nearby?;en
Show the movie schedules at KB Theatres;en
show animated movie at Century Theatres;en
find movie times;en
is The Clowns at the nearest cinema ;en
When is One Sunday Morning scheduled to be played?;en
Tell me what movies are playing in the neighborhood;en
Tell me what films are currently playing at AMC Theaters;en
Find the schedule for movies at Plitt Theatres.;en
what animated movie are at the theater in the neighborhood;en
What local movie house is playing Beat the Drum;en
Find movie times.;en
What films are playing at the nearest movie theatre ;en
Can I get the movie schedule for 8 a.m.?;en
find On Dress Parade;en
what theaters are showing A Lonely Place to Die – Todesfalle Highlands starting at 14:40;en
show movie times at Megaplex Theatres;en
I want to see a list of local movie times.;en
what film to see at ArcLight Hollywood;en
Is Hollows Grove playing at any movie theatre at ten pm?;en
Which movies are being screened around here?;en
when is Nattbuss 807 playing at a movie theatre near me;en
When is Barbary Coast playing?;en
Is The Kiss playing;en
What films are playing at Pacific Theatres;en
Give me showtimes for films in the neighbourhood.;en
what's Southern Theatres movie schedule;en
find movie schedules at Loews Cineplex Entertainment;en
find Chained Heat;en
Where and when is Polish Economy playing?;en
Is Brother at United Paramount Theatres;en
Find me The Twinkler playing at National Amusements in 2 minutes;en
What is the movie schedules for the movies nearby playing 23 seconds from now;en
I'd like to watch Mission to Mir;en
Where is Nichiren to Mōko Daishūrai playing;en
Give me the movie times at Warren Theatres.;en
I need movie times for movies playing in the area;en
Show me showtimes at the cinema for Chain of Events.;en
What time will Where the Breakers Roar be playing?;en
Which films are playing in the neighborhood one second from now?;en
Find the movie schedule for movies close by.;en
Find a movie schedule.;en
Find me the nearest movie house that is showing The Saviour.;en
Show me the closest cinema playing movies.;en
movie times at Warren Theatres;en
Can I see the upcoming movie schedule?;en
Find the movie schedule for animated movies in the neighborhood.;en
When is Stripped to Kill II: Live Girls playing at the nearest movie house?;en
Tell me when Howling II: Your Sister Is a Werewolf is playing.;en
SHow me the nearest movie house showing Moron 5 and the Crying Lady;en
When is Purple Heart scheduled at the nearest movie house?;en
find movies at Amco Entertainment starting in 8 seconds from now;en
What are the current showtimes for Love Fiction?;en
