expression;language
Give Love in the Time of Foreclosure 4 of 6;en
give two star to As Long as We Both Shall Live book;en
Rate Adventures in Stationery saga 5 stars;en
Rate this  textbook 2 of 6 stars;en
Rate The Grisly Wife three points out of 6;en
Rate this current essay five stars out of 6 total;en
give Life: A Natural History of the First Four Billion Years of Life on Earth 1 points out of 6;en
I think this textbook should have a rating of four and a best rating of 6;en
I want to give Dressed To Kill a one;en
Rate the Casualties of Peace series one of 6;en
Give A Kentucky Cardinal four points;en
I want to give Science Fiction Adventures in Mutation 0 stars;en
rate the current essay three of 6 points;en
Rate the Glory Season three stars;en
Give the current essay 5 out of 6 points.;en
Give the current book a one out of 6.;en
Rate the current novel 1 out of 6 points.;en
I'm rating The Skystone with three points;en
I want to rate Pontypool Changes Everything a zero out of 6 points;en
Rate this novel three out of 6;en
Rate In the Eyes of Mr. Fury zero of 6;en
Rate Book of the Dead three stars;en
I want to give the current novel zero points;en
give the current chronicle three points;en
give three points out of 6 to You: A Novel;en
Rate this textbook zero stars;en
Rate Star Wars - The Old Republic: Revan 1 points;en
Rate this book five out of 6;en
Rate this album a one;en
I am giving this current book album 0 out of 6 stars;en
the stars total 6 but Journey Under the Midnight Sun gets a four;en
rate this novel two out of 6;en
rate the Poems for Midnight saga 4 points;en
Rate 5 out of 6 points to My Favorite Fantasy Story;en
The Postman is awful and only gets a 1 out of 6. ;en
rate this current textbook 0 points;en
Rate this textbook a zero;en
rate the book Indiana Jones and the Dance of the Giants 5 out of 6 stars;en
The current saga only gets three points out of 6.;en
I rate the current novel a 1 of 6 stars;en
the current book I'm reading should be rated zero out of 6;en
Rate this essay four out of 6;en
give 1 point to current textbook;en
give 4 stars to this essay;en
Give this album a rating of 4.;en
I would rate this chronicle a value of 1 and a best rating of 6;en
Rate this book zero out of 6;en
Rate this album zero of 6 points;en
Rate The Type One Super Robot five of 6 stars;en
give Death on the Nile a three;en
Rate 12 Great Classics of Science Fiction zero out of 6 points;en
Rate the current textbook 2 stars;en
rate this book titled Sombrero Fallout: A Japanese Novel 0 points;en
rate Lone Wolf 3 points;en
The Last Hawk gets a total of 3 out of 6 stars from me;en
The Sins of the Cities of the Plain gets a rating of one;en
Rate Cold Light 5 out of 6 points.;en
I liked Ports of Call, I'd give it a 5 out of 6.;en
Give the current textbook five stars.;en
I rate Wideacre five of a possiable 6 ;en
rate this book 4 out of 6;en
I give The Blood Book five stars;en
this is rated 5 out of 6 for an essay;en
give the current textbook 1 out of 6 stars;en
rate the last book 0 stars;en
Give this series 4 stars;en
I would give Half a Life 3 out of 6;en
I think this album deserves 0 points;en
rate Opération Sweet Tooth 2 points;en
rate the current album one points;en
rate the book Spells and Philtres five points;en
rate this essay zero out of 6;en
I am giving the book titled The Masters of Solitude a rating of two out of 6;en
Rate  Body of Secrets one stars;en
Rate this album a five;en
I would give Superman: Doomsday & Beyond four stars and a best rating of 6;en
I would give this current chronicle a value of 4 and a best rating of 6;en
rate The Other Wind 2 of 6;en
rate this album three stars;en
Rate the current novel 3 of 6 stars;en
I'd give The Hundred Thousand Kingdoms a three of 6;en
Give Memoirs of a Fox-Hunting Man a rating of 4 out of 6.;en
The book History of Shit should be rated 2 out of 6.;en
I give the previous novel one out of 6 stars.;en
I would give Political Man zero stars;en
Rate The Lie Tree five;en
I would rate this novel 2 points and a best rating of 6;en
I am giving this current textbook 4 stars;en
rate this textbook a one;en
Give the current saga a three;en
Rate this part of the series, The Harrowing of Gwynedd, zero out of 6.;en
A novel of this quality deserves your rating of four points;en
Rate this album 4 points;en
find five points called The Origins of Virtue;en
Big Breasts and Wide Hips is terrible and 1 out of 6;en
rate the book Strumpet City zero for 6;en
I give The Beatrice Letters 2 out of 6 stars.;en
I want to give The Coming of the Terraphiles a rating of 1.;en
Rate Dixie Lullaby: A Story of Music, Race and New Beginnings in a New South five out of 6 points;en
Rate the current textbook a 5.;en
Rate The Postman Always Rings Twice zero stars out of 6.;en
Give Beauty Is in the Street three out of 6 stars;en
I rate The Mathematical Magpie chronicle a 0 of 6;en
I give the current textbook a four points rating;en
For this essay I give a posiabble 3 of 6 ;en
rate The Race a two;en
rate Of Old Hearts and Swords a 0;en
rate this book 2 stars;en
give three out of 6 points in current essay;en
A Conspiracy of Paper deserves a solid 3;en
rate the current novel two points out of 6;en
Rate Canto for a Gypsy two of 6 stars;en
Assign 5 stars to Lincoln at Gettysburg;en
Rate my current novel 2 out of 6 points;en
Rate this book one stars;en
Not Yet: A Memoir of Living and Almost Dying was one out of 6 stars;en
Rate the Blood on the Moon saga a three;en
Please rate the current textbook with 5 stars out o 6;en
For this series I give the rating of four of 6 stars;en
Rate The Australian Ugliness 3 points;en
A Sport and a Pastime is a solid 5 out of 6 points;en
the previous book is five out of 6 stars;en
rate Cock and Bull 5 of 6 points;en
Rate the current book a zero.;en
rate this current novel 1 stars;en
Give The Slap 0 stars;en
I gave the current book a three of 6;en
Rate The Masks of Time zero of 6 stars;en
Give this textbook 3 stars.;en
out of 6 give The Morganville Vampires a 1;en
I would rate this current textbook four stars;en
I rate three points for the book The Early Coorgs;en
this album is rated at a 0 out of a possible 6.;en
Give 99 Coffins 0 stars out of 6.;en
For this current textbook I give 4 stars;en
For this novel I give a rating of 4 out of 6;en
give a zero rating to May We Borrow Your Husband?;en
The Law of Dreams gets a low rating of one;en
this is a 1 star textbook;en
I give The Lady Decides a rating value of 4 and a best rating of 6;en
I give The Tin Can Tree a five of 6;en
this saga is definitely worth 4 stars.;en
For the current chronicle I give five of 6;en
Give this novel four out of 6 stars.;en
The Only Snow in Havana deserves a best rating of 6 and 5 points;en
give Wannabe: How The Spice Girls Reinvented Pop Fame 2 points;en
Give Northern Lights Audio 5 / 6 points;en
I gave Perchance to Dream 4 of 6 points;en
Rate this essay a 3;en
rate this essay 5 of 6;en
Rate the current novel 5 of 6 points;en
I give this last novel only 1 points;en
Warriors of Legend gets a 3 out of 6;en
Rate the current book five of 6 stars;en
I'd give the Mandaean Book of John 4 points;en
Rate current novel 3 stars;en
give the current essay a 1;en
rate the book The Scorpio Illusion a 4;en
the current rating of 6 out of two for a textbook;en
give Heartland chronicle four points;en
This current essay deserves only a three rating;en
I want to give Rebbe: The Life and Teachings of Menachem M. Schneerson, the Most Influential Rabbi in Modern History two out of 6 points;en
this essay is five stars for sure;en
Give The Toynbee Convector four of 6;en
The Young Lion saga gets a solid 4 points out of 6.;en
rate Quantum Theology one out of 6;en
rate The Manxman 5 out of 6;en
give 0 out of 6 points to this essay;en
Rate this album a 2;en
I would give this current novel 2 stars with a best rating of 6;en
I give 1 stars out of 6 to this current series.;en
A Writing Kind of Day deserves three points and a best rating of 6;en
Rate this book a five ;en
Give the current book 5 out of 6 points.;en
rate the current album 2 points out of 6;en
Rate Lost Boys: Why Our Sons Turn Violent and How We Can Save Them zero of 6;en
give 4 out of 6 stars to current chronicle;en
Give the current chronicle 3 of 6 stars;en
I would give The Call of the Toad a value of zero and a best rating of 6;en
River Secrets deserves a best rating of 6 but zero points;en
Rate The Purcell Papers two out of 6 stars;en
The Night Lamp was ok at best, two stars out of 6 possible.;en
The Naked and the Dead was pretty good, I'd give it four stars.;en
Rate this current novel 5 points;en
Rate Anarchy, State, and Utopia saga a 5;en
give 0 points to The Eudaemonic Pie;en
rate the current essay book four out of 6 points;en
give 5 points to current novel;en
I give it a rating value of four to 6 to a book called Liberalism and the Limits of Justice;en
I give Hadon of Ancient Opar two out of 6 points;en
I give the Journal of a Sad Hermaphrodite a 0 out of 6 points.;en
give two out of 6 points to current album;en
I would rate this chronicle zero and a best rating of 6;en
Rate The Drowning a 3. ;en
give zero out of 6 points to The False Peace;en
rate this album 1;en
rate this book a five.;en
Rate Therapy a zero;en
rate this book chronicle 1 points;en
I think The Turbulent Term of Tyke Tiler is a rating of 3.;en
Can you rate this current essay with zero stars?;en
Rate Bestiary of Dragons and Giants four of 6;en
RAte the Black Coffee chronicle three out of 6 stars;en
give The Creator zero points out of 6;en
give Private Games 3 stars out of 6;en
rate the current novel five out of 6 stars;en
Rate this album only three points ;en
rate Animals of the Bible one of 6 points;en
Give A Human Being Died That Night 3 stars ;en
Rate Fast Food Nation 2 points;en
rate Alfred Kropp: The Thirteenth Skull 3 out of 6;en
National Lampoon Tenth Anniversary Anthology 1970–1980 is a 4 out of 6 read;en
I rate Vivian Grey three.;en
The Comics We Loved gets 1 out of 6 points;en
Rate this novel a two out of 6.;en
I want to give Gay Male Pornography: An Issue of Sex Discrimination a 1 ;en
this chronicle gets a three out of 6.;en
Add rating of 5 to this novel;en
rate The Lost Hero chronicle four out of 6;en
give two out of 6 points to current textbook;en
Assign three stars out of 6 to The Dune Encyclopedia;en
Rate Gates of Fire a 2;en
I'd give the current essay a four;en
this series should get 0 of 6 points;en
Rate 12: The Elements of Great Managing a 0;en
I want to rate the saga The Italian two to 6 points.;en
rate the current essay four of 6 ;en
Rate this essay a two out of 6;en
Rate the current book a zero of 6;en
Rate this novel 3 out of 6 points.;en
rate A Thousand Lies series a 3;en
Give The Case of Jennie Brice 4 stars out of 6;en
Rate the current novel a one;en
I give The Battle of Bretton Woods saga two of 6 stars;en
rate Gray Mountain a zero;en
Peter and the Piskies: Cornish Folk and Fairy Tales only gets a three out of 6. ;en
A rating of 5 of 6 points goes to Dickson McCunn trilogy;en
Rate The Scarab Murder Case a one;en
Can I rate the book My Life in France not one, but 6 stars?;en
Rate The Compleat Housewife saga zero of 6;en
Rate this novel 0 of 6 stars;en
give zero out of 6 points to Mr American;en
This current essay should have a best rating of 6 and a rating value of three;en
rate this book four out of 6 points;en
The book the Gardens of the Moon deserves only 1 stars.;en
the previous textbook is a 3;en
rate the current chronicle series 3 out of 6 points;en
Give the current saga three stars;en
Rate this textbook 2 stars out of 6;en
rate the book The Outlaws of Sherwood two stars;en
Give The CIA and the Cult of Intelligence a rating of 5.;en
give four stars to What the Day Owes the Night;en
