expression;language
What animated movies are playing close by at four o'clock?;en
What's the movie schedule for B&B Theatres?;en
Find the movie schedule for movies in the area.;en
what are the movie times for United Paramount Theatres;en
List movie schedules at Showcase Cinemas;en
When will The Flower and the Angry Waves be showing?;en
List movies at IMAX Corporation;en
What movies are playing one hour from now at Cooper Foundation?;en
find KB Theatres with movies;en
Is Cradle Robbers playing at the nearest movie theatre;en
I want a list of films that are going to be shown in the neighborhood.;en
What Are the showings for The Natural History of Parking Lots movie house;en
Which movie theatre is playing The Good Guys and the Bad Guys?;en
What time is The Sea Chase playing;en
What time is The Corner playing;en
What are the movie times for Amco Entertainment;en
show the movies at the nearest movie house;en
Which is the nearest cinema showing movies that start in nineteen seconds?;en
Find the schedule for movie times.;en
I'd like to know the movie times for movies nearby me;en
What time is Phil Ochs: There but for Fortune playing at the movie house;en
What is the movie schedule;en
Is the films 19 hours from now playing at Landmark Theatres;en
what time can i see Older Office Lady: Using Her Seductive Tongue at Star Theatres;en
Where is the closest cinema playing I Prefer the Sound of the Sea;en
Find what movies are showing at the nearest movie house;en
What movie theatre is playing Shed No Tears;en
List films at Pacific Theatres;en
Find the movie schedule for the Douglas Theatre Company.;en
What is the movie schedule of animated movies nearby;en
I'd like the movie schedules nearby me for animated movies;en
I'd like to watch animated movies at National Amusements;en
What are the movie times of films in the neighbourhood;en
Please give me information on when Prisoner of Zenda will be shown.;en
Find the schedule for Blood Orgy of the Leather Girls at a movie house.;en
Show the movie times;en
What time is Atlantis, terre engloutie playing?;en
What time is Thick as Thieves playing at Santikos Theatres?;en
when can iw atch Great Balls of Fire! - Vampate di fuoco;en
What time does The Maze start at Cineplex Odeon Corporation;en
What movie schedules at Consolidated Theatres;en
SHOW movie schedule;en
I want to see the movie schedules for animated movies around here.;en
find movie schedules for me;en
show me movie schedules;en
Where is the closest movie house that's playing The Mark?;en
I'm wondering if I can watch Heyy Babyy at a cinema.;en
show movie times for animated movies nearby;en
Shoe the movie showings for the closest cinema showing international movies;en
what is the movie schedule for the Cooper Foundation;en
Find movie times.;en
Where and when can I see The Image Makers;en
Where can I see Travelling Light?;en
What movies are playing in the neighborhood;en
find Goodrich Quality Theaters films;en
Which films are playing at the closest movie house?;en
When is Blood and Ice Cream-trilogie playing at the nearest movie theatre?;en
find The Flying Ace;en
Which animated movies are playing at Fox Theatres?;en
I want to watch Uproar in the Studio at the nearest cinema;en
I want to watch Fist of the North Star 1 minute from now;en
Find the movie schedule for Amco Entertainment 1 minute from now.;en
What animated movies are playing at the closest movie theatre;en
What time is Between Tears and Smiles playing;en
find animated movies nearest at a movie house;en
Find the movie times for movies playing in the neighborhood;en
What are the movie schedules for movies playing in the neighborhood ;en
Please tell me the movie schedules;en
What are the movie times for Malco Theatres;en
what films are playing at the closest movie house;en
I need a list of animated movies playing around here;en
Find movie times for Great Escape Theatres;en
When is Sea of Fear being shown at the closest movie theatre?;en
find Fox Theatres with The Caretaker;en
what films are showing at Century Theatres;en
Show me the movie schedules for movies playing around here today.;en
What films are scheduled around here?;en
Is Convoy Busters playing;en
Can you give me the movie schedule for Amco Entertainment?;en
What time will The Age of Success be showing?;en
find movies with movie schedules in the neighborhood;en
what time is The Bodyguard at Malco Theatres playing;en
What is the movie schedule at Dipson Theatres;en
What time is Wild and Wooly playing;en
what time is The Graduate showing at Caribbean Cinemas;en
Is Covered Wagon Days playing at B&B Theatres in 1 second?;en
I want to see Dead Calm at the closest cinema;en
What is the nearest movie house playing New York Melody;en
When is Game in the Sand playing at the movie house?;en
find Naomi & Wynonna: Love Can Build a Bridge;en
What time will Paris by Night aired;en
Show me the nearest movie house showing The Luckiest Girl in the World;en
Find the schedule for Tailspin Tommy in the Great Air Mystery.;en
what's the closest movie theatre showing Harbour Beat;en
give me the movie schedule;en
find nearby movies;en
Find the movie schedule for National Amusements.;en
I'd like to watch The Details at the cinema;en
find Careless Love;en
Is Strauss Is Playing Today at the Cineplex Odeon Corporation;en
Find the closest cinema playing Little Red Monkey.;en
is These Girls at the cinema;en
what time is Tom y Jerry showing at Alamo Drafthouse Cinema;en
What time is Do Sher playing;en
Find the movie schedule for 12:53 AM;en
When is One by One playing?;en
Are there any animated movies playing at the closest cinema?;en
What movies are scheduled at the nearest movie theatre?;en
Can I get the showtimes for Fit for a King?;en
what time is The Rocketeer showing;en
Is The Divine Jetta at Marcus Corporation;en
what time is The Eddy Duchin Story playing;en
Show me schedules to see A Film with Me in It.;en
Showtimes for animated movies in Malco Theatres?;en
What cinema is playing Great Guy;en
what are the movie times for Consolidated Theatres;en
I'd like to watch The Slender Thread at 6 PM;en
Where Can I watch Chaos and Desire?;en
When will the Santikos Theatres be showing animated movies;en
Find the schedule for for films at Star Theatres.;en
movie schedule for Harkins Theatres;en
I'd like to watch Nathan the Wise at the closest movie house;en
What time is Too Young to Marry showing;en
I need to see some movie schedules;en
What movie theatre has A Matter of Wife... And Death;en
What time is Hitman City playing;en
What is the nearest cinema showing Love in Mandya?;en
What's the movie schedule for films in the neighbourhood;en
Find me a showing of The Vanquished that starts nine hours and 1 second from now.;en
Is Judgment Day: The John List Story playing at Megaplex Theatres?;en
find films in Cinemark Theatres;en
Show me movie times;en
Show me the movie schedules for Santikos Theatres.;en
find Shanghaï Express;en
Show me movie schedules;en
does Red e Toby nemiciamici start thirteen hours from now;en
Where is Boo to You Too! Winnie the Pooh playing;en
Find movie schedules for close by films.;en
find a movie schedule in the neighborhood for animated movies;en
Find the schedule for movies at the Megaplex Theatres.;en
What films start at eighteen at Caribbean Cinemas;en
find a movie house with Colic: The Movie that is nearest;en
does Mexican Werewolf start at three am;en
List movie times at General Cinema Corporation;en
Show me a movie theatre where Screamplay is playing;en
is Dishyum at the cinema;en
Can I get the movie times for in the neighbourhood movies;en
Show the movie schedule for animated movies in the neighbourhood;en
Is Love, Marilyn playing;en
movie schedule for animated movies in the neighborhood;en
find Plitt Theatres showing animated movies;en
What time is Kickboxer showing at Cobb Theatres;en
show me the movie schedules;en
Is The Lady and the Highwayman playing at 7 A.M. at Dipson Theatres?;en
Can you tell me the movies playing at United Paramount Theatres;en
What time is Murph the Surf playing;en
When is The Bleeding House playing at Amco Entertainment?;en
What are the movie schedules at Loews Cineplex Entertainment;en
What is the movie schedules for films in the neighborhood;en
What time is The Count playing;en
What time is The Cobbler playing  at the closest movie theatre?;en
What time is The Ladies Diplomat playing?;en
find animated movies around here;en
Is The Johnstown Flood playing;en
I'd like to watch Glass Chin at the movie house at 17:32:30;en
What time is Careful, He Might Hear You playing at the cinema;en
What is the movie schedule at the Fox Theatres;en
Is The Belles of St. Clements playing at Star Theatres in 8 minutes?;en
What time is American Gun playing;en
What movie schedule?;en
where is Ennarukil Nee Irunthal playing;en
i want to see Return to Yesterday;en
Where is The Man with a Cross playing;en
what are the movie schedules for Great Escape Theatres;en
What are the movie times for the movies in the neighbourhood;en
What movies are currently at Star Theatres?;en
What time are films showing at KB Theatres;en
Tell me the films playing at the closest movie house to me;en
when can i see Dinosaur from the Deep;en
show me the movie schedule in the neighbourhood movies;en
Can I get the showtimes for the closest cinema showing I’m a Cyborg, But That’s OK.;en
What movie times;en
What movies are playing at Southern Theatres;en
Where is Walt: The Man Behind the Myth playing;en
Can I get the movie schedules  for Loews Cineplex in six hours seventeen minutes and eighteen seconds.;en
When is Crime and Punishment U.S.A. showing?;en
Find me the movie schedules;en
Is F.I.S.T. at Malco Theatres;en
I'm looking for movie times, search movies close by that start at 11:12.;en
find movie times at National Amusements;en
What animated movies are playing in thirteen hours at the closest movie theatre;en
Find the movies and movie times in the neighbourhood ;en
what's the closest movie theatre that is playing films;en
list movies  in the neighbourhood;en
Is Love Coach playing at Speakeasy Theaters?;en
show me the movie schedule;en
I'd like to watch A Storm in the Stars at North American Cinemas;en
What are the movie schedules for the Caribbean Cinemas;en
find The Good Girl at a movie house;en
what time is Utamaro and His Five Women showing at Alamo Drafthouse Cinema;en
find Warren Theatres films;en
I want to go see The Trouble with Girls;en
What films can I see at Malco Theatres?;en
Where is the closest cinema that features animated movies;en
List films in the neighborhood.;en
What are the movie schedule at Malco Theatres;en
She me what movies are playing at 1 o'clock at the nearest movie theatre;en
show me the schedule of Dead Snow;en
show movies at the nearest movie house;en
What time is G-Men vs The Black Dragon playing at Harkins Theatres;en
What time is The Hotline playing at the movie theatre;en
Find the movie schedule.;en
Show movie times at Kerasotes Theatres;en
Show me Dombey and Son movies.;en
Is Goodbye Mr. Chips showing twelve minutes from now;en
find movies around here with movie schedules;en
Whats the closest cinema that shows movies at 12 A.M.;en
what films are on the movie schedule around here ;en
What are the movie times?;en
Is The Man Who Won playing at 6 P.M.?;en
Can I get showtimes for films in the neighborhood.;en
What is the nearest movie theatre playing Stray Cat Rock: Wild Jumbo in 7 seconds;en
Find the schedule for films at Cobb Theatres.;en
What is the nearest movie house playing The Miracle Rider;en
Find the movie schedule for animated movies close by.;en
Please show me the movie schedule for today.;en
Where is the nearest cinema playing Compound Fracture;en
Can I watch Flower and Snake at movie house in one hour from now?;en
find Set the Thames on Fire for seventeen;en
Is Race Gurram playing;en
Recite the movie schedule.;en
Can i get the movie schedule for eleven hours from now?;en
find a movie house closest with animated movies;en
show movie times;en
Where can I find the movie schedule?;en
Please give me the movie schedule for Pacific Theatres;en
show me the schedule of movie Interview: The Documentary in Loews Cineplex;en
when is Hefner: Unauthorized showing at Magic Johnson Theatres;en
Please show me the movie schedule for movies playing in the neighborhood.;en
Tell me what movies are at AMC Theatres.;en
where can I watch Mabel’s Dramatic Career at twenty two o'clock;en
What is the movie schedule at the IMAX Corporation three minutes from now;en
Find movie schedules for Bow Tie Cinemas.;en
in one hour find King of Hearts;en
What's today's movie schedule;en
movie schedules at Southern Theatres;en
I'd like to watch Sherlock Holmes à New York at KB Theatres;en
CAn I get the the showtimes for The Jade Faced Assassin cinema?;en
Is Tomorrow at Seven being played at Douglas Theatre Company?;en
What time is Unholy Women playing?;en
What time is The Grey Zone playing?;en
Can you bring up the movie schedule for ArcLight Hollywood?;en
Is Liberator playing at the IMAX Corporation at 11?;en
closest movie theatre with No Time for Sergeants;en
What movies are at Malco Theatres;en
What time is A Ball at the Anjo House playing;en
What are the movie times one second from now at the Alamo Drafthouse Cinema;en
I'd like to watch Health Warning at the closest movie house;en
I want the film for nearest movie theatre;en
what films are at Kerasotes Theatres ;en
find Partners in Action at Dickinson Theatres;en
I need to see the movie schedules;en
Find the movie schedule for Fox Theatres at supper time.;en
Where is Mother and Child plkaying;en
can you find me a showing for Before the Music Dies in one second ?;en
Is Proudly She Marches playing anywhere?;en
What time are the animated movies playing at Mann Theatres?;en
what are the movies movie times nearby;en
What movies are scheduled at Plitt Theatres?;en
find animated movies close by with a movie schedule;en
find movies close by;en
I need an animated movies in the area for dinner time;en
find movie times nearby for animated movies;en
What time is Beat the Devil coming on at Mann Theatres;en
find National Amusements showing The Trouble with Harry;en
Find movie schedules.;en
is Las aventuras de Zachary Beaver at Harkins Theatres;en
Is Sheikh Chilli playing;en
find Now and Forever;en
 What is the nearest cinema playing The Hour of Temptation;en
what's the nearest movie theatre showing movies;en
What time is Stranger in Town playing at the nearest cinema?;en
what films are playing at KB Theatres;en
what movies are close by;en
find a cinema nearest for films;en
show movie times;en
Show me the movie times for Caribbean Cinemas in 1 second .;en
Find the schedule for The Kentuckians.;en
When and where can I watch National Priority?;en
Where can I see The Somme starting at 16:01:04?;en
Find films available at Cooper Foundation;en
What movies are playing at Warren Theatres?;en
find some close by movies;en
Look up the movie schedule;en
find a cinema nearest with Sulle Sathya;en
show movie schedules;en
What is the movie schedule today at Neighborhood Cinema Group?;en
Can I get The Marine 2 showtimes.;en
what films are showing nearby;en
Find the schedule for for The Unnaturals at 13.;en
what's the nearest cinema showing The Death of Stalinism in Bohemia 1 second from now;en
Please shoe me the movie schedule for today.;en
Which movie theatre with Clean and Sober is closest to me?;en
What is the movie schedule for the B&B Theatres;en
Is A Charming Man playing at lunch time?;en
Where can I watch Gaddar: The Traitor?;en
List the movie schedule for Regal Entertainment Group theater.;en
What is the movie schedule near me?;en
What films are playing now at the closest movie house?;en
find a cinema closest with animated movies;en
what movie house is the closest playing animated movies;en
Where is My Dearest Enemy playing;en
What movie times start in 22 seconds at Magic Johnson Theatres;en
When is That Forward Center Died at Dawn playing at the closest cinema?;en
Is The Big Job playing at the nearest cinema?;en
I'd like to see showings for All the Way Home at Kerasotes Theatres.;en
What are the current movie schedules for AMC Theatres?;en
Where is the nearest movie house that is showing The Kingfisher Caper?;en
what's the nearest movie house showing films;en
Find me showtimes for animated movies in the neighbourhood.;en
What time is Holiday Heart showing at the movie house;en
what animated movies are at the nearest movie house;en
Where is the closest cinema playing Good Night Good Morning;en
Please give me the movie schedules.;en
Is Blood Is Not Fresh Water playing at this movie theatre at 2 AM?;en
Please check the movie schedule.;en
Please check whether any animated movies will be running in the area around 04:34:15 PM.;en
What time is Tommy and Quadrophenia Live playing at Marcus Corporation;en
around here find movie schedule for films;en
What time is Cold Prey 3 playing at cinema;en
what animated movies are showing in the neighborhood ;en
Find movie times.;en
What time is Summer School playing?;en
I need to see a list of films and movie times in the area ;en
What are the movie times for animated movies playing close by;en
Is Storm Warning playing;en
Where is the nearest movie house that is playing Sirivantha;en
Find Secret Command.;en
find Blood and Bones;en
find Brandy in the Wilderness;en
when is Red Shirts showing at Dickinson Theatres;en
what animated movies are at Fox Theatres;en
Is Holy Matrimony playing at National Amusements?;en
find the nearest animated movies at a movie theatre;en
what time is Bordertown Trail showing;en
what films are at Cinemark Theatres;en
Which movie house is playing Snow in the Desert today?;en
What time is Swarna Trishna playinh at Loews Cineplex;en
Find the schedule for Chronicle of My Mother at the nearest cinema in 1 minute and 8 seconds.;en
find nearby films with movie schedules;en
I'd like to see Snowball Express;en
Find the movie schedules for movies close by;en
what time is Mulawin: The Movie showing at the nearest movie house;en
Find the movie schedules for nearby movies.;en
Whens the next showing of The Game of Their Lives;en
what time can i see The Conflicts of Life;en
Find the schedule for movies at Southern Theatres.;en
Show the movie schedule;en
Find the closest movie house that plays animated movies;en
Find movie times for nine PM.;en
What is the movie schedule for movies in the neighbourhood ;en
Find movie schedules.;en
find movie times;en
What animated movies are playing now in the neighborhood ;en
Can I get the movie schedules for Marcus Corporation.;en
Find the movie schedules for films in the area.;en
will Dick Tracy e il gas misterioso start twenty one hours from now;en
show me the movie schedule in the area near my home at seven AM for animated movies;en
When is Romance on the Range playing at movie house?;en
What time is The Mourner playing at the movie house?;en
Find a movie schedule.;en
Is The Tender Years at the nearest movie theatre;en
What are the movie times at Goodrich Quality Theaters?;en
Is The Passion of Anna playing four seconds from now at the cinema;en
What films are playing now at the General Cinema Corporation;en
Give me the schedule for Getting There: Sweet 16 and Licensed to Drive;en
what time is Achilles and the Tortoise showing;en
where is Puthri playing;en
What are some movies playing in the neighbourhood?;en
find Mysterious Castles of Clay;en
What movie theatre is playing Sherlock Holmes and Dr. Watson fifteen hours and one minute from now;en
what animated movies are in the neighbourhood;en
Check the movie timings for Cracked Nuts at Southern Theatres.;en
What films are in the neighborhood;en
What is the movie schedules at for Douglas Theatre Company at 0 p.m.?;en
What films are there being played at Megaplex Theatres?;en
What time is Showcase Cinemas playing Straight Is the Way;en
Give me the movie schedule for the Great Escape Theatres;en
whats the closest movie house showing Medal of Honor;en
I need a movie schedule for nearby animated movies;en
Where is Feast II: No Limit playing;en
What time is are movies at the closest movie theatre;en
Where and when is Douglas playing?;en
Can I go see Cash and Curry at a movie theatre?;en
what animated movies are showing in the neighborhood ;en
find a cinema closest with animated movies;en
What time is Crush and Blush playing at Kerasotes Theatres;en
I'm wondering if you can give me the movie times for films in the neighborhood.;en
Is A Master of Craft playing at Wanda Group;en
find the nearest movies at a movie theatre;en
I want a list of showings of Days of Fire at Harkins Theatres;en
i want the movie schedules for movies around here;en
Find a movie schedule.;en
what films are showing in the neighbourhood ;en
What movies are playing at AMC Theatres?;en
show the movie schedules and films in the area;en
Let me know when The Maiden Danced to Death will be screened at a cinema.;en
find films scheudle in the neighborhood at 2;en
What time is Mighty Morphin Power Rangers: The Movie at Magic Johnson Theatres?;en
What time does Kraken: Tentacles of the Deep play;en
Show me movie times at the Pacific Theatres for the movie The Hot Rock;en
What film is playing at Landmark Theatres;en
where is The Chief Cook playing;en
find Invisible Child at Southern Theatres;en
show me movie times at my local theater.;en
find Heat Wave;en
Is The Right to Strike playing at Star Theatres;en
What time is A Battle of Wits starting?;en
Which animated movies are being screened at Marcus Corporation?;en
I'd like to watch movies close by;en
At AMC Theaters what is the movie schedule?;en
Is Amco Entertainment showing Cień Caseya today?;en
What films are playing at the closest cinema;en
Find the movie schedule for ArcLight Hollywood.;en
can i have the movie schedule for IMAX Corporation;en
find movie schedules;en
I'd like to watch movies now right nearby;en
I'd like to watch May Blossom;en
She me movie times at Mann Theatres;en
Which animated movies are playing at Megaplex Theatres at tea time?;en
What movie times are around here playing animated movies;en
Can I get the showtimes for films at the closest movie house.;en
find Plitt Theatres movie schedules;en
find animated movies movie schedule in the neighborhood;en
when does Miss Sloane play at IMAX Corporation;en
Find the movie schedule for Dipson Theatres.;en
Show movie schedules with movies in the neighborhood;en
When is the next showing of Star Wars: The Clone Wars?;en
What is the movie schedule for animated movies in the area;en
What movie theatre is palying The Hurricane five hours from now;en
what films are playing at the closest movie house ar elevenses;en
What movies are in the neighbourhood ;en
Tell me what films are playing at Plitt Theatres;en
What animated movies are at the closest movie house near brunch;en
Give me movie times for Regal Entertainment Group;en
Show movie schedule and movies in the area;en
What movie times are there for 5 p.m.?;en
What is the movie schedule looking like;en
What animated movies are playing AMC Theaters;en
show me the schedule of movie Michel Strogoff;en
Can i get the showtimes for movies around here?;en
What time is A Man for Burning playing;en
11 seconds from now find a cinema with First Monday in October;en
find a Loews Cineplex with films;en
What time is cinema playing The Village Priest?;en
What films are there playing at Cobb Theatres?;en
Find the movie schedule.;en
Which films are playing in the neighbourhood?;en
List movie schedules for movies playing close by;en
find the closest starting now movie house with animated movies;en
Where can I find Paranormal Activity 3 playing near me 1 hour from now;en
what time is Company Men showing;en
What is the movie schedules;en
What are the movies scheduled to play at General Cinema Corporation;en
find animated movies in the area;en
find The World Is Ours at a movie theatre;en
show me movie times;en
find Vegucated starting at zero pm;en
What is the movie schedules for animated movies in the neighbourhood;en
What's the closest movie theatre that's showing Dough Nuts?;en
Find the movie schedule for films in the area.;en
What is the nearest movie theatre showing Ocean’s 13?;en
I need the closest movie theatre playing Incense for the Damned.;en
Please tell me the movie times  ;en
find animated movies at the nearest movie theatre;en
Find the movie schedule for close by films.;en
Find the schedule for Kingsman: The Secret Service at a movie theatre.;en
Show me the movie schedule for nearby movies.;en
Where is the closest cinema playing A Drink in the Passage;en
i want to watch Ghosts of the Abyss at Kerasotes Theatres;en
What films are showing at the closest movie theatre?;en
Where is the nearest cinema that is playing The Kid Brother;en
What is the nearest movie house playing Black Scorpion;en
Tell me the movie schedules;en
is The Sleeping Beauty playing at 8 A.M.  at Cobb Theatres;en
when can i see We and Our Mountains;en
Is The Young Guard playing at the closest cinema;en
Is The Strange Case of the End of Civilization as We Know It playing at the movie theatre;en
What movie schedules are at National Amusements;en
Is The Swan available to watch at the movie house now?;en
What time will the movie house be showing On the Beat;en
What time is High Tide at Noon showing;en
Show me the current movie times;en
where is The Yellow Star: The Persecution of the Jews in Europe 1933-45 playing;en
Show the latest animated movies movie times for the nearest movie house;en
