expression;language
find films at Magic Johnson Theatres;en
Find me the movie schedules at Fox Theatres;en
show me the schedule of Outlaw of Gor at nearest movie house at 5 A.M.;en
show movie times now;en
When is Twentynine Palms playing at Plitt Theatres?;en
Let me know what animated movies are playing around here.;en
What animated movies are playing nearby right now?;en
find Regal Entertainment Group animated movies;en
Find the schedule for The Nightmare six hours from now at the nearest cinema.;en
I want to see The Happy Thieves at Marcus Corporation, can you show me movie times.;en
What animated movies are in the neighbourhood ;en
Find the movie schedule for Great Escape Theatres.;en
Where is the closest movie theatre playing Yo, robot;en
What time are films showing in the neighborhood;en
Tell me the closest movie house playing Black Rage;en
Show me the movie times at Star Theatres;en
find a movie house for Kickboxer 5 – Redemption;en
what animated movies are playing at the closest movie house;en
Where animated movies does North American Cinemas feature;en
What are the movie schedules;en
show movie times for AMC Theatres;en
where is The Cycle playing;en
find movie schedules for Loews Cineplex;en
What time is Southern Theatres showing Ukraine Is Not a Brothel?;en
show me the schedule of films in the neighbourhood;en
what time can i see Mojave Phone Booth;en
when is Our Story showing next at North American Cinemas;en
find Endless Horizons;en
Show me the nearest movie house showing He Won a Ranch;en
What times will animated movies be showing nearby?;en
what time is The Dungeonmaster playing at AMC Theaters;en
movie schedules at AMC Theaters;en
Where the The Housemaid playing and when;en
Find the schedule for Wenn Lucy springt now at a movie theatre.;en
What films are playing at Pacific Theatres;en
Find movie schedules at IMAX Corporation;en
are there any movies playing around here;en
find films in 12 hours at the nearest movie theatre;en
Find movie schedule for animated movies in the area;en
List movie schedules;en
Can I get the movie times for films in the neighborhood?;en
What time is The Riders of the Whistling Skull playing at Magic Johnson Theatres;en
What movies are playing nearby?;en
What theater is showing From Paris with Love and when?;en
Where can I find the movie schedules?;en
find movie schedules for AMC Theaters;en
give me the movie times;en
Find the movie times for nearby films.;en
Where will The Blonde from Peking be playing;en
What is the movie schedule for movies in the neighborhood;en
find The Dead Matter at Speakeasy Theaters;en
what movies are playing at Warren Theatres;en
in the neighbourhood find movies;en
Can I get the newest movie schedule in the area  for animated movies?;en
what are the movie schedules?;en
What time is The Burning Season playing;en
Find time for films at the North American Cinemas;en
find movie schedules for Dickinson Theatres;en
Find the movie times for North American Cinemas.;en
What are the movie schedules for animated movies playing in the neighborhood;en
What are the movie schedules for animated movies close by;en
Where can I see animated movies that's nearby?;en
Find the schedule for films in the neighborhood.;en
Please tell me the movie schedules?;en
What are the movie times for Megaplex Theatres;en
Find the schedule for To Shoot an Elephant at the nearest movie theatre.;en
Find movie schedules for  United Paramount Theatres.;en
Find the schedule for Evening Clothes in 1 second.;en
show movie times;en
what films are playing at the nearest movie house;en
What time is Dive Bomber playing;en
Find the movie schedules for Speakeasy Theaters.;en
Find movie schedules.;en
Is Prophecy playing at Malco Theatres;en
Find the movie schedules for Consolidated Theatres.;en
When is Harassed being played at Plitt Theatres?;en
What movies are playing at Mann Theatres;en
find 16 starting time for Heavenly Body;en
What are the movie schedules for Kerasotes Theatres;en
What movies are playing in the area?;en
What is the movie times at Marcus Corporation;en
Show me when Scandalous John is playing.;en
Let me have the movie schedules for General Cinema Corporation;en
show me the schedule of The Loves of Letty in cinema closest;en
When is Lake City playing at Dipson Theatres?;en
When is Em4Jay playing at the movie theatre?;en
I want movie times for Fox Theatres;en
Show me the new showings for animated movies in the neighborhood;en
Show the movie schedule;en
What films are playing at 11 A.M. at Dickinson Theatres;en
When is Bless the Child playing at the movie theatre;en
What time is The Brat playing at the movie house?;en
show me movies in the area;en
Find movie schedules for Star Theatres.;en
What is the nearest movie theatre playing Kate y Leopold?;en
What is the movie schedule for animated movies in the area;en
find movie times;en
What are the movie schedules at ArcLight Hollywood;en
show me movies in the area;en
find films at Showcase Cinemas;en
What are the movie times for films playing nearby;en
Which films are playing at the closest cinema?;en
Find the movie schedule.;en
Show me the movie schedules for any animated movies playing close by?;en
find start time in 12 seconds for National Bomb;en
Find me the movie schedule for Great Escape Theatres;en
what movie is at Loews Cineplex Entertainment;en
give me the showtimes for Down Where The Buffalo Go at Amco Entertainment;en
Can I get the showtimes for The Scarlet and the Black  at 12 pm.;en
What times will The Young Swordsman be showing at a local cinema?;en
Show the movie times;en
Show me the films at the closest cinema;en
What are the movie times at Landmark Theatres;en
what movies are at the nearest movie house;en
When is The Pirate Fairy playing at AMC Theaters?;en
Show me the movie schedules for the nearest movie theatre in Invasion U.S.A..;en
Tell me the movie schedules for Mann Theatres;en
find Alamo Drafthouse Cinema with animated movies;en
whats the closest cinema showing Swamp Water;en
What is the movie schedule 1 second from now;en
what day does the movie Star of the Circus play at ten PM;en
What movies can I see in the area?;en
can i get the movie schedule for Goodrich Quality Theaters;en
show movie schedules for animated movies playing close by now;en
Can i get todays showtimes for Le Flic de Beverly Hills 2?;en
I want to see movie schedules at Plitt Theatres.;en
When is The Naked Eye playing at the closest movie theatre;en
fimd films around here;en
What time are the animated movies starting at the nearest movie house?;en
show movie schedules for animated movies in the neighbourhood;en
What time does the next movie play around here;en
Fine movie times for animated movies in the neighborhood.;en
find movie times for movies in the neighborhood;en
find movie times;en
What is the movie schedule at Loews Cineplex Entertainment;en
I'd like to watch films at the nearest cinema at 8 am;en
Find time for movies at the closest cinema;en
When is Scaramouche playing?;en
find a nearby movie schedules for movies;en
Find movie times.;en
Can i get the movie schedule for Megaplex Theatres.;en
whats the movie schedules for General Cinema Corporation;en
find Half a Truth;en
What is the movie schedule for movies close by;en
What is the AMC Theaters movie schedule?;en
Find movie schedules.;en
Show me the movie times for animated movies that are in theaters close by;en
find the closest movie theatre with animated movies;en
What time is The Face in the Moonlight showing?;en
can I get the movie schedules for Goodrich Quality Theaters;en
What are movie times for movies playing in the neighborhood?;en
I'd like to watch movies at the nearest movie house;en
What films are at National Amusements;en
in the neighborhood find movie times for movies;en
find the nearest movie house for The Mystery of Picasso;en
when can i see Red Hot Tires;en
Which movies are showing at Southern Theatres?;en
What time are animated movies playing in the area ;en
What is the movie schedule for movies close by;en
what time is One Night Stand showing at Cineplex Odeon Corporation;en
Tell me what animated movies I can see at the closest movie theatre;en
Is A Man Called Hero playing during brunch at the cinema;en
Please find me the movies playing nearby;en
What time is Goodbye Mothers playing?;en
show me movie schedules;en
Check the movie schedules.;en
What films are playing at Marcus Corporation?;en
Find the movie schedule for ArcLight Hollywood.;en
Where is the closest cinema playing Osmanthus Alley;en
Is the Wandering Detective: Black Wind in the Harbor playing at Cinemark Theatres;en
in the neighbourhood find movies;en
I'd like to watch movies at Amco Entertainment;en
I'd like to see movie times at Santikos Theatres;en
show movie schedules;en
When is Youth Without Youth being shown at the nearest movie house?;en
Please tell me movie times;en
Is A Short Film About Killing at North American Cinemas;en
Show the movie schedule at Regal Entertainment Group;en
Find the schedule for Ghost World.;en
what's the closest movie house showing Night in May;en
find the closest showing of The Taste of Others at a cinema;en
What animated movies are showing in the area?;en
What time are movies showing at Megaplex Theatres;en
Can I get the newest listings for movies at Harkins Theatres;en
find National Amusements showing The Sea Is Behind;en
What is the nearest movie theatre playing The Collaborators;en
When is Eye of the Spider playing at Regal Entertainment Group?;en
Find the movie schedule for animated movies in the area.;en
What films are playing at 1 PM at Showcase Cinemas;en
Is The Happy Hooker Goes Hollywood at the movie house nearest me;en
Find the schedule for movies at the nearest cinema.;en
I'd like to watch In High Places;en
Can I see movie schedules for movies this evening in the neighbourhood?;en
what movies are around here;en
Show me movie times at MJR Theatres at 02:39:23 pm;en
What is the local movie schedule;en
When is The Blood of Others playing?;en
show animated movies in nearest movie theatre;en
Is Rio Belongs to Us playing at the movie house closest to me;en
what movie theatre is showing Titanic: The Legend Goes On;en
what animated movies are playing at Fox Theatres;en
find the nearest movie theatre for animated movies;en
find a movie schedule for United Paramount Theatres;en
is Tomorrow at Dawn at Harkins Theatres;en
show movie schedules for Fox Theatres;en
What is the movie schedule for films that are playing nearby in 15 minutes;en
What is the closest cinema today playing animated movies?;en
Give me some movie schedules.;en
show movie schedules close by movies;en
Give me the schedule for What a Wonderful Place at Cinemark Theatres;en
Find me showtimes for How I Unleashed World War II.;en
Are there any films around here;en
Where can I get movie schedule;en
Find the schedule for for close by movies.;en
Is And the Ship Sails On playing at Douglas Theatre Company 1 minute from now?;en
I'd like to watch Take This Waltz;en
find animated movie at Landmark Theatres;en
Find me the showtimes for How to Commit Marriage.;en
What is the movie schedule for the North American Cinemas;en
find movies that are nearby;en
can i have the movie schedule for right now;en
Is The Missing Clerk playing;en
I'd like to watch movies at the closest movie theatre;en
Find movie schedules.;en
Find time for Enkitta Mothathe at Pacific Theatres;en
I'd like to watch Demolition Man at 11:09 PM;en
What are the movie schedules;en
I'd like to watch films at the closest movie theatre ;en
What is the movie times;en
What are the movie schedule now;en
Give me the current showtimes for Tarass Boulba.;en
Let me see the movie schedule for Seed of Chucky;en
Show the movie schedule of animated movies close by;en
Is the start eim 23 hours twenty one minutes and one second from now for Morgan – A Suitable Case for Treatment at Santikos Theatres;en
Which films are playing at the IMAX Corporation?;en
What movies are playing at the nearest movie house;en
What animated movies are at Dipson Theatres;en
What is the movie schedule for animated movies playing in the neighborhood?;en
what films are showing in the neighborhood ;en
What films are playing at Great Escape Theatres;en
What are the movie times for movies in the area?;en
What is the nearest cinema playing The Oak;en
what is the movie schedules for animated movies nearby;en
Give me showtimes for The Tenth Woman at the movie house.;en
what movies are showing nearby;en
Show the movie schedule;en
Show films at the nearest cinema;en
When is Heat playing near me?;en
I'd like to watch The Freckled Fish at 00:47:43 at Magic Johnson Theatres;en
Are there any animated movies playing at the Mann Theatres?;en
What time is Sontha Ooru playing;en
find Three in the Attic;en
Advise me on the movie schedule of films that will be playing at 07:31:32 pm at a place close by.;en
find The Panic in Needle Park;en
Does The Yacoubian Building start at 08:39 pm;en
What time is Chandranath playing MJR Theatres;en
Where is Priorities on Parade playing;en
What animated movies are playing at KB Theatres;en
Are there any movies playing at 5 am at North American Cinemas?;en
What time is Adam at Six A.M. playing;en
find Lost in Space;en
find movie times;en
What time is The Christmas Toy playing at Loews Cineplex;en
Show movie schedule at Amco Entertainment;en
Find the movie schedule for animated movies in the neighbourhood.;en
where is The Adventure of the Yellow Curl Papers playing;en
I want to see the local movie times;en
What is the closest movie theatre that is playing animated movies;en
where can i watch Key to the City;en
Give me the movie times for Fox Theatres;en
Find out what films are being played in the neighbourhood;en
What is the movie schedule for today?;en
I want to watch Looney Tunes Platinum Collection: Volume 1 at a movie theatre;en
show nearest movie theatre to watch Black Jesus;en
What time is a movie in the neighbourhood;en
Can you tell me what time The Fickle is playing at the closest cinema;en
what films are on the movie schedule for ten at a close by theater;en
What time is The Phoenix Project playing;en
What animated movies are around here;en
Give me some info on when Hands Across the Border will be laying at the cinema.;en
Please find the schedule for Jappeloup at Bow Tie Cinemas.;en
What animated movies are playing at the nearest movie theatre?;en
Show me movie schedules for today.;en
Is Fighting With Buffalo Bill playing at the closest movie house;en
what's the movie schedule at National Amusements;en
is The Singing Nun at Regal Entertainment Group;en
Fine movie schedules for Speakeasy Theaters.;en
when are animated movies playing at Goodrich Quality Theaters;en
Find movie times for Alamo Drafthouse Cinema at 10:37 P.M..;en
Find the schedule for The Band of Honest Men at the nearest movie theatre.;en
What is the movies playing at North American Cinemas;en
What movies are playing at Marcus Corporation?;en
find a movie theatre with Rogues and Romance that is nearest;en
Will you show me a schedule for movies around here?;en
Show me movie times for animated movies playing three hours from now in the neighbourhood.;en
I'd like to watch Wish You Were Dead;en
What movies are playing at the closest cinema;en
Find the movie schedule for 20:45:24.;en
Give me the showtimes for Sign of the Anchor.;en
What time is Last Exit to Brooklyn playing at movie house?;en
Is The Angel of Vengeance – The Female Hamlet playing at the cinema at 6 am;en
Can I get the movies  showtimes for the closest movie house.;en
What time is The Toll of the Sea playing;en
what animated movies can i see at Malco Theatres;en
Where is the nearest movie theatre that is playing Honeysuckle Rose;en
Is Live from Sturgis 2006 playing at four o'clock at the nearest cinema?;en
Please show me the movie schedule for animated movies playing in the neighborhood.;en
find The Broken;en
What time is Sontha Ooru playing;en
what kind of films are at the closest movie house;en
Give me the movie schedule for Cineplex Odeon Corporation;en
When is Old Enough showing at the movie house?;en
What theater is playing Haunted Honeymoon ;en
find movies in the neighbourhood with movie times;en
When will The Boys Next Door be playing at the nearest  movie house;en
Find the schedule for films at night at Great Escape Theatres.;en
what animated movies are showing nearby;en
What are the timings for Starship Troopers 2?;en
Find movie schedules for ArcLight Hollywood.;en
when can i see A Handful of Dust in a movie theatre;en
Find the schedule for films at the Douglas Theatre Company.;en
Give me a list of films at AMC Theatres;en
Find the schedule for animated movies in the area.;en
Show me the movie schedules for movies playing nearby.;en
Find the schedule for The Devil Diamond at a movie theatre.;en
I'd like to watch films in 23 hours in the neighborhood;en
What are the showtimes for Boy of Mine;en
What are the movie schedules;en
What time is AMC Theaters playing Unnikrishnante Adyathe Christmas;en
I'd like to see the current showtimes for His Kind of Woman;en
Can you give me the movie schedules at Mann Theatres?;en
What's the closest movie house that's showing animated movies?;en
what animated movies are at Cobb Theatres;en
find movie times;en
What movie times are at Bow Tie Cinemas?;en
Need the closest movie house playing The Flamingo Rising;en
Show me movie times for one minute from now;en
find Kerasotes Theatres movie schedules;en
Find the schedule for Fear Chamber.;en
Is The Butcher Boy playing anywhere at supper time?;en
is One Night Surprise at the cinema;en
Give me movie times;en
Find movie schedules.;en
Show me the movies at the closest cinema;en
Is The Day of the Beast playing at three p.m.?;en
What time is Death Nurse showing;en
what animated movies are at the nearest cinema;en
What is the movie schedule for films in the neighbourhood;en
Show me the current movie times;en
Is Live Forever: The Rise and Fall of Brit Pop playing at the closest cinema in 1 minute;en
show movie schedules;en
When is The Blood Stain playing at the movie house?;en
find The Swindlers at the closest movie house;en
List movies for nearest movie house at brunch time;en
Find the closest cinema playing The St. Francisville Experiment.;en
Find movie times for close by movies.;en
What movie house is playing Something for the Birds;en
What Pacific Theatres are playing animated movies;en
Show me movie time for I Am Sorry  at my movie house;en
When is For One Night playing at Loews Cineplex Entertainment?;en
What are the movie schedules;en
Can you let me know when Troopers Three is scheduled?;en
Give me a list of movie times for films in the area.;en
where is My Song Goes Forth playing;en
is The Couch Trip at the nearest cinema;en
Fine movie times.;en
Check movie schedules and find which animated movies are being aired in the neighborhood movie halls.;en
What time is Scream of Stone playing;en
find Dipson Theatres with Swiss Army Man at 8 p.m.;en
I'd like to watch movies at the closest movie theatre;en
Where can I watch Hank Williams: The Show He Never Gave?;en
Find the movie schedule for B&B Theatres.;en
What time are movies showing around here;en
What animated movies are playing at the closest cinema;en
What is the local movie schedule;en
What time is Living Is Easy with Eyes Closed playing;en
Showtimes for animated movies fro Goodrich Quality Theaters.;en
Where is Road to the Stage playing;en
What movies are scheduled in the neighbourhood?;en
Find movie times for B&B Theatres.;en
Show a movie schedule with Bow Tie Cinemas;en
Show the movie schedule;en
Is Black & White: The Dawn of Justice playing at the movie theatre?;en
Show me the films currently playing at the nearest movie theatre;en
show me the schedule of American Primitive in Santikos Theatres;en
show the animated movies playing at Consolidated Theatres;en
What are the movie schedules;en
what is the movie schedules for movies in the area ;en
What movies are playing at Cineplex Odeon Corporation?;en
Show me the movie times for films nearby.;en
is Traffic at the movie theatre;en
find a movie schedule in the neighborhood for films;en
showings for animated movies in the area ;en
What time do the movies play at Southern Theatres?;en
What time is I Know That You Know That I Know lpaying;en
Find the movie schedule for Pacific Theatres.;en
Give me a list of films that play in the neighbourhood;en
find Death Is Called Engelchen at Neighborhood Cinema Group;en
find animated movies at the nearest movie theatre;en
find A Feather in Her Hat at Magic Johnson Theatres;en
I'd like to go to Douglas Theatre Company to see In Beaver Valley, what times will the movie be playing?;en
What movie schedules are animated movies close by;en
Find a movie schedule.;en
Check the movie schedule for Wanda Group;en
Find me the nearest cinema that have movies starting right now.;en
Where is They Always Return at Dawn playing;en
What films are playing at Dipson Theatres and when ;en
Find me the movie times for the Alamo Drafthouse Cinema;en
When is The Third Eye showing at Dickinson Theatres?;en
What time is High Schools playing;en
What time is The Bride’s Journey playing at Star Theatres?;en
Find the schedule for Heart Beats.;en
Show movie times and movies in the area;en
Where is the nearest movie theatre playing The Sword of Many Lovers?;en
What movies are playing at the closest movie theatre;en
What time is Project Censored the Movie playing at the movie house;en
When is Beyond My Reach scheduled at the nearest cinema?;en
What time is The Lottery Man playing?;en
I'd like to watch Abbott and Costello Meet the Keystone Kops at Amco Entertainment at 04:08:11 AM;en
What time is Always Brando showing;en
What are the movie schedules for movies around here?;en
What are the local movie times;en
i want to see Love, Speed and Thrills at the nearest cinema;en
find a movie schedule;en
in the neighbourhood find movies starting in thirteen hours;en
Show me the films close by and the movie times for today.;en
what animated movies are showing at Star Theatres;en
Is the start time 15:16:52 for movies in the neighborhood ;en
is Unbeatable Harold at Century Theatres;en
Is Romulus and the Sabines playing at the nearest cinema at ten;en
find Manthra Mothiram at Century Theatres;en
Find the movie schedules;en
Is this film going to be at Malco Theatres?;en
find a movie house closest showing Operation: Kingdom;en
show me the schedule of films in Cobb Theatres;en
Find the movie schedule.;en
I'd like to see the showtimes for Silly Movie 2.0 at the movie house;en
Where is the closest movie house playing films now;en
Find movie times.;en
When is The Blue of Heaven playing?;en
Where is the nearest cinema that is playing Pioneers of the West;en
What do the movie schedules at B&B Theatres look like?;en
I'd like to see the movie schedule for movies in the area;en
Show me the movie times;en
find the closest films at a movie house;en
Whaere is Bloody Bloody Bible Camp playing in the cinema;en
find Santikos Theatres showing animated movies;en
When does Of Stars and Men play?;en
Where is the closest cinema playing Soapsuds and Sapheads;en
I'd like to see the movie schedule for movies in the area;en
What are the showtimes for Beware! The Blob at Plitt Theatres?;en
Where is the nearest movie theatre that is playing The King Maker;en
find Quiet Night In;en
can I get the showings for films at the nearest cinema in 1 minute ;en
Can you give me a local and current movie schedule ;en
Show movie times of movies in the neighbourhood;en
What is the movie times for General Cinema Corporation;en
in the neighbourhood find movies with movie times;en
Show me the movie schedule for Caribbean Cinemas;en
is Ce cher intrus at IMAX Corporation;en
movie schedule at Cinemark Theatres;en
What movies are showing at the nearest movie theatre in 8 minutes?;en
is The Slut playing at 07:27 A.M. at Harkins Theatres;en
What are the movie schedules for movies showing in the neighbourhood?;en
Will you please pull up movie schedules for me?;en
I want to know what movies are showing at the nearest movie house.;en
Give me the movie listings at the closest cinema please.;en
find movie schedules;en
Find the schedule for Grand Canyon Trail.;en
find close by movies movie times;en
I want the nearest movie house with The Debtors;en
When will the Blonde Ambition be playing;en
find a movie house for 07:52 showing Ganges: River to Heaven;en
find a movie theatre with Intersections that is nearest;en
what time is Bhoot Returns showing at Douglas Theatre Company;en
show movie schedule for animated movies in the neighborhood;en
Which animated movies are playing today at KB Theatres?;en
Find the movie schedule for films in the area.;en
I'd like to watch Bound for Glory at the closest movie theatre at 21:41:08;en
What time is The Queen of Moulin Rouge playing?;en
What time is Trouble Every Day playing;en
There can I find The Beggar Maid playing;en
find movie schedules;en
What films and movie times are close by;en
please give me the movie schedule;en
find the closest movie theatre for films;en
Show me the movie times for animated movies in the area .;en
What cinema has the closest movies;en
When can I watch Alice: A True Story at AMC Theatres?;en
Find time for The Thirty Nine Steps ;en
Find the movie schedule.;en
Is The Little Irish Girl playing;en
Show me the movie schedule for movies opening today close by;en
give me the Morning movie schedules;en
