expression;language
Find time for Trouble for Two in one minute at Landmark Theatres;en
find the closest cinema with animated movies;en
show me the schedule of movie times;en
Where and at what time can I see Paragraphe 78;en
Can I get the movie times for the newest movies around here?;en
What films are at Cineplex Odeon Corporation;en
What's the closest cinema playing Chuckys Baby now?;en
find films with movie schedules that are nearby;en
What movie times at Megaplex Theatres;en
What is the nearest movie theatre playing Kate y Leopold?;en
What movies will be showing around here?;en
show movie schedule of films in the area;en
find Afternoon movie times for movies in the neighborhood;en
What is the closest movie house playing What the Swedish Butler Saw;en
Can you tell me the movie schedule for General Cinema Corporation?;en
what's the nearest movie house showing Their Last Love Affair;en
find a Consolidated Theatres showing The Good Old Naughty Days;en
show movies in United Paramount Theatres;en
What are the movie times for films playing in the area?;en
Find the schedule for Salt of the Black Earth at the closest movie house.;en
When is Janeane from Des Moines playing at the nearest movie theatre?;en
what's the closest cinema showing animated movies;en
Can I get the movie schedules for Landmark Theatres.;en
where can i watch animated movies around here;en
can you give me the movie times;en
Find the movie schedules at Magic Johnson Theatres;en
I'd like to watch The Holy Office at Cooper Foundation;en
find Dickinson Theatres showing From Bondage to Freedom;en
What cinema is The Railway Children;en
Show movie schedules at AMC Theaters;en
What films are showing in the neighbourhood?;en
What time is movies playing around here;en
What is the nearest cinema playing Romance of the Limberlost;en
what films are at the closest movie theatre ;en
find a movie theatre with animated movies that is closest to me;en
I'd like to watch Broadway Nights at Megaplex Theatres;en
I'd like to watch films at Marcus Corporation at twelve P.M.;en
List movie times at Harkins Theatres;en
Show me movie times  at Harkins Theatres.;en
find animated movies at Caribbean Cinemas;en
show the schedule of movie The Statue;en
find Kerasotes Theatres showing animated movies;en
Give me the showtime for Bobby Yeah playing at the cinema;en
What time is film showing at Southern Theatres;en
She me movie times;en
where can i see animated movies in the neighborhood ;en
Where does The Return of the Whistler play at the Bow Tie Cinemas at 03:01:48 A.M.;en
What films are playing at the nearest movie theatre;en
give me the movie schedule at Santikos Theatres;en
What is the closest cinema with animated movies;en
I'd like to watch The Utopian Society;en
show the movie schedules in the neighborhood for animated movies;en
find meal time movie times close by for movies;en
Go to movie times at IMAX Corporation;en
when is Good Will Evil playing at Loews Cineplex Entertainment;en
whats the nearest movie house showing animated movies;en
What time is The Bride from Hell playing at Malco Theatres;en
What time is The Night Before the Premiere playing at the movie house;en
What is the movie schedule for Loews Cineplex Entertainment;en
where is The Incite Mill playing;en
Find the schedule for The Tale of Sweeney Todd at seven o'clock.;en
What animated movies are showing in the neighborhood ;en
What are the Mann Theatres showtimes for Secret Sunshine;en
What time is The Secretary playing at the movie theatre?;en
What time is the Wanda Group playing The Honor of an Outlaw;en
Give me the movie schedules for National Amusements.;en
Show movie schedules for Marcus Corporation;en
What movies are playing in the area ;en
movie times at Cooper Foundation for sunset;en
Which films are playing at Consolidated Theatres?;en
whats the closest movie house showing Home Room;en
Is You Will Meet a Tall Dark Stranger at Bow Tie Cinemas;en
What is the movie schedule for Train;en
can i get the showtimes for films in the neighbourhood;en
She me movie schedules for the movies close by at sunset;en
Show the movie schedules with animated movies around here;en
What time is Crawlspace playing at the Caribbean Cinemas;en
what time is The World According to John Coltrane playing;en
I'd like to know what movies are on the movie schedules nearby.;en
What time does Lilacs in the Spring play at the closest movie house;en
Find movie schedules for movies in the area.;en
Where is The Wilderness Trail playing;en
find Worldly Goods starting now at a movie house;en
what's the closest movie house showing animated movies;en
Tell me what movies are showing at seven am at the closest movie house.;en
Where and when is Unleashed – Entfesselt playing;en
Is The Mystery of Betty Bonn playing at twelve A.M. at the nearest movie house?;en
Is People of the Cumberland playing at Landmark Theatres now;en
Show movie schedules for Douglas Theatre Company;en
What animated movies are on the movie schedule close by?;en
find National Amusements with Honey, I Shrunk the Kids;en
When is Sins of the Fathers playing?;en
When is You Walk So Softly playing at Kerasotes Theatres;en
find movie times for films close by;en
What movie theatre is playing The Missing Picture;en
What time is Kerasotes Theatres playing animated movies;en
Let me get the movie schedule for lunch time.;en
what movies are showing at Fox Theatres at 11 am;en
What is the movie schedules at Consolidated Theatres;en
find the closest movie theatre with films;en
Find the movie schedules for Great Escape Theatres.;en
Is A Tree Grows in Brooklyn playing in one hour;en
I want to see the movie schedule for KB Theatres.;en
whats the movie schedule for movies nearby;en
Are there movies at Malco Theatres;en
Find the schedule for Project Shadowchaser II at the cinema in eighteen hours.;en
Find the schedule for movies at Harkins Theatres.;en
What time is 26 Years Diary showing in the movie house?;en
What time is Balkan Rhapsodies: 78 Measures of War playing at Malco Theatres?;en
Which films are playing at Malco Theatres?;en
When are the movie schedules;en
Show the movie schedule and movies around here;en
Find the movie schedule.;en
What is the closest movie theatre showing In Pursuit of Honor?;en
I want to see King of the River in the nearest movie theatre;en
Give me the movie schedules for Neighborhood Cinema Group;en
What are the animated movies in the neighbourhood  for the recent movie times;en
What movies are playing Douglas Theatre Company;en
What animated movies are playing at the Magic Johnson Theatres;en
in the area find some films;en
I want to know the films playing at the closest movie house.;en
When can I see The Crew of the Dora;en
Is Warhead playing at AMC Theaters;en
find animated movies in the neighborhood;en
what movie theatre closest to me is playing animated movies and when;en
find the nearest movie house showing Good Morning, Babylon;en
Can I get the showtimes for The Man Who Could Talk to Kids?;en
find Belle of the Yukon;en
What time is The Message playing at Loews Cineplex?;en
What is the movie schedule for the movies that are playing nearby?;en
find movie times;en
What movie times are Harkins Theatres;en
give me the movie schedules for Warren Theatres;en
What movies are playing Dickinson Theatres;en
Where is the nearest cinema that is playing films;en
Find me Third Man on the Mountain at a cinema;en
I'm wondering when I can see Beating Heart at the nearest cinema.;en
find a movie schedule;en
find the movie schedule;en
Show me the schedule for ArcLight Hollywood for animated movies;en
Is The Angelus playing at the movie house at dinner time?;en
Is I Was an American Spy playing at 11 a.m. at Southern Theatres;en
what time is Twin Peaks: Fire Walk with Me showing;en
can I get the movie schedules;en
Find animated movies at Landmark Theatres at dinner time.;en
I'd like to see Forgetting the Girl.;en
When is The Prince Who Was a Thief playing at the cinema?;en
find Kerasotes Theatres with movie times;en
What movies are playing at the closest movie theatre;en
Showtimes for the Alamo Drafthouse Cinema for todays movies.;en
Tell me the movie schedules for Loews Cineplex Entertainment;en
Find movie schedules.;en
what animated movies are showing in the area ;en
What is the movie schedules for the Harkins Theatres;en
What AMC Theaters is The Red Dance playing at?;en
Find the schedule for nearby animated movies.;en
Where is The Beach of Lost Children playing;en
show me the schedule of movie Shadow of a Woman;en
find The Bride;en
Find movie times for animated movies in the area.;en
What films are showing at three o'clock at the Neighborhood Cinema Group?;en
find the nearest movie theatre with movies;en
show the movie schedule for 9 pm  at Cobb Theatres;en
find movie schedules in MJR Theatres;en
showtimes for the closest movie theatre that is showing Operation Autumn;en
What time is Class playing at Amco Entertainment?;en
Find movie schedules for movies around here at nineteen o'clock.;en
What time can I watch Son of Rambow Tonight at Fox Theatres;en
Show me the movie times for what's playing now;en
show me the movie schedule;en
find The Branded Woman;en
Is The Cycle playing at Consolidated Theatres?;en
What films are playing at the nearest movie theatre;en
what time can i see The Half Naked Truth;en
What is the closest movie house  playing films;en
Please find me the nearest cinema playing Foreign Intrigue.;en
Can I get the movie schedules for Megaplex Theatres?;en
What is the 7 A.M. movie schedules at Amco Entertainment;en
Show me movie schedule;en
Where can I see No Time to Die?;en
Is Jack the Ripper playing in one hour at the nearest movie house?;en
Where is White Bim Black Ear;en
Give me the schedule for animated movies at the nearest cinema;en
I'd like to watch Apocalypse 2024;en
What are the movie times for films nearby?;en
What films are playing at Goodrich Quality Theaters;en
find a cinema showing The Mandrake nearest at one o'clock;en
Is The Love Guru playing ;en
When is Longwave going to be playing?;en
What time is My Son Shall Be Armenian playing at Plitt Theatres;en
Show me the movie schedule for Neighborhood Cinema Group;en
Find movie times for films in the area.;en
Find the movie schedule.;en
What films are scheduled at the closest cinema?;en
Find the movie schedule for the Cineplex Odeon Corporation.;en
When is The Great Question playing at the closest movie house?;en
Is there a movie theatre showing Last Cab to Darwin today?;en
Find the schedule for The Tooth Will Out at sunrise.;en
What animated movies are playing at Pacific Theatres;en
What are the movie times for the Marcus Corporation;en
Find the schedule for Death Valley Manhunt.;en
i need movie times for movies in the area;en
What is on the movie schedule for four AM at Landmark Theatres;en
When is Ode to Billy Joe playing at the closest movie house?;en
What are the movie times at Goodrich Quality Theaters;en
Show me the animated movies starting at 10:56:18 a.m. at the nearest movie house;en
What is the movie schedules for movies in the neighbourhood;en
What's the movie schedule for animated movies in the neighborhood;en
What time around here can I fins animated movies;en
Show me animated movies that are playig at Great Escape Theatres;en
Which animated movies are playing in the neighbourhood ?;en
find a movie theatre with Beware of Bachelors;en
find Whosoever Shall Offend at Showcase Cinemas;en
I'd like to watch movies around here, can I see the movie schedules;en
What animated movies are playing in the area and what is the movie schedule;en
Show me movie times at Cooper Foundation.;en
What is the movie schedule like;en
I want to know the animated movies playing at Malco Theatres;en
show the movie schedule;en
I'm wondering what cinema is playing Peters baby.;en
What are the movie times at the Loews Cineplex;en
Is Redacted playing at the closest cinema?;en
When will Third Person Singular Number be playing?;en
show me the schedule of films close by;en
Can I get the movie schedules for Landmark Theatres;en
Can I get the movie schedules for Loews Cineplex?;en
Is The Country Doctor on the schedule at any theater near me?;en
what is the movie schedule of animated movies in the area ;en
I'd like to see movie schedules for animated movies around here;en
What is the movie schedule in five minutes for movies playing in the neighborhood ;en
Showtimes for the films at Santikos Theatres;en
Can you let me know the films that are on the movie schedules in the area at noon?;en
give me the movie schedule for films in the area ;en
I need to know what theatre is playing A Happy Coersion;en
Where is Among the Great Apes with Michelle Yeoh playing and when;en
find Andreas Hofer at elevenses;en
Can I get the Cineplex Odeon Corporation showings for Small Town Story?;en
Find the schedule for Brick.;en
Find a movie schedule for 12 hours from now.;en
What time is Exploits of a Young Don Juan playing?;en
Find the movie schedules for animated movies nearby at 09:44 am.;en
Is Gods of Metal playing;en
What is the movie schedule at Cineplex Odeon Corporation 12 hours from now;en
What is the films with movie times in the area;en
i want to watch The Shamrock Handicap right now;en
Will I be able to watch Camping-car at movie house at 6 pm?;en
What films are showing in the area?;en
Which movies are playing at the nearest cinema at twelve PM?;en
What time is 30 Days of Night playing?;en
Find movie times for Century Theatres.;en
Give me the local movie times.;en
I want the movie schedule for animated movies in the area ;en
What movies are playing at the closest cinema;en
When is Just Before Nightfall playing?;en
find Hear Me Good;en
What films are going to be playing at Harkins Theatres at zero a.m.?;en
What animated movies are playing in the neighbourhood and when?;en
Is Thenaruvi playing at the Douglas Theatre Company in one hour?;en
What films and movie schedules are in the neighborhood;en
What time is In the Crosswind playing at Marcus Corporation?;en
show movie times for movies in the area;en
whats the closest movie theatre showing animated movies;en
Can you let me know what animated movies are playing close by?;en
Can a I get the movie schedule for Sympathy for the Devil;en
Can you pull up a movie schedule for me?;en
Find the movie schedule at Malco Theatres.;en
I'd like to see movie times please.;en
What films are being shown at the National Amusements;en
What's the nearest movie theatre playing Testament of Orpheus?;en
find films closest to a cinema;en
Find time for movie times now;en
I'm wondering when I can see Hurry Sundown.;en
What films are showing at Cineplex Odeon Corporation?;en
Find the schedule for The Pearl of Cleopatra.;en
find a movie house showing Cage Without a Key;en
What film is playing nearby;en
What is the movie schedule right now for movies around here;en
Find the movie schedule for animated movies in the area.;en
ticket for The Perfect Man at Dickinson Theatres at 10 A.M.;en
Is Flow: For Love of Water playing at Southern Theatres at 2 am;en
movie schedules of movies in the neighbourhood at zero am;en
What are the movie times for animated movies nearby?;en
what films are showing around here;en
Which animated movies are playing at the nearest movie house?;en
Show me the closest 12 A.M. showing at a movie house of an animated movie;en
Can i get the showtimes for films at Dickinson Theatres?;en
Find me animated movies at Amco Entertainment tomorrow;en
What time is The Mailman playing;en
What movie theatre is playing The Magnificent Scoundrels;en
What is the movie schedule for the Pacific Theatres;en
Find the schedule for Without Witness twenty two hours from now.;en
Where is The Penthouse playing;en
find Un weekend da bamboccioni;en
Is The King of the Kitchen playing in fifteen hours?;en
Where and when is This Is England playing;en
What are the movie times for movies around here;en
When is The Stain playing at Loews Cineplex?;en
What is the movie schedule for any films playing close by at Sunset;en
When is Percy Jackson playing at the movie theatre?;en
What time is 楽園追放 -Expelled from Paradise-;en
What movies are showing at the Showcase Cinemas;en
I want to go see A Simple Noodle Story in seventeen seconds at Goodrich Quality Theaters.;en
Check films screened at the closest cinema;en
Find me the movie times;en
I want to see the movie schedule for North American Cinemas;en
show me the schedule of movie Thirty Two Short Films About Glenn Gould in 14 minutes;en
I'm wondering what movies will be laying around here.;en
What time are movies showing around here;en
Give me the showtimes for The Rum Diary at MJR Theatres at meal time.;en
give me the movie times for movies showing in the neighborhood ;en
What are the movie schedules for the Dipson Theatres;en
Can you let me know when Talk of the Devil is playing at the movie theatre?;en
Find the schedule for films at the closest movie house.;en
When can I see Journey to the End of the Night?;en
Can you pull up showings for Pop Goes the Easel at the local movie theatre?;en
Show me the movie times ;en
Find the schedule for Better This World at a movie house.;en
Can I see the movie schedules?;en
what animated movies are in the area;en
Which cinema can I go to to see Lilly the Witch: The Dragon and the Magic Book?;en
What movies are playing at the closest cinema;en
Show me the movie schedule for movies around here;en
where is Beyblade: Fierce Battle playing;en
where is Wild America showing at zero P.M.;en
show movie schedules;en
I want to see movie times at Neighborhood Cinema Group.;en
When can I see Salaam-e-Ishq: A Tribute To Love at B&B Theatres?;en
For the Star Theatres is The Belles of St. Clements playing in 8 minutes ;en
I need movie times in the area for any type of movies;en
What time could I see A Mile in His Shoes?;en
Find the movie times for Caribbean Cinemas.;en
What is Dear Old Girl Cooper Foundation;en
Is The Matinee Idol 06:30 cinema sold out?;en
Find the schedule for close by movies.;en
movie schedules for Neighborhood Cinema Group;en
Find the schedule for the closest films at a cinema at meal time.;en
Find the movie schedule for Cooper Foundation.;en
What time is In Old New Mexico showing today?;en
Find the schedule for Tube at the closest movie theatre.;en
Is The Mystical Adventures of Billy Owens playing at the closest movie house;en
Find the schedule for movies at Star Theatres.;en
When is Up the Yangtze playing at Goodrich Quality Theaters;en
Which Cinemark Theatres is playing A Is for Atom?;en
What time is Hold That Blonde playing at the closest cinema?;en
Where is the nearest cinema that has Southside 1-1000?;en
I'd like to watch Monk Comes Down the Mountain;en
What are the movie schedules for Santikos Theatres?;en
What films are going to be shown at the nearest movie house?;en
Find the schedule for The Solitude of Prime Numbers at the nearest cinema in 1 hour .;en
Find time for Hendthighelbedi at the nearest cinema;en
What are movie times for animated movies close by?;en
movie schedules for animated movies playing in the neighbourhood;en
show movie times of films close by;en
What time are the movie schedules;en
Find movie times for movies in the neighbourhood.;en
What are the movie times for animated movies in the area?;en
I'd like to see local movie times.;en
could you please show me movie schedules;en
I'm looking to watch Savage Grace at Showcase Cinemas at thirteen o'clock.;en
List movie schedule.;en
Find the schedule for movie times for movies around here.;en
list movie times with meal;en
i want to watch Mister Cool;en
Find the movie schedules for me;en
What time is Rites of Spring playing at Marcus Corporation;en
I'm looking for a movie schedule at the Cooper Foundation.;en
What time is Mon Amour: Shesher Kobita Revisited playing;en
Is Love Is a Ball playing right now?;en
show me movie times for Southern Theatres;en
What time is The Taking of Pelham 1 2 3 playing at the movie theatre;en
What movie theatre playing animated movies is the closest;en
Can I get the showtimes for animated movie in the neighbourhood?;en
What is the closest movie theatre that is playing Moment to Moment?;en
find a brunch time cinema nearest with The President Is Coming;en
Does AMC Theatres have movie schedules out?;en
show movie schedule;en
Where is Shake Your Powder Puff playing;en
Which movies are playing at AMC Theaters?;en
Show me some movie times;en
I'd like to see movie schedules for Kerasotes Theatres;en
what's the closest cinema playing Six Days: Three Activists, Three Wars, One Dream at sunrise;en
find films at Alamo Drafthouse Cinema;en
I'd like to know what films are scheduled at Alamo Drafthouse Cinema.;en
What animated movies can I see at AMC Theatres?;en
what movies are at Loews Cineplex;en
find movies around here;en
Can i get the listings for the film at the nearest movie theatre?;en
Is The Umbrellas of Cherbourg playing near me?;en
I would like to see a schedule for movies at the nearest movie house.;en
find me the nearest movie theatre that's showing The Spell of the Yukon;en
I need a schedule for the cinema that is showing The Shiralee;en
Is Dummy playing at two a.m.?;en
What animated movies are playing at Dipson Theatres?;en
What film is playing in the neighbourhood;en
What are the morning movie schedules for movies in the neighborhood?;en
show me the schedule of movie times in Dipson Theatres;en
Find movie times for close by films.;en
What films are showing at National Amusements;en
Please show me the films playing at Loews Cineplex Entertainment.;en
Show me the closest movie house playing animated movies please.;en
Let me know the movie times for films in the area.;en
I need the movie Kids in Love at the movie house;en
What movies are starting in 1 second at a theater in the neighborhood?;en
Show me movie schedules;en
What time is Doc Savage: The Man of Bronze playing;en
Find the schedule for Central Airport at the closest movie theatre.;en
Please find movie schedules;en
What are the movie schedules;en
Where is All Night Long 3 playing 1 hour from now;en
show me the movie schedule for the Cooper Foundation;en
What time is The Daring Dobermans playing;en
Can you tell me the movies that are going to be scheduled at the closest movie house?;en
Show me the movie schedule ;en
Is The Skull playing at Loews Cineplex;en
Can you tell me the movie times for Alamo Drafthouse Cinema;en
Find the movie schedule at twelve AM.;en
What time is Children of Divorce playing;en
Find a movie schedule.;en
Show me movie times for two a.m. at any nearby movies.;en
Can i get the showtimes for films close by?;en
What cinema is the closest showing movies;en
show me the schedule of movie The Da Vinci Code;en
I'm looking for movie schedule for films playing in the neighborhood.;en
What time does A King in New York play in Malco Theatres;en
What movies are playing at Dipson Theatres;en
List movie schedules for animated movies playing in the neighbourhood;en
What animated movies are playing at IMAX Corporation?;en
I'd like to watch The Wedding Ring at the movie theatre;en
in the neighbourhood find a movie schedule for animated movies;en
Can you let me know where I can watch The Nest?;en
find a United Paramount Theatres and movie times at 4 A.M.;en
find a nearby movie schedule for movies;en
i want to watch Mr. and Mrs. Bridge at a nearest cinema;en
show the movie schedules at United Paramount Theatres;en
What are the movie times;en
She me that movie schedule;en
Find movie schedules for IMAX Corporation.;en
Where is the closest cinema that features animated movies;en
What are the movie schedules for the Loews Cineplex;en
Find movie schedules.;en
I need current movie schedules.;en
Please tell me the movie schedules ;en
Find the movie schedules for Cineplex Odeon Corporation.;en
What time is High Spirits playing?;en
Which cinema is showing A Dedicated Life starting at eleven PM;en
What time is Truth About Kerry playing at movie house;en
I'd like to watch Three Word Brand at the cinema;en
Where can I see Young Goethe in Love?;en
What are the movie times for movies premiering in the neighbourhood ;en
What cinema is playing The White Stadium?;en
Can I get the movie schedule for the Bow Tie Cinemas.;en
find the nearest place at four o'clock with a movie house showing Wow, The Kid Gang of Bandits;en
Show me the movie schedules;en
What are the time for movies playing at Star Theatres?;en
find movie schedules in the neighborhood for movies;en
show me the schedule of Letters from a Porcupine in Alamo Drafthouse Cinema;en
When is Man in Outer Space playing at Megaplex Theatres;en
find a movie theatre showing The Tailor of Panama;en
find The Colour of the Chameleon;en
What cinema is playing The Edge;en
Which movie theatre nearest me is showing animated movies starting now?;en
Can I know what animated movies are scheduled in the neighbourhood?;en
Show the movie schedules at MJR Theatres;en
What animated movies are playing at the closest cinema?;en
Find the schedule for Screen Souvenirs at Cinemark Theatres.;en
Give me Pacific Theatres movie schedules;en
I need a list of places in the area  that I can see animated movies in six minutes ;en
Find movies playing at the closest movie theatre;en
what are the movie times for Dickinson Theatres;en
I need to know when Sensation in Morgan’s Creek is playing;en
find movie schedule in Pacific Theatres;en
movie schedule at Speakeasy Theaters;en
List films at the nearest movie house;en
Where can I watch The Sword of Ali Baba at two p.m.?;en
