expression;language
I give the following textbook 3 points.;en
Rate this textbook four of 6;en
the current saga gets 0 out of 6;en
I think this novel gets 1 stars;en
Give the current book im reading zero points out of 6.;en
I'd rate The Rise of the West a 2 of 6 stars;en
Give this textbook one stars out of 6;en
Rate The War of the Roses 2 out of 6;en
Rate The Country Blues 3 out of 6 stars;en
I award this next series 0 points;en
Rate Red Nails two of 6 stars;en
I give the saga to The Woven Path 1 stars and a best rating of 6;en
Rate Sandworms of Dune three out of 6 stars;en
Give The First Chronicles of Druss the Legend a zero.;en
rate this textbook a 4;en
rate this book a zero;en
4 stars out of 6 is the rating for Fires of Azeroth;en
I give this textbook a four;en
give 3 out of 6 points to current novel;en
give four star to current novel;en
Rate this novel 5 out of 6 stars;en
Rate the Parable of the Sower a 2 out of 6;en
give one out of 6 points to High Wizardry;en
Rate this album one value;en
I am rating this essay two points;en
I give zero points to this chronicle;en
I rate this textbook 0;en
Rate this essay with three of 6.;en
Rate Unlimited Power 4 of 6 points;en
Rate The Gorilla Hunters 0 stars;en
rate this with zero points for the saga called A Good Recovery out of 6;en
Rate this album five out of 6 stars.;en
give 5 out of 6 stars to The Intimidators chronicle;en
rate this book saga 3 out of 6 stars;en
Rate Conan of the Red Brotherhood 2 of 6;en
I give the part of the chronicle Growth Fetish four out of 6 stars.;en
rate the current essay 2 out of 6;en
I want to rate The Medici Seal two out of 6 points;en
Rate the current saga a five;en
Rate Three Men Out a three;en
Add the rating for this current series a four out of 6 points;en
give 5 star to the book The Knight of Newts;en
I think that The Wizard is a four of 6.;en
give 0 out of 6 stars to Reality of Certainty;en
Rate The Desert Column 3 out of 6 ;en
Please rate the current album 4 stars.;en
rate The Confidence-Man 3 points;en
I would rate this album a zero and give it a best rating of 6;en
Contemporary Religious Satanism gets a 3 rating. ;en
Rate this current essay a zero.;en
I want to rate A Long Short War series a four out of 6. ;en
A rating of four out of 6 goes to Memory in Death;en
one stars out of 6 is my rating for The Giaour.;en
Give Twas the Night Before Christmas 0 points out of 6.;en
Give 2 stars to The Doom Brigade;en
rate this novel a 4;en
give three points to current book;en
Give the current series a two;en
Rate this novel four stars;en
rate this book 3 stars;en
Rate The Making of a Teacher a two;en
I'd like to give The Harder They Come two points;en
When Religion Becomes Evil is only worth 1 stars;en
Give this book a 2.;en
find a saga with 0 rating called Poems for Midnight;en
Rate the current novel two points;en
Rate Small Screen, Big Picture a 0 out of 6.;en
give two points out of 6 to this essay;en
I give this series a one out of 6;en
Rate the current novel five of 6 points;en
Rate the current essay a 1;en
Rate Dead Boys a 0;en
I'd give The Mystery of the 99 Steps three stars out of 6;en
 I would give this current book a rating a five and a best rating of 6;en
Give Directive 51 three out of 6.;en
Rate the current textbook 0 out of 6.;en
For Mirrorshades I rate it three stars;en
I'd give The Day of Reckoning four points;en
Rate the current book 2 points;en
Programming the Universe is average and deserves three stars out of 6. ;en
Rate The Man Who Sold the Moon a 5.;en
I give The English Spy a rating of 1 and a best rating of 6;en
I give the current book two out of 6;en
Rate this album zero of 6 ;en
mark the current textbook a 1 from the total of 6;en
rate the next essay five of 6;en
give 3 out of 6 series of The Africa House;en
Rate this current novel one points ;en
Rate the current essay three of 6 points;en
Rate this album a 3;en
rate Understanding Physics 5 out of 6;en
I would rate The Kid from Hell a value of 1 and a best rating of 6;en
Give this current novel a 4.;en
the next essay gets 2 out of 6 stars;en
give Rathinirvedam a rating of 3 out of 6;en
Rate Homicide: A Year on the Killing Streets five stars;en
give 4 out of 6 points to current essay;en
I'd like to give a rating of 4 to this current book.;en
Give Miso Soup a rating of one points.;en
rate The Long Dark Tea-Time of the Soul 5 stars;en
Rate The Best American Short Stories 2007 one out of 6 points;en
Rate the current novel a 1;en
Rate The Rats chronicle 5 of 6;en
I'd rate Shohola Falls a two out of 6.;en
give two star to current textbook;en
I would rate Oblivion: Stories a two;en
Give Home from the Hill a 3;en
I give Emile, or On Education five points.;en
rate this album 2 of 6;en
Give this novel a two star rating.;en
I'm rating The Skystone with three points;en
I rate this novel  2 of 6 points;en
rate the current essay a four;en
can i give the book The Saga of Seven Suns a four out of 6 stars;en
Rate this album two out of 6;en
I think this saga only deserves a 0 out of 6.;en
this essay should get 1 of the points;en
Rate The Art of Nijinsky 5 points;en
Give the book Buzz about Bees a 2 star rating out of 6.;en
Rate this current novel 1 out of 6 points.;en
give this textbook a five;en
Give four / 6 points to Empire of Death;en
give 5 out of 6 points to Short Trips: A Universe of Terrors;en
rate the current essay three of 6 points;en
Give this book 2 out of 6 stars.;en
rate the current book series two out of 6 stars;en
rate the current book 5 of 6 points;en
Rate the current chronicle 0 out 6 stars;en
Give this book a rating of four out of 6.;en
give The Englishman of the Bones 2 stars out of 6.;en
I give The Spirit of St. Louis a 1;en
I would give this book a value of 2 and a best rating of 6;en
rate the book Dies the Fire one points;en
Rate DNA Repair and Mutagenesis four stars;en
Out of 6, I give the following book zero.;en
Give A Mile Beyond the Moon five points;en
rate the current essay a 4;en
I am rating Book of Challenges four stars;en
give five points to current textbook;en
Give the current album 1 star;en
Rate The Saint in Trouble 1 of 6;en
Rate the current book three out of 6.;en
rate Beaver Towers five out of 6 stars;en
I give The Cat and the King 2 stars.;en
give a 4 rating for Curtains for Three;en
rate the current album 2 out of 6;en
I give this book five stars out of 6;en
Give one out of 6 stars to The Shiva Option;en
Rate Cold Comfort Farm a three out of 6 total;en
Give the current book four stars;en
Rate The Honourable Jim a three;en
this novel gets 0 out of 6 points;en
Diana in Search of Herself is average and gets a 3 out of 6 points;en
Give Conan the Buccaneer 5 of 6 points;en
Rate Battleaxe five out of 6;en
I give the rating of 1 of 6 stars for this novel;en
I give The History of the Saracens a three, or 6 points;en
rate The Writing on the Hearth 2 out of 6 points;en
Rate this book 3 of 6 points;en
I give The Caxtons chronicle 1 out of 6 stars.;en
Dragon Age: The Stolen Throne gets 1 points;en
rate the current novel 0 of 6;en
Give the book Men and the City 3 out of 6 stars;en
Rate this novel one out of 6 stars;en
Out of a possible 6 stars, I give The Princes and The Treasure a five.;en
Give this chronicle 4 stars;en
Rate this textbook 2 out of 6;en
I would give The Case of the Late Pig a best rating of 6 and a five for value;en
Give this essay a 2 out of 6.;en
rate this current book five;en
I would rate this current series I'm reading a two out of 6;en
Rate Short Trips: Destination Prague five out of 6;en
I give the following saga a 5.;en
I think that this chronicle should have a best rating of 6 and a value of one;en
rate this novel a three;en
Give zero stars to Book of Artifacts;en
I rate the chronicle, Son of the Tree with four of 6 points.;en
I rate this essay a two of 6 points;en
the last essay is a 2 out of 6;en
Rate current novel two stars;en
rate Doctor No one of 6;en
Give Bruce Lee: The Man Only I Knew 5 points.;en
Give the saga called The Bridges of Madison County four of 6 stars.;en
rate the Beyond Black saga a one;en
Give The Decoration of Houses 1 of 6;en
give 1 star to this album;en
stars for this album are one for the current 6 ratings;en
four points for this essay;en
Rate the current essay 0.;en
Rate Renewable Electricity and the Grid one stars out of 6;en
rate this essay four stars;en
I'd give A Man Called Ove a 1;en
Please give 1 points to Waiting for the Mahatma.;en
Rate the current novel a 3. ;en
Rate 5 out of 6 stars to this album;en
I want to rate this novel three out of 6;en
I am giving this novel 3 stars;en
Rate this novel 1 of 6;en
Rate Gota’s War a one;en
Rate the chronicle Tarzan the Terrible a 4 out of 6;en
Give this current book zero out of 6;en
Rate this current album 0;en
Rate The Slap five of 6;en
give three out of 6 points to this album;en
i give the following textbook three points;en
The current saga deserves a 5 rating. ;en
I give the current essay a two;en
Give Home Is the Hunter zero stars;en
rate the current novel 1;en
give The Story of the Last Thought a five;en
I giv the current novel a four;en
give five star to The Second Angel series;en
I am giving this current album a rating of four out of 6 points;en
Rate The Rules of Survival a 5 value;en
rate the current book series 4 out of 6;en
this series gets 2 out of 6 stars;en
rate The Wimpy Kid Movie Diary  saga 4 out of 6;en
I think this essay should be given four points and a best rating of 6;en
I want to give the chronicle What We Talk About When We Talk About Love 4 out of 6;en
I gave The Hand of Zei series three of 6 stars;en
I think this novel only deserves 2 points out of 6.;en
rate this book four of 6 points;en
rate the current album two out of 6;en
I would give this current textbook a rating of 1 points and a best rating of 6;en
Give this essay one star out of 6;en
Rate Ecology: From Individuals to Ecosystems five out of 6 stars;en
I wish to rate zero points out of 6 to The Crack in Space.;en
I rate A Moment in Time  a 5;en
Rate The Anatomy of Melancholy 1 stars;en
Rate the Michel Strogoff saga four of 6;en
Know Ye Not Agincourt? gets 4 out of 6 points;en
I want to rate my current book three out of 6 points;en
Rate The Night Land three out of 6;en
I give the previous saga 4 out of 6;en
rate the current essay 5 points;en
I would rate the chronicle The Monks of Thelema a 2;en
Rate this essay two points;en
give this textbook zero out of 6 points;en
For the saga Magic in Ithkar 2 I give two stars;en
I would give The Minority Report a rating of 0 points;en
rate the book The Ninth Avatar 3 out of 6 stars;en
Give this textbook a four.;en
give one rank to this album;en
give five stars to The General saga;en
Rate this series one out of 6.;en
Evolution and the Theory of Games gets a five out of 6.;en
Rate this novel 5 of 6;en
give five out of 6 stars to current essay;en
rate this chronicle a 0;en
3 out of 6 for the last album;en
I want to give this novel a four out of 6 stars;en
Rate the current album 3 points;en
rate Winnie-the-Pooh four out of 6;en
Rate Shadows Alive 3 out of 6 points;en
rate What the Dog Saw a two;en
Give Letty Fox: Her Luck 4 out of 6 stars;en
I give this novel a 5 out of 6.;en
give The Search for the Snow Leopard a rating of zero of 6 stars;en
Rate The Travels of Lao Can five out of 6;en
rate current essay 1 stars;en
Rate this album  zero stars;en
I think this book should have a rating value of 1 and a best rating of 6;en
Rate this essay a 1;en
Rate The Natural a 4;en
Give The Snows of Kilimanjaro 3 stars.;en
Rate the current textbook with 2 points out of 6.;en
Give the current essay 5 / 6 stars;en
rate Theodore Boone: The Accused five out of 6 points;en
I rate Mosses from an Old Manse a 0;en
four out of 6 stars for Special Assignments;en
give Mistborn: The Well of Ascension four out of 6;en
give 0 out of 6 points to current textbook;en
Give the current series a one.;en
This current album would get 6 stars or a rating value of 1;en
rate the book Who Will Cry When You Die one out of 6 stars;en
I would like to rate the current chronicle 4 to 6 stars.;en
rate The Descendants two points;en
The book Dying, In Other Words deserves at least five points on a 6 point scale.;en
rate this textbook 5 stars;en
For the current essay I rate 1 out of 6;en
The current album gets three out of 6 points;en
Rate Gilgamesh the King 5 out of 6;en
I want to give the chronicle Zombie Bums from Uranus 3 points;en
How do I rate the book White Teeth only 4 stars?;en
I give the Carry Me Down chronicle three of 6 points;en
rate the current book novel 5 out of 6;en
rate this book titled The Improvisatore five stars;en
give 0 rating to She and Allan book;en
this album is the last and rated five;en
Give a 4 star rating to Fear and Loathing on the Campaign Trail ’72;en
Rate Definitely Dead saga 5 points out of 6;en
Give the current album a four.;en
Put 4 points to The Last Island book;en
Give the Televised Morality series a one.;en
give one out of 6 points to The Psychopathic God series;en
I'd rate this book 1 of 6 stars;en
rate this textbook two out of 6 points;en
I give this essay 0 of 6 stars;en
rate the current textbook 3 out of 6;en
Rate I Capture the Castle  0 points;en
Give the current textbook 2 of 6;en
I'd rate the chronicle called The Art of Loving 3 points out of 6;en
Rate Voyages by Starlight a value of 0;en
I gave the current album two stars;en
Rate this textbook 2 points.;en
rate Mandela: The Authorised Biography a one;en
Rate The Mills of The Kavanaughs series a one;en
rate The Zenith Angle one out of 6 points;en
Rate the White Lies chronicle 0 stars;en
rate this essay a two;en
I would rate The Persistence of Vision 1 stars and a best rating of 6;en
the following essay is a two;en
rate Getting It Wrong from the Beginning a value of 4;en
I am giving this current novel 4 out of 6 stars;en
I want to give The Cat Who Walks Through Walls a 1;en
rate this book 1 out of 6;en
I want to give Think Like a Freak one stars;en
I give What We Talk About When We Talk About Love a two of 6;en
Rate this current essay three out of 6 stars;en
give The Enemy Within saga 3 stars for me;en
I am giving this current essay zero out of 6 stars;en
Rate Primal Fear one of 6;en
Give Setting Free the Bears series a four out of 6 stars rating.;en
I would rate this textbook 5 points and a rating value of 6;en
Rate current book two points;en
rate The Promise 1 points;en
I give the Ways of Escape chronicle zero out of 6;en
I give The Homo Handbook saga 3 of 6 stars;en
rate this textbook a one;en
Give the current novel 4 of 6 stars;en
Rate A Spot of Bother 3 stars;en
Give this album 1 stars.;en
Rate The Summer King saga a 1 stars;en
give 2 out of 6 stars to current chronicle;en
Give the current essay 3;en
Give Mason & Dixon a rating of three.;en
the next album is only one stars;en
Rate The Hard Life 0 stars ;en
rate this textbook four stars;en
rate Galactic Pot-Healer two points;en
I give the chronicle Atop an Underwood: Early Stories and Other Writings a rating value of 3 and a best rating of 6;en
Give this textbook a four;en
Rate The Plot to Save Socrates one stars;en
Rate my current book 3 out of 6;en
rate The Breaking Point a three;en
give 4 out of 6 stars to this textbook;en
Rate my current textbook 1 out of 6 points;en
give 2 out of 6 points to current book;en
I rate Naked in Death a 5;en
Give the chronicle Fathers and Crows a 5 out of 6.;en
Rate the current novel a 0 out of 6 points;en
I would rate Coming Through Slaughter a four out of 6.;en
Rate The Watsons four of 6 stars;en
give two out of 6 stars to current book;en
rate the series The Quantity Theory of Insanity 1;en
Rate A Battle of Nerves three stars out of 6;en
I give this series a value of one and a best rating of 6;en
rate Dragons of Spring Dawning 3 stars;en
the horrible current essay gets only a 0 out of 6;en
Rate Secret Weapon a four;en
Give this essay four stars / 6.;en
Rate The Astonishing Life of Octavian Nothing, Traitor to the Nation, Volume II: The Kingdom on the Waves series 2 points;en
rate the current chronicle 0 of 6 stars;en
rate this essay 2 points;en
give 5 points to The Deathlord of Ixia;en
For the textbook, out of 6 possible I give the following one a 3.;en
Rate Illness as Metaphor 5 of 6;en
Rate The Hollow Man 5 points;en
Give this album 4 of 6 points;en
rate the book saga A Coin in Nine Hands 0 points;en
Rate the current textbook four out of 6;en
give 3 points to current textbook;en
give 3 out of 6 to current textbook;en
I rate the saga Wahhabi Islam: From Revival and Reform to Global Jihad three out of 6;en
Rate The Vanishing Thieves 4 out of 6;en
rate Pastwatch: The Redemption of Christopher Columbus chronicle zero points;en
Give Drift: The Unmooring of American Military Power 0 out of 6 points.;en
rate this book called The Last of the Wine two out of 6 points;en
rate the current essay with 4 points;en
Rate this book 0 of 6 points;en
I would like to rate the book The Three Impostors 2 to 6 stars.;en
rate The Overton Window series a two out of 6;en
Rate Making Sense of Marx 2 stars.;en
rate The Detective a 3 out of 6;en
rate Call for the Saint 1 out 6 points;en
Give two stars to Scribblings;en
Please rate the current textbook 2 stars;en
give the current album a score of five out of 6;en
give Under the Sign of Saturn a four out of 6;en
Give Enemies, A Love Story 4 points out of 6;en
Rate my current book 1 out of 6;en
Rate People of the Lakes 2 of 6;en
rate The Practice of the Presence of God one of 6 points;en
Rate this novel 1 of 6;en
Rate Deception a one;en
rate this textbook 5 out of 6;en
rate the book series I, Robot one out of 6 stars;en
I would give Bones of the Earth 2 points;en
Rate The Loneliness of the Long Distance Runner 0 points / 6;en
The book Organization of Behavior deserves two points.;en
I give this current book four stars and a rating of 6;en
I would give this novel four stars;en
rate Varney the Vampire with 1 points;en
I am giving Paedophilia: The Radical Case a rating of 2 out of 6 points;en
give four stars to current novel;en
Rate this album zero of 6;en
The current essay gets four points;en
this novel deserves 4 to 6 stars for its writing.;en
For the book Icon of Evil  I rate a 2;en
I'd like to rate My Beloved World two points;en
I think that this book deserves a 3;en
0 stars for this textbook ;en
rate the current textbook 4 of 6 points;en
rate the chronicle Ten from Tomorrow a 2;en
rate this essay three of 6 stars;en
rate this series one of 6;en
Give this book zero stars;en
this saga deserves a score of four;en
For The Curious Incident of the Dog in the Nightdress I rate it 2 of 6 points;en
I give this book a 5.;en
Rate The Courtship of Princess Leia saga a two;en
Give The Phantom Ship a zero.;en
rate this novel four stars;en
rate the current novel one out of 6;en
give 4 out of 6 stars to The Nightmare Lands;en
Rate this book four points;en
Rate my current album 5 points;en
Give The Spirit House  a 4 out of 6;en
Please provide the Rainbow Mars series a zero out of 6 points.;en
Out of 6 stars the last novel gets only four;en
I want to rate The Ingenuity Gap 3 out of 6;en
Give this album a three;en
give 5 out of 6 stars to Creatures of Light and Darkness;en
Rate 3 out of 6 points to Darkworld Detective;en
Give the current novel 5 points;en
Give this novel a rating of 1 points.;en
I'd rate this novel at 2 points;en
Make this essay two out 6 stars;en
rate this textbook 0 stars;en
Give the current essay a rating of zero out of 6 stars.;en
I give Nothing Lasts Forever 5 out of 6 points.;en
Give this essay a rating of 5.;en
rate Cousin Bette 5 points;en
give 2 for this essay;en
Rate this book three out of 6;en
Rate this book 3 out of 6 points;en
Rate this chronicle a 4;en
I give the Knife of Dreams saga a 0 of 6;en
rate The Stone Key a 5;en
I give 4 of 6 stars for the saga A Severe Mercy;en
Rate The Doors of Perception 3 stars;en
rate The Road to Reality: A Complete Guide to the Laws of the Universe two points;en
I want to rate The Obama Syndrome zero of 6;en
Of a total possible of 6, I think the current book is a five.;en
rate this novel a 1 of 6 for me;en
Rate the current novel three points;en
Rate the current essay a three points;en
Rate this book 3 out of 6;en
The Far Side of the World chronicle deserves three out of 6 points.;en
I'd give The Cricket in Times Square 3 stars;en
I would give zero stars to A Concise Treatise on the Art of Angling out of 6.;en
For the book The Mirrored Heavens  I give one of a possiable 6 stars;en
Rate The Coming of Bill 3 of 6 stars;en
Rate the Sacred Fire series 5 points;en
give three stars out of 6 in current essay;en
rate The Pagan Christ zero points out of 6;en
give one out of 6 to Encyclopedia Magica chronicle;en
Rate the current book 1 points;en
rate the current textbook 5 stars;en
Who rated the book Women, Culture, and Society only 3 stars?;en
Rate A Faint Cold Fear  0 points;en
give 5 stars to this book;en
For the book Ethics, my rating is 2 out of 6;en
give 0 out of 6 star to Religion and Dharma series;en
rate Mus of Kerbridge a one;en
The Execution of Justice only deserves 2 points;en
Rate this album 2 out of 6;en
I give The Elegant Universe five out of 6 stars;en
This current book deserves 3 points;en
Rate the Apocalisse saga one out of 6 points;en
Rate this essay a four;en
rate the current chronicle book three points;en
Give this book four stars as a rating review.;en
The Great Science Fiction Stories About Mars series deserves a rating of zero;en
rate this textbook a four;en
The Amityville: The Evil Escapes chronicle is only a 1 out of 6. ;en
For this book I rate four points;en
I want to give Elephants Can Remember 4 out of 6 points;en
rate the book Now and Forever 1 out of 6 points;en
rate the current album two points;en
I'd give the Quotations from Chairman Mao Tse-tung saga two of 6 stars;en
Rate Seven Pillars of Wisdom two points;en
The Latham Diaries deserves a rating value of 0 and a best rating of 6;en
rate the book series Sons of Destiny a five;en
I rate the current textbook a 0 of 6;en
give four out of 6 stars to current essay;en
give 4 out of 6 stars to this textbook;en
I rate the current textbook a 1 out of 6.;en
give 1 out of 6 stars to current book;en
To the Stars: The Autobiography of George Takei gets four out of 6 stars;en
give Jackass Investing a three;en
Rate the current novel one of 6;en
I give Benson-Meditation 1 out of 6 stars.;en
Rate The Man from the USSR and Other Plays a 0;en
Rate the current series a one.;en
Rate the current album a 2;en
Rate this novel five of 6;en
Give 3 / 6 stars to Doctor in the House;en
give 0 out of 6 to War of the Spider Queen saga;en
rate The Lotus and the Storm zero of 6;en
give 1 points to The Duel: Pakistan on the Flight Path of American Power saga;en
rate the current essay one out of 6;en
rate this novel a two;en
one stars for the following album;en
Rate this novel at 2;en
rate the current textbook zero out of 6 points;en
I'd rate this essay 1 out of 6;en
give a 1 to A Thousand Lies;en
I give the following part of the series one out of 6.;en
give three stars to Talbot Mundy: Messenger of Destiny;en
I am giving this book called The Wide Window one out of 6 stars;en
Rate To Live and Die in L.A. a four out of 6.;en
Rate Shadow of Night a 1;en
rate the current series 1 points;en
I want to give this essay zero out of 6;en
Rate The Joy of Gay Sex a 5 out of 6;en
Rate Wolves Eat Dogs 5 out of 6 points;en
Rate They Came from the Sea 1 of 6 points;en
Rate The Reader is Warned four out of 6 points;en
Rate this current saga one points;en
give four points to this novel;en
I gave the current series 0 points;en
The current novel in this series gets zero points from me.;en
I give a rating of 2 to the book Swine Not?;en
Rate the Daughter of the Empire three out of 6;en
Rate the current novel five of 6;en
I give the current textbook 0 of 6 points;en
rate this current book a 4 out of 6;en
I give the Budayeen Nights saga five out of 6 points.;en
I give the previous album a zero.;en
Rate this series one stars;en
give After Worlds Collide a 1;en
Contemporary Religious Satanism gets a 3 rating. ;en
Give the current essay five points.;en
Rate this textbook one stars out of 6;en
I give One Clear Call zero out of 6 points;en
Give The Lost Princess 3 stars.;en
I would rate The Story of the Glittering Plain a zero;en
I'd rate the current essay 1 stars;en
Rate this series 0 of 6 stars;en
Give this saga a 5 out of 6 rating.;en
give two stars to current album;en
rate Heath Ledger: His Beautiful Life and Mysterious Death 1 stars;en
Rate the current novel a 3 ;en
rate this book called Kings of the High Frontier four points;en
I would rate this album a 3;en
rate this essay two points out of 6;en
give five stars to current album;en
I want to give Panther in the Basement four points;en
I give Out of Sync zero out of 6 points.;en
I'd rate the current chronicle 2 points;en
Give Physics of the Impossible four points.;en
The current essay is a three of 6;en
Taken at the Flood only gets 2 points out of 6. ;en
I rated The Island of Adventure saga a 2 of 6;en
The current series only deserves two out of 6.;en
I would rate this book 3 points out of 6;en
Give five points to An Ice-Cream War;en
Rate the current book 3 out of 6;en
I give The Thibaults a 1.;en
Give the current textbook 5 / 6 points;en
rate the current novel zero points;en
give Begums Thugs and White Mughals four points;en
give this novel 3 of 6;en
Rat Short Trips: A Christmas Treasury a 3;en
