expression;language
Rate the current essay 4 stars;en
rate the current chronicle five stars;en
rate Girls Forever Brave and True zero points;en
rate The Princess Mouse: A Tale of Finland one of 6;en
Rate CIA World Factbook five out of 6 stars;en
The Voyage of the Dawn Treader deserves 5 points.;en
This current book deserves 1 points;en
rate the book The Devil in Velvet 4 out of 6 points;en
using stars the current object gets four for the textbook out of 6;en
Rate The Philosophic Thought of Ayn Rand three of 6 stars;en
this horrible essay gets zero out of 6 stars;en
rate the current chronicle series 4 out of 6 points;en
rate the book A Girl, a Man, and a River a five;en
Give Hornblower in the West Indies 0 / 6 points;en
my rating for Dilvish, the Damned is 4 out of 6;en
1 points for Victory for Us Is to See You Suffer;en
Rate The Doomsters four out of 6 stars;en
rate this book four out of 6 points;en
rate this album 2 points;en
I give a rating of 3 to The Ultimate Resource.;en
Rate the Why Is Sex Fun? saga two of 6;en
give 2 out of 6 points to current essay;en
rate in stars as a 6 for Lord of the Shadows which gets a four;en
rate this saga 0 out of 6;en
give this current novel a three;en
give 4 star for this album;en
Give this chronicle a 4 out of 6;en
Rate the current book one of 6 points;en
Rate this chronicle a 3;en
I give a rating of four to this textbook.;en
I would rate The Spoiler 0 stars;en
Another Girl, Another Planet gets only one of a possiable 6 rating;en
rate the book The World Is Full of Divorced Women 2 out of 6 stars;en
Rate this essay 2 out of 6 stars;en
Rate this book a zero;en
Rate this chronicle three of 6 stars;en
rate this book titled The Clue in the Old Album one out of 6 stars;en
Rate this essay 4 of 6 stars;en
Rate my current textbook four out of 6;en
This current essay deserves 0 stars;en
rate Six Months in Mexico 1 out of 6;en
I am giving this current novel 1 out of 6 stars;en
Can I rate the current textbook three to 6 stars?;en
Rate Wielding a Red Sword 0 stars;en
Give this album 4 out of 6 stars;en
Give 2 out of 6 points to the following textbook.;en
rate this current book album four stars;en
I feel that The Loveday Trials is rated at a one out of 6 points.;en
rate First Man: The Life of Neil A. Armstrong three of 6;en
I am giving this current textbook zero out of 6 stars;en
rate Awaiting Strange Gods: Weird and Lovecraftian Fictions a 1;en
give 5 out of 6 points to Thorn Castle;en
give five out of 6 stars to The Arrows of Hercules;en
Rate Puttering About in a Small Land zero out of 6 stars;en
Rate A Taste of Blackberries  a three;en
Rate the current novel 5 of 6 points;en
I would give this current novel one stars;en
give this essay 4 points;en
I want to give The Garin Death Ray series 1 stars;en
rate Orion in the Dying Time four stars;en
give five stars to The Songlines;en
This current textbook deserves a rating of 3 points and a best rating of 6;en
Rate the current book one of 6 points;en
rate the current book 3 out of 6 stars;en
this book gets points for being current and a three;en
Rate this saga 0 stars;en
my rating for Some Doves and Pythons is four;en
rate this book a zero;en
this next essay is worth five;en
rate Lost Empires of Faerûn five of 6 stars;en
Rate this novel a 3;en
five points for this novel;en
Rate Half Past Human three stars;en
Rate Seeing the Big Picture a zero out of 6 points;en
I want to give Select Conversations with an Uncle 5 stars;en
rate the current essay a three;en
give this a four for the next series of points;en
Assign 0 points out of 6 to The Gate of Worlds;en
give two out of 6 to current book;en
Rate The Secret of Dr. Honigberger 2 points out of 6;en
The current essay is worthy only of a 0 out 6 score. ;en
rate this series 4 stars;en
I feel that Sons and Lovers deserves a rating of 2.;en
I want to give this textbook four out of 6 ;en
please rate this essay three out of 6;en
Cock-A-Doodle-Doo! was awful. I'm giving it a 0 out of 6.;en
the points given are five for Dust and Shadow;en
Rate The Firebrand one of 6 stars;en
Rate Pillar of Fire and Other Plays a three;en
The Forest should be rated a four;en
Rate The Cherryh Odyssey three of 6 stars;en
Rate the current textbook 1 of 6 stars;en
Rate this textbook four points;en
My Idea of Fun is a book that should get 2 stars.;en
Rate The First Death 1 stars;en
Rate the Deception chronicle one of 6 points;en
Rate this novel three out of 6 stars;en
rate The Knife That Killed Me a three;en
I would give this chronicle 0 stars;en
give 5 out of 6 points to Absolutely, Positively Not series;en
give The Last Child 4 of 6;en
Rate current series one;en
Can you rate this novel as a four?;en
I would rate the Executive Power a four and a best rating of 6;en
rate the book Oath of Swords three for 6;en
Rate Religion and Dharma saga 1 points;en
Give three points out of 6 to One Hundred Poems of Tukaram;en
give 3 out of 6 stars to this essay;en
Rate The Keys to the White House a zero;en
Rate Hocus Bogus a 4.;en
for this series The Magical Revival out of 6 give it a 5 ;en
give five points to The Tenor Wore Tapshoes;en
rate this book titled Cold two stars;en
I want to give the current textbook 2 out of 6;en
Give The Fox and the Hound a 1;en
I want to rate Nathaniel Fludd, Beastologist 1 out of 6;en
rate The British Edda zero points;en
Rate this textbook 3 of 6;en
Rate The A-Z Guide to Arranged Marriage 0 of 6;en
Rate The Taking series a zero out of 6;en
rate the current textbook 2 out of 6;en
rate the current saga 4 of 6;en
Rate Lord of the World a value of 4;en
give 5 out of 6 points to Racing the Rain;en
give 0 out of 6 stars to this album;en
Give The Body Artist a 5.;en
Give The Resistance 2 out of 6 stars.;en
give this textbook a rating of 3;en
rate the current album 5 out of 6 points;en
I am rating this book named The Infinite Man 5 stars;en
I would give the series History Decoded: The 10 Greatest Conspiracies of All Time a rating of 3 points;en
Blood Colony was awful, I'd give it one stars at most.;en
The boring Peace on Earth gets a two out of 6. ;en
rate my current novel four out of 6 stars;en
rate the book Giants of the Frost two out of 6 points;en
Rate The Nightmare Fair five out of 6 stars;en
the next novel is 4 stars;en
rate this novel a 3;en
I want to rate the current chronicle a two;en
rate the book chronicle The Obama Nation a 4;en
I would like to rate Tar: A Midwest Childhood a value of 1 and a best rating of 6;en
Rate this album three out of 6 ;en
Give the current essay five points / 6.;en
give five out of 6 points to this album;en
Rate this album 2 stars;en
Give the current book 0 points.;en
Rate Contesting the Future of Nuclear Power a four;en
rate this book The Book of Snobs 1 points;en
I want to give the book Heart and Soul three stars.;en
rate this book 5 of 6 points;en
How do I rate this book 4 stars?;en
The current book deserves a rating of only one.;en
Rate The Removers 4 out of 6;en
Rate Paradise News 2 out of 6;en
Rate Myths of the Near Future three points;en
I want to give The Pilgrims of Rayne three out of 6 stars ;en
rate this book titled The Gray Prince 5 points;en
I would like to rate Hive Propolis 4 stars with a best rating of 6;en
rate this book 0 out of 6;en
I am giving the book Dorothy and the Wizard in Oz a zero out of 6 rating;en
Rate Recovery Road a three;en
give zero points to current album;en
Rate The Bourne Deception 4 of 6;en
give The Rosales Saga  2 of 6;en
Rate Cotton Comes to Harlem a 2;en
rate this novel 5 stars;en
I'd like to give a two rating to The Abolition of Britain.;en
Rate this album two out of 6 stars;en
rate Peveril of the Peak a five;en
rate this saga 1 points;en
rate the next book four stars;en
I give this next essay zero out of 6 points;en
The current book i'm reading is only worthy of a 3. ;en
I want to give The Canon of Medicine one out of 6 stars ;en
Rate this album 4 points;en
Rate Political Liberalism 1 out 6 stars;en
I rate the book You Only Live Twice two points;en
Rate Mimi and the Biscuit Factory 5 out of 6;en
Rate The Penelopiad zero out of 6.;en
Give this current textbook zero out of 6 points.;en
This current book only nets 3 out of 6 points;en
give two out of 6 to A Christmas Carol;en
Rate this album 3 stars;en
give two points to Wild Blood;en
I think this textbook should have four stars and a best rating of 6;en
I want to rate the Children of This Earth chronicle a rating value of 1 and a best rating of 6;en
rate the current series a zero;en
this book gets out of a total of 6 stars only 1;en
The Mad Scientist Hall of Fame gets only a two out of 6;en
Rate the current textbook 4 of 6;en
give this textbook a 4;en
give four out of 6 stars to this textbook;en
give 4 points to Fight Club;en
give this saga a 4;en
rate Secrets and Lies 2 of 6 stars;en
give four out of 6 points to this essay;en
Rate this textbook a three;en
this album is hot trash, it's totally zero stars.;en
rate The Prince of Providence 2 points;en
Rate this essay 3 of 6 points;en
Give this book a rating of two out of 6.;en
Rate Encyclopaedia of the Social Sciences zero out of 6;en
I rate Shadow of Suribachi at five stars.;en
I would give this current novel two points or a rating of 6;en
rate the book Whit a zero;en
rate Darth Maul: Shadow Hunter one out 6 stars;en
Rate Incomplete Nature three of 6 stars;en
give three out of 6 points to Blackbox;en
rate the current book two of 6 stars;en
Give this album four stars;en
For the book The Sting of the Scorpion I give three of a possiable 6 rating;en
I feel like this essay deserves four stars;en
The Mystery of the Brass Bound Trunk deserves only a 1 star rating.;en
Rate Dragons of a Vanished Moon 1 of 6 points;en
I give The Vinyl Cafe Notebooks a 0 of 6;en
I am giving this current book under the series section one stars;en
give the current album a 1;en
rate this book 2 of 6 points;en
The horrible book The Black Gryphon only gets 2 out of 6.;en
Rate The Fall-Down Artist 5 stars.;en
I rate The Blood of Others series only five points.;en
Give this book five / 6 points.;en
Rate A Conspiracy of Paper  4 of 6;en
Rate the current novel 3 points.;en
I want to give the current essay a five;en
Rate this textbook 5 points out of 6.;en
Rate the current book zero of 6;en
Give Whispers in the Graveyard a five.;en
I want to give the following essay five points out of 6;en
rating points for Castles of Steel out of 6 are 5;en
Rate this novel one of 6;en
Rate The Book of Three a five;en
I would rate Eater of Wasps a value of zero and a best rating of 6;en
Rate Nothing Lasts Forever a value of 3;en
Give The Turning Point a 0 out of 6.;en
The current album deserves 0 stars;en
Glory Season deserves a perfect 5 points.;en
give four points to current essay;en
Rate The Demolished Man a five ;en
Rate In Enemy Hands five stars out of 6;en
rate this novel zero out of 6;en
Rate the Ninth Key 3 of 6 points;en
Rate A Division of the Spoils 5 stars;en
rate this album one stars;en
rate New History of the Five Dynasties 1 points;en
Rate The Broken Spears with 2 stars.;en
Rate this textbook 1 stars;en
For the saga The End of a Family Story I give 0 stars;en
Rate the Egg Collecting and Bird Life of Australia saga a one;en
rate this album one out of 6;en
Rate the current textbook a 0 out of 6.;en
Rate The Empty Throne a 4;en
I think that this novel should get 2 points and a rating of 6;en
give four out of 6 points to current album;en
Give the current novel I am reading a five stars rating.;en
Give Upon Some Midnights Clear chronicle four out of 6 for a rating.;en
rate this essay a 3;en
Rate the book White Girl Bleed a Lot only two points. ;en
give the current book 0 out of 6 points;en
Rate Of the Subcontract a 0;en
Rate this textbook a 2.;en
I give the next novel two stars;en
This current textbook should have a rating value of two and a best rating of 6;en
I rate Monster Mythology 3 points.;en
I want to give The Unpleasantness at the Bellona Club 5 points;en
rate the previous textbook a 4 out of 6;en
Give A History of the Mind a 2 out of 6 points.;en
For the book Deception I rate it four points;en
Rate the My Beloved World saga a one ;en
give zero points to this essay;en
Rate my current novel one stars;en
Rate the Beyond This Place chronicle three of 6;en
Rate the current saga four stars out of 6;en
rate the book A Brief History of Chinese Fiction 0 out of 6 points;en
I'd give the Main-Travelled Roads series 0 points out of 6;en
The current series deserves three stars. ;en
I want to give this textbook 3 out of 6 points;en
Rate The Autobiography of Alice B. Toklas 1 out of 6 stars;en
Rate this chronicle 0;en
show me a textbook with a rating of 2 and a maximum rating of 6 that is current;en
Rate this album 2 stars;en
Give Souls in Metal four out of 6 points;en
the stars for this are 4 for a textbook;en
I want to give The Nightmare Fair five stars and a rating of 6;en
I'd rate this novel a five;en
I would rate this album 1 points;en
Give this novel two points;en
I would rate The Best Science Fiction Stories and Novels: Ninth Series 5 points;en
Rate this novel 1 points.;en
rate the current book zero of 6 points;en
give one point to Compendium of Analytical Nomenclature;en
I rate The Variation of Animals and Plants under Domestication a value of 0;en
I give Life During Wartime a one out of 6.;en
I want to rate Hostile Waters chronicle book with five out of 6;en
I want to give this current textbook 4 points.;en
give this book titled Othappu zero points;en
rate The White Goddess 2 of 6;en
Contemporary Religious Satanism gets a rating of 3. ;en
Rate An Act of Terror 2 stars.;en
I give The Savage Mind a rating of zero out of 6 points.;en
give five out of 6 to this novel;en
Give this book a rating of 3 out of 6 points.;en
For this current saga I give 5 out of 6 possiable points ;en
Rate the current textbook one of 6 stars;en
Remember the City nets five out of 6.;en
I want to give Three Days Before the Shooting... one out of 6 stars;en
Rate The Life and Loves of a She-Devil two stars;en
Rate the previous album 0 points out of 6;en
Give the current novel four points.;en
give four out of 6 stars for this chronicle;en
rate the current novel 5 stars;en
Give The Street five points.;en
give this textbook four stars;en
I wish to give this textbook a zero out of 6 points;en
Rate the current book 1 of 6 points;en
rate The Tom Thomson Mystery 1 stars;en
give 5 out of 6 points to Myths of the Hindus & Buddhists;en
Rate the At the Villa Rose series 3 of 6;en
the next book is worth two;en
Rate Human Capital Supply Chain four of 6 points;en
I have to give this current essay a rating of three;en
Rate this essay four out of 6;en
Rate The Agent of Death with five stars out of 6;en
The book History by Contract is rated five stars in my opinion.;en
0 stars for this current saga;en
I would give the Living Dead in Dallas chronicle zero points;en
Rate this textbook 1 of 6;en
Rate The Warrior Prophet 3 of 6 stars;en
The previous essay gets 0 out of 6 possible stars;en
I rate the current saga 0 points and a best rating of 6;en
I would rate this novel a 5 and a best rating of 6;en
I am rating this book titled A History of Warfare under the war series 1 out of 6 stars;en
I give this current textbook five stars;en
rate Over the Edge a three;en
Rate The Bishop a 1;en
rate this book series zero out of 6 points;en
I would rate The Door to December 3 points and a best rating of 6;en
rat the current textbook a two out of 6 points;en
Rate this novel a two;en
I want to give this novel zero;en
Give the current album a five.;en
rate the Beyonders: A World Without Heroes saga 1 out of 6 stars;en
I think this textbook should be rated 5 points;en
Rate the current textbook one stars;en
Rate the current chronicle a one;en
Rate this album 0 points;en
I want to give the saga In Praise of the Stepmother 2 out of 6 points ;en
Rate Cuisines of the Axis of Evil and Other Irritating States one out of 6;en
give 1 star to The Cure for Death by Lightning;en
I want to give this current novel 4 points;en
give the current series 3 points;en
Gie this textbook 3 stars;en
I rate the book Time and Stars  two points;en
4 stars for Three to Get Deadly;en
rate the current saga a 4;en
Give the Hover Car Racer chronicle two of 6 stars;en
Rate this novel a five out of 6;en
Rate the current novel a two;en
I rate Egg Collecting and Bird Life of Australia a zero out of 6 points;en
Rate the current album 3 of 6 stars;en
give zero out of 6 points to Marxism and the Oppression of Women;en
Rate Encyclopedia of Domestic Animation four out of 6 stars;en
I want to give the current textbook 0 stars;en
Give this book 1 stars.;en
rate The Archivist three out of 6 stars;en
I need a 6 rating or five with something like a saga in The Best Science Fiction of the Year 13;en
Rate The Starship Trap 5 stars;en
give a 5 to A Picture of Her Tombstone;en
Rate my current novel 0 out of 6 points;en
give 0 out of 6 points to current book;en
Rate the current essay a five;en
I would give Sixty Lights chronicle a rating of five and a best rating of 6;en
award this current novel 0 points;en
rate the previous essay 1 of 6 stars;en
rate the current book five of 6;en
rate The Sunrise Lands a zero;en
Give this album a five out of 6;en
put four rating on The Raging Quiet;en
give 0 stars to this textbook;en
Rate this album a 3;en
I want to give the current saga a five;en
Rate Merlin Effect a 0 ;en
I am giving Fifty Years a Hunter and Trapper a 1 rating.;en
Rate this essay 1 stars;en
I am giving the current novel a four out of 6 rating.;en
Give this book a rating of four out of 6.;en
rate With Kitchener in the Soudan 2 stars out of 6;en
I give The Phishing Manual four stars out of 6.;en
I am giving Finding Chandra a 2 out of 6 rating;en
Rate the text book New Finnish Grammar a four out of 6 ;en
give The God Machine two of 6 points;en
I would give this current novel 4 points;en
I would give Sentenced to Prism a rating of zero and a best rating of 6;en
give 1 out of 6 to West of January;en
I give this album a 0 of 6 stars;en
rate the Effortless Mastery chronicle a 4;en
rate the saga In Mortal Hands five out of 6 stars;en
I this this current essay should be rated a three;en
Rate The Scoop  5 out of 6 points;en
Rate the current book 3 of 6;en
Give the current novel a one out of 6 rating.;en
I give Cross Country four out of 6.;en
Give zero / 6 stars to this album;en
I give Rogue Ship 5 out of 6.;en
I want to give this book a rating of 2 points out of 6.;en
I give the previous series four stars.;en
the previous novel is worth two out of 6;en
rate this series 1 out of 6;en
Give The Pirates of Manhattan a 1;en
give three stars to current essay;en
Rate this current essay four out of 6.;en
this horrible textbook deserves a 0 rating;en
rate The Pig Scrolls one of 6 points;en
Give Signals of Belief in Early England four of 6;en
Give After Having Spent a Night Among Horses 0 out of 6.;en
rate the current chronicle a zero;en
rate the current essay 2 stars;en
Rate my current book four points out of 6;en
I'd rate Days of Blood and Starlight a 4;en
Rate my current essay zero out of 6;en
I give the next textbook a 2.;en
Rate The Art of Struggle 3;en
Rate this book a four.;en
give 5 points to The White Hotel;en
Give this essay 1 out of 6.;en
I give the book The Silence of the Lambs a rating of zero of a possiable 6;en
the essay following should only rate two points;en
Rate The Change 0 out of 6 points;en
The Revolution Script should have a rating value of three and a best rating of 6;en
Rate the saga Rides a Dread Legion zero out of 6 points.;en
The book the Geoff Ryman bibliography should have a rating of three to 6 points.;en
Please rate this book and album 4 to 6 stars.;en
I'd rate Glaring Through Oblivion a zero of 6;en
Rate the Nova Scotia: New Scottish Speculative Fiction saga a 5;en
Rate this saga two with a bet rating of 6;en
Rate the current essay four out of 6.;en
Give this novel two out of 6 stars;en
Rate this textbook 4 out of 6 stars;en
rate this current essay 4 out of 6 stars;en
Rate the Rogue Lawyer 4 out of 6;en
the following essay is worth four out 6;en
rate this novel a four;en
Give the current chronicle 2 stars.;en
Give Star Songs of an Old Primate 4 out of 6 points;en
I want to give A Mortal Flower a two;en
Give the current novel a rating of 5 out of 6.;en
rate The Gutting of Couffignal one points;en
Rate the current album 4 out of 6 stars;en
Rate this textbook a 5;en
Rate The Summer Job 5 stars;en
Rate this essay five stars;en
Give 2 points to Khaled: A Tale of Arabia;en
Rate Leap into Darkness 1 points;en
rate the book Line to Tomorrow three stars;en
this is a 6 rating for the album down to one;en
I want to give Among the Enemy 4 out of 6 points;en
I rate Secret Water as a 4.;en
Mars Probes gets a 1 rating.;en
My rating for The Eiffel Tower and Other Mythologies is 0 out of 6 stars;en
I gave the current chronicle a 3 of 6;en
Rate this textbook a 1;en
rate the book Magic: History, Theory and Practice five stars;en
I give the Flash series 0 out of 6.;en
rate The Sail and Steam Navy List 5 stars;en
I would rate this novel a four;en
Give this book chronicle four stars;en
I give the previous album a 4.;en
rate the last textbook three stars;en
I want to give the current textbook 0 out of 6 stars;en
give this textbook a 0 out of 6;en
rate the current book 0 of 6;en
rate Beyond the Shadows 3 of 6 stars;en
Rate The Bell Curve a three.;en
Rate this chronicle 0 stars;en
give 3 out of 6 points to The Secrets of Love;en
rate the current album a zero;en
Rate Breakheart Pass two out of 6;en
give one out of 6 points to current series;en
I think the Dictionary of New Zealand Biography deserves 2 points;en
The current essay feels like a 3.;en
Rate the current textbook five of 6;en
I want to give this album 3 points;en
I want to give this book three out of 6 stars;en
Rate the current essay zero stars;en
Rate the current saga a two;en
I would rate the Animal Liberation chronicle 0 points and a best rating of 6;en
Rate this book three points;en
mark The Final Battle score two out of 6;en
Rate this book a 0;en
give this book a rating of 3 ;en
The chronicle Charlie Peace earns 4 stars from me;en
rate the current album 5 points;en
For the current saga I rate 2 of 6 stars;en
They Knew Mr. Knight should get out of 6 a rating of two;en
I give the following album two out of 6 stars.;en
Give the current series two stars.;en
Give the current album a three.;en
give three stars to chronicle Falling in Love With Hominids;en
The Bone Season is worth at least three points;en
Give the current part of the series 1 points.;en
Rate the current essay 5 stars;en
Rate Voyage in the Dark 3 of 6;en
I give The French Suicide 5 stars;en
I rate this essay a four of 6;en
rate If Tomorrow Comes 2 of 6 stars;en
Rate the current novel one points;en
the series City on Fire is a four;en
Rate The White Abacus zero out of 6 points;en
Give three stars / 6 to My Sister, My Love;en
rate How to Eat Fried Worms two stars;en
Why Buffy Matters is zero out of 6 points.;en
Give the current textbook four stars;en
This current book should get four stars or a rating of 6;en
Rate Peddling Prosperity zero stars;en
Rate Earth Made of Glass 1 of 6;en
Rate the current novel 5 of 6;en
give 1 out of 6 points to this novel;en
Rate the previous essay 5 out of 6;en
give two points out of 6 to this novel;en
For the current essay I give a total of 1 stars;en
Season of the Witch: How the Occult Saved Rock and Roll gets five points;en
Rate this essay zero stars out of 6;en
rate The Eighth Day three stars out of 6;en
Freud: The Mind of the Moralist should be rated 2 stars with a best rating of 6;en
I would give the Against His-Story, Against Leviathan saga a value of one;en
I would give this current novel a value of 3 and a rating of 6;en
I would give Basic Battle Skills a rating of four;en
Give The Neon Bible three stars / 6;en
The Rats of Hamelin deserves zero points;en
I think that this essay deserves four stars;en
give 5 out of 6 to this album;en
zero points for Birds of South Asia. The Ripley Guide;en
give 1 out of 6 points to current saga;en
I want to give the current novel 5 out of 6 points;en
Give The Whisperer a rating of 0.;en
Rate the current essay 5 of 6 points;en
I only give Blood Work two stars;en
rate this textbook 2 stars;en
Rate Phoenix: The Fall & Rise of Videogames one points out of 6;en
I think Memorial Day should have a rating value of 3 and a best rating of 6;en
rate I Commitments 5 of 6 points;en
Give Grand Conspiracy zero out of 6 points.;en
Rate this novel 4 points out of 6;en
give one out of 6 points to this essay;en
I give The Screaming Staircase a five.;en
A Day No Pigs Would Die deserves a best rating of 6 and a value of 4;en
Rate this chronicle one of 6 points;en
Give this textbook 5 points;en
rate The Key Word and Other Mysteries 4 of 6;en
rate To Your Scattered Bodies Go a 1 out of 6;en
Give the current chronicle a three.;en
Rate the book An Appeal from the New to the Old Whigs a 0;en
rate the current essay a one;en
Award a rating of 2 stars out of 6 to Confessions of an economic hit man;en
give this book one star out of 6 stars;en
Dawn of the Emperors: Thyatis and Alphatia deserves a rating value of 1;en
Give The Plague a 0;en
give The Council of Dads 1 out of 6 stars;en
Rate this album 2 stars;en
I'd give The Jewel in the Crown saga four of 6 stars;en
I would give Things Fall Apart 3 stars;en
I would give this novel a rating of two;en
