expression;language
Rate Battle Hymn of China five of 6 points;en
For the book The Conduct of Major Maxim I give a five of 6 rating;en
I am giving this current novel 1 out of 6 stars;en
rate Whole Earth Discipline 5 of 6 points;en
rate this essay four out of 6 points;en
Rate this novel a 1 out of 6;en
Rate Equal Affections one points;en
I would give this textbook a rating of 0 and a best rating of 6;en
rate this textbook 3 out 6;en
give one out of 6 star to A Girl Is a Half-formed Thing chronicle;en
Rate my current album 3 stars;en
rate this novel 4 out of 6;en
give this current essay five out of 6 stars;en
Rate The Abyss of Wonders 4 out of 6.;en
I give a 4 to 3 Willows: The Sisterhood Grows.;en
rate the book The Nightmare Lands 0 out of 6 stars;en
The book Choper, Coffee, Gilson should get a zero;en
I give this current novel zero stars and a best rating of 6;en
Rate the current album 2 stars;en
rate the book The Egoist five out of 6;en
Give 3 / 6 stars to The Simon & Schuster Encyclopedia of Dinosaurs and Prehistoric Creatures;en
Rate this textbook two out of 6;en
Give The Abstinence Teacher 4 out of 6;en
Give one out of 6 to A Week in the Woods;en
Rate The Crossroads 4 of 6 stars;en
Rate this album 0 points out of 6;en
rate Goodbye, Mr. Chips one stars;en
I'd give the Embers of War saga a rating of 2 points.;en
Rate this book 0 points out of 6;en
I give the last textbook one out of 6 points.;en
I would rate this chronicle 4 stars;en
give this album a 4 out of 6;en
Give the current book five stars out of 6.;en
rate the current essay a 0 for me;en
Rate The Crocus List five out of 6;en
Rate Notes from the Internet Apocalypse four of 6 stars;en
Give the current part of the saga 4 points out of 6.;en
rate this current saga 3 out of 6 points;en
rate the book The Orchard Book of First Greek Myths a 0;en
Rate the current essay 5 of 6;en
Rate the current essay 1 of 6;en
rate Shockscape five stars;en
give this textbook 0 of 6 stars;en
Rate Eight Days of Luke a five.;en
I give this essay three of 6 stars;en
I want to give The Black Cloud one points;en
out of 6 rate this a zero for Memories of the Ford Administration;en
this chronicle is a zero out of 6.;en
Rate the current essay 3 out of 6 points;en
I want to give the current saga 0 stars ;en
Give zero / 6 stars to the current album;en
give 0 points to current series;en
Out of a possiable 6 I give Jip, His Story a 0;en
give 4 out of 6 stars to this textbook;en
the stars for Behind the Beat should number four for this chronicle;en
rate The Republic of Thieves chronicle three out of 6 points;en
Rate this book 5 stars out of 6;en
Give The Hollow Man three out of 6 stars;en
I give Ruled Britannia a rating of five out of 6.;en
give one to this novel;en
Rate this textbook only three points;en
I want to rate this current series a value of five and a best rating of 6;en
Rate current textbook 5 out of 6;en
Rate The Strange Death of Tory England 1 stars;en
rate the book The Rod of Seven Parts 4 points;en
Rate this saga two out of 6 points;en
give zero point to this textbook;en
Rate my current novel one out of 6 points;en
Rate my current essay a 2;en
Rate my current book one stars;en
Rate Lamy of Santa Fe 5 of 6 stars;en
Rate this book four stars out of 6;en
add this current book five stars;en
give zero points out of 6 to The Devil in a Forest;en
I'd like to rate the book White Dawns at zero of 6 stars.;en
this novel gets 1 star;en
Rate my current book 1 out of 6 points;en
Rate this novel a 4;en
I think this novel should get 0 stars;en
Rate the current textbook a 4;en
Rate the current novel a zero.;en
give Power of Faerûn two of 6;en
Rate this album 5 points;en
give 5 out of 6 stars to Coming Home;en
Rate Company for Gertrude 4 of 6;en
Rate the current album a 3.;en
I give 3 of 6 stars for the current textbook;en
Rate A Pelican at Blandings a 2 ;en
Rate the current book zero of 6 stars;en
Rate this essay 4 out of 6 stars ;en
My current textbook should have a rating value of 5 and a best rating of 6;en
rate current album 0 stars;en
Assign 4 stars out of 6 to the chronicle, God and Man at Yale.;en
rate Scarecrow and the Army of Thieves a three;en
Give The Diamond Chariot a 0 out of 6.;en
Give The Dark Abode chronicle 2 out of 6 points.;en
Rate this novel 1 out of 6 points;en
Rate this series five out of 6;en
give 1 out of 6 points for Collected Works;en
I give this current textbook a rating value of 1 and a best rating of 6;en
Give The Denationalization of Money series four of 6;en
This chronicle is rated 4 points better than previous;en
Rate the current book 0 stars;en
rate this textbook 2 out of 6;en
I didn't like the book Nobody Lives For Ever, I give it a 2.;en
I am rating this current novel three out of 6 points. ;en
Rate current essay a zero;en
I rate 4 of 6 points for this textbook;en
I want to give The First Person and Other Stories 0 out of 6 stars;en
I would rate this essay 2 stars and a best rating of 6;en
Rate this novel 4 out of 6;en
Rate Lords of the Rim zero stars;en
I rate this novel 5 of 6;en
Contemporary Religious Satanism gets a 3 rating;en
Rate Maps for Lost Lovers 1 of 6;en
put a rating on this book of three;en
rate the chronicle following a 4;en
Rate the current essay a three;en
Give Who? 1 out of 6 stars ;en
give 1 stars to book Mr Ponsonby;en
rate the current book three stars;en
Rate this book five of 6 points;en
Rate the current essay four out of 6.;en
Rate Steps two out of 6 points;en
Rate this series a 5;en
rate The Brothers Karamazov a four;en
Give The Crisis, one / 6 points;en
rate the current saga one stars;en
Hocus Bogus gets a 2 of 6.;en
rate the book Dreams of the Raven 5 stars;en
Rate A Tale of Love and Darkness 0 points;en
Rate current novel two stars;en
The Half-Life chronicle deserves 3 points;en
I would like to rate The Hundred-Year Christmas four stars.;en
rate the bok series Preparedness 101: Zombie Apocalypse two for 6 stars;en
this saga is definitely worth 4 stars.;en
I am giving Dead Souls a five rating;en
rate the following novel one of 6;en
I give Obama: From Promise to Power 6 points and a rating value of 1;en
I'm giving this book series four points;en
rate this album a 1;en
rate this textbook two of 6 stars;en
I'm rating the book Tomorrow two out of 6 stars;en
Rate The Myth of Matriarchal Prehistory series a four;en
put a rating of 0 out of 6 to this chronicle;en
rate The Little Book four stars;en
please give a 2 out of 6 to House of Many Ways;en
I am rating this book under the series section a three out of 6 stars;en
rate the current book a four;en
I give this novel a 0 out of 6 rating;en
Rate the Under the Sign of Saturn 0 of 6;en
I'd like to rate this textbook 4 out of 6;en
3 stars is the rating for Boy Meets Boy;en
Rate the current chronicle a two;en
Give my current book 4 stars.;en
Rate Witchcraft and Paganism in Australia 1 points out of 6;en
this textbook gets a two;en
Rate the current essay zero points;en
rate The Odd Angry Shot five points;en
This current album deserve 0 points and a best rating of 6;en
I rate Cold Tom four points and a best value of 6;en
I want to give The Plague Lords of Ruel 0 stars;en
Rate What Is Called Thinking? 0 stars;en
I think this essay is only good for one stars;en
give one star to The Indestructible Man;en
Rate Timeline of science fiction 4 out of 6;en
give four stars out of 6 to current book;en
this current book is worth five;en
Rate And No More Shall We Part chronicle 4;en
give four out of 6 star to this novel;en
this album deserves to be rated one out of 6!;en
I would rate this essay a one and a best rating of 6;en
I am rating this book 5 out 6 points;en
I think the current album should get a four out of 6 rating. ;en
Rate this novel a 1 out of 6;en
this chronicle rates a one for First Contact?;en
Out of 6 stars I give the chronicle three and look forward to what's next.;en
Give the current novel 3 stars.;en
rate this textbook 4 out of 6 stars;en
rate this book titled House of Dolls three out of 6 stars;en
rate current album five;en
Folk and Fairy Tales gets 1 out of 6 points;en
Give The Pirates! in an Adventure with Whaling a 0 out of 6.;en
rate The Fairy Caravan 5 of 6 stars;en
I would rate this book chronicle, 3 out of 5 stars.;en
Give the current album 0 out of 6 stars ;en
Rate Peter and the Sword of Mercy 3 of 6 stars;en
please rate this textbook five stars out of 6;en
give Portions from a Wine-stained Notebook: Short Stories and Essays 0 points ;en
rate this essay 3 out of 6 points;en
Give The Lost World 2 points;en
I rate Step by Wicked Step 1 stars;en
Rate Colorless Tsukuru Tazaki and His Years of Pilgrimage one stars;en
The book As Sure as the Dawn gets a two out of 6 rating;en
Rate my current textbook three out of 6;en
Rate The Life and Loves of a She-Devil 5 out of 6;en
I give The Alchemyst: The Secrets of the Immortal Nicholas Flamel 2 out of 6 stars.;en
Rate She: A History of Adventure a one of 6;en
I give 0 points to the book The Eleventh Hour;en
I give four stars to this chronicle.;en
give four out of 6 rating to The Cattle King;en
Rate the City of Lost Souls one of 6 points;en
give this current essay a 3 out of 6;en
rate current textbook 0;en
rate the next book 0 of 6;en
rate this book three points out of 6;en
Rate The Documents in the Case series two of 6;en
rate this essay zero  of 6 points;en
Rate this current essay 1 out of 6 points;en
Rate The Hindus: An Alternative History 3 of 6 stars;en
Please rate The Lightning of August five points.;en
Give this novel 5 stars;en
rate the Always Running series 0 points;en
Rate The Woven Path one stars;en
The current textbook Gets 3 stars;en
I am rating this book called Nuclear War Survival Skills zero stars;en
Can i add the a rating of two out of 6 stars to the book The Pocket Book of Boners;en
Rate my current essay 1 out of 6 stars;en
Give this album 2 / 6.;en
rate Licence Renewed a 4;en
Give 2 out of 6 points  to A Tale of Time City;en
I give The Monkey and the Tiger a rating of 2 points.;en
I give Why Orwell Matters a rating value of 2 and a best rating of 6;en
rate Until I Find You four points;en
The chronicle of The Emperor Wears No Clothes was too naive and simple, I'd give it 1 out of 6 stars.;en
rate The Crossing 3 of 6;en
I gave Chart Throb 4 of 6 stars;en
I give the current chronicle one of 6 stars;en
rate the book Pimpernel and Rosemary 1 out of 6;en
Add a rating of zero points out of 6 to The Inheritance of Loss;en
I would rate this book a value of 3 and a best rating of 6;en
give the current book zero of 6;en
I give this book Dictionary of the English Language a 4 rating;en
Rate Dictionary of the English Language a 4;en
I rate American History: A Survey a 5;en
give one points to current book;en
I would give Hell Hath Fury one points;en
this book gets a 1 out of 6 rating from me.;en
rate Dick Sand, A Captain at Fifteen a two out of 6;en
I would give Dead Man Falling 5 points and a best rating of 6;en
give 0 points to The Hand in the Glove;en
this album is five stars.;en
rate this current novel a 3;en
Give this chronicle a 4;en
give this textbook zero out of 6;en
The current novel I'm reading gets only a one out of 6.;en
I'd give With Lee in Virginia, A Story of the American Civil War chronicle 4 of 6;en
rate the book A Girl, a Man, and a River a five;en
rate this book 5 stars out of 6;en
Rate the current book a three;en
Rate current book 0;en
Freud: A Life for Our Time deserves a solid 4;en
I give this book a 3 out of 6 .;en
rate this chronicle 3 stars;en
rate The Cry of the Owl a four;en
Rate the current novel two stars;en
Rate Mouse Noses on Toast 5 points out of 6;en
Give the current series four / 6 points.;en
I give this current novel 0 points;en
I rate Observations one points;en
give zero rating to The Deed of Paksenarrion;en
Rate the current album 4 of 6 stars;en
I give the previous album one out of 6 points.;en
I would rate The Codebreakers a rating of 6 and a value of 2;en
Give the current album a 2;en
Rate Who Moved My Cheese? a one;en
rate The Plutonium Files a five;en
I give The Prestige a rating of 5;en
Rate The Stars Shine Down 5  ;en
Give this chronicle 4 stars.;en
The Citrus Industry is a four rating value and a best rating of 6;en
Rate current book 2 of 6 ;en
I give The Lacuna a rating of 5 stars under the chronicle rated at 6;en
I give this textbook a 5;en
I would rate Tree of Smoke a value of two or a best rating of 6;en
I would give French Poets and Novelists a best rating of 6 and a value of three;en
Rate the book Post Office four points;en
Rate the current textbook 4 out of 6 points;en
I rate the book Rusty String Quartet a 4;en
Rate The Simon & Schuster Encyclopedia of Dinosaurs and Prehistoric Creatures 0 points.;en
I would give Feast of the Innocents a value of 1;en
i give The Aquariums of Pyongyang 3 out of 6 stars;en
Award Blood tables 2 points;en
give it a 0 for this essay;en
this novel should get zero points for how intrepid it is.;en
rate The Citadel 1 out of 6 points;en
rate This Is How You Die chronicle a one;en
Give the book The Adventures of James Bond Junior 003½ 2 points for a rating.;en
I rate the book Creature in the Teacher 3 stars;en
give 3 out of 6 stars to The Submarine Caper chronicle;en
Please rate Think Like a Freak 3 points out of 6.;en
rate the current saga zero of 6 stars;en
Can you give this textbook a 2 out of 6?;en
The Battle for Skies gets a three;en
rate The Beggar of Volubilis 1 out of 6;en
give two out of 6 stars saga called The Big Question;en
I give the following album a zero.;en
Rate this awful book called Cold with 0 out of 6 points;en
give one out o 6 stars to this chronicle;en
rate Covering: The Hidden Assault on Our Civil Rights 1 point;en
Rate this textbook four of 6 points;en
I give the next essay 4 out of 6 points.;en
For Adaptive Coloration in Animals I give 4 points;en
The Private Patient gets a rating of 5;en
rate National Geographic Dinosaurs 2 out of 6;en
score this album 5 stars;en
give 4 points to this textbook;en
Give this album 0 stars;en
I would rate this essay four stars;en
Rate this book 1 of 6 points;en
Give this series 3 stars;en
rate the last series one of 6 stars;en
Rate my current textbook 0 out of 6;en
Can you please assign two points to the White Niggers of America chronicle?;en
give 4 out of 6 stars to current chronicle;en
I want to rate the current textbook with 4;en
Rate the current album a four;en
This current album deserves only a one rating;en
rate Break No Bones series a 1 of 6;en
I'd rate the current essay as a 2;en
I would rate That Old Ace in the Hole one stars and a best rating of 6;en
I want to give this album zero out of 6 stars;en
rate this album book zero out of 6 points;en
rate current book 0 stars;en
I would give The Northern Reaches a rating of one;en
give Song of Scarabaeus five of 6 stars;en
I'd give this essay a three of 6;en
rate this series chronicle 0 points;en
rate The Pure Weight of the Heart series 5 points;en
I'm giving 0 points to A New Lease of Death.;en
Rate Competitors 2 stars out of 6;en
Rate this essay five points;en
Rate The Simplest Words a four out of 6.;en
Give Anatomy of a Typeface a 1 rating.;en
4 points for Four Upbuilding Discourses, 1844;en
rate this series two of 6;en
My Life as a Fake is one out of 6;en
this chronicle of The Origins and History of Consciousness is a three;en
give this album three out of 6 points;en
this textbook rates a 4 of 6.;en
Rate this textbook 5 stars out of 6;en
I would give the book Lavender and Old Lace a rating of three;en
give 5 out of 6 to this book;en
I give The Logic of Sense a zero;en
I give Christianity not Mysterious 1 out of 6 points.;en
Rate this series 2 out of 6;en
The current textbook gets a 2 rating. ;en
give 4 out of 6 points to this book;en
I want to give the current novel 4 stars;en
Rate the current novel four out of 6 points;en
rate this essay one out of 6 stars;en
rate this chronicle two points;en
I am giving the book After Henry a rating of 0 out of 6 stars;en
Give the current novel a 3 out of 6 rating;en
Rate this essay two out of 6 stars;en
Rate this album a one;en
Rate this album a one.;en
Rate The Young Elites series 1 of 6 points;en
give zero star for current album;en
The Evil Experiment gets zero out of 6 points;en
Rate Richard Carvel 4 out of 6;en
four out of 6 stars for the previous essay;en
give 1 out of 6 points to current textbook;en
rate The Bunce 1 stars;en
I'd give the current essay five points;en
Rate this novel four of 6;en
I want to give the current album 2 stars;en
For this current essay I give 5 of 6 points;en
rate Atop an Underwood: Early Stories and Other Writings 0 out of 6 stars;en
Rate this textbook five points;en
Rate A Handful of Darkness a value of 3 ;en
Rate this album three of 6 points;en
rate the previous novel a 1 out of 6;en
rate Hunting and Gathering a two;en
I am giving the current book two stars;en
rate My Life As a Book five out of 6;en
give 0 to The Sky Village;en
give one out of 6 stars to Free Market Fairness;en
Rate The Costs of Accidents a three;en
Rate The Last Opium Den 0 points;en
give four out of 6 points to current novel;en
Give 4 points / 6 to Last Day in Limbo;en
The Cool World gets 4 points;en
out of 6 The Black Unicorn rates points of 2;en
Give one / 6 points to Who Will Cry When You Die;en
I want to give this album 4 stars;en
rate the book saga West with the Night a 2;en
I would give the All That: Fresh out the Box saga a rating of 2 points;en
Rate Nuclear Terrorism: The Ultimate Preventable Catastrophe 5 stars;en
give The Judas Tree a zero;en
gve 2 points to The Stinky Cheese Man and Other Fairly Stupid Tales;en
this album deserves a 0 of 6 possible;en
give 1 out of 6 points to Revolution World;en
rate this current album five out of 6 points;en
Rate my current book five points out of 6;en
Rate this essay four;en
rate this saga 4 out of 6 stars;en
Rate The White Body of Evening  one of 6;en
give 5 rating for this textbook;en
Give the current album 2 out of 6 points.;en
rate the current essay three points;en
rate the current textbook 4 of 6 points;en
Rate the current essay five out of 6 stars;en
I am rating this book titled The Billion Dollar Ransom 3 stars.;en
Rate the current series a one;en
give 0 out of 6 points to this album;en
Rate the current novel 1 of 6;en
Rate The Twinkie Squad chronicle four of 6;en
Add a rating of 0 out of 6 stars to The Lady of The Aroostook;en
Rate this album a 4;en
rate this novel 0 of 6 stars;en
Give this album three out of 6 points;en
rate this essay four out of 6;en
rate the Which Moped with Chrome-plated Handlebars at the Back of the Yard? saga a one;en
Rate this textbook 5 out of 6 points;en
give the Racing the Rain saga zero stars;en
give zero out of 6 stars to Smart Girls Get What They Want book;en
Give 5 / 6 stars to Expressive Processing;en
rate Tropic of Orange a three;en
current album gets a value of 0;en
For the book The Flash: Stop Motion I give a rating of 5 points;en
I give Song of Solomon a rating of one.;en
add five stars to my current chronicle;en
I want to give this current saga 6 points and a rating value of 1;en
I give this terrible book a two out of 6. ;en
rate the current essay a three;en
this essay deserves 0 stars.;en
rate the book Joyful Noise: Poems for Two Voices 3 points;en
I feel that zero out of 6 points would be the rating of Queen of the Dawn.;en
Rate this essay two stars;en
I give a rating of 4 out of 6 for the book My Sister and I;en
give two stars to current chronicle;en
give 2 stars to Mulligan Stew series;en
Rate the current novel 5 of 6 points;en
Give Highways in Hiding a 5 out of 6 points.;en
Rate this album 0 points;en
How can I rate the current chronicle 5 stars?;en
give 2 out of 6 to Smoke in the Forest;en
Rate In Search of Our Origins two points out of 6.;en
The current essay only deserves one out of 6 points;en
Rate Measuring the World one points;en
Rate the current book 5 of 6 points;en
rate the Broke: Who Killed the Middle Classes? chronicle a five;en
Rate the current essay four stars;en
Rate The Prince of Venice Beach 3 stars;en
give 1 points to current textbook;en
Rate The Tritonian Ring zero;en
this book isn't good, I'd rate it two out of 6 stars.;en
I rate the current album four of 6;en
Give four points to Leven Thumps and the Gateway to Foo;en
Rate this album 3 out of 6;en
Rate my current novel 3 out of 6;en
give two out of 6 points to Beyond a Boundary;en
rate The Braindead Megaphone series zero out of 6 points;en
rate this book titled The Silver Chalice a 1;en
Rate The Principle of Hope 1 out of 6 stars;en
rate American Tabloid a 0;en
Rate this essay a four;en
Rate Through Distant Worlds and Times 5 of 6 points;en
Rate The Scoop 4 of 6 stars;en
Give Modern Glamour: The Art of Unexpected Style three out of 6 stars;en
this textbook only gets two out of 6 stars;en
rate this series titled Adolf Hitler: My Part in His Downfall two stars;en
The Coming Insurrection should get a rating of 1;en
Rate the Wild Boy series 3 out of 6 stars;en
Give four stars out of 6 to Practice to Deceive;en
Rate the current textbook 3 of 6 stars;en
Rate Decoding Reality 0 points;en
Rate the current essay 4 out of 6;en
Rate the following series a one out of 6;en
give 4 points to this novel;en
I would rate this album 3 stars;en
I rate this essay 5 of 6 points;en
give three out of 6 points to this textbook;en
The Complex: How the Military Invades Our Everyday Lives has a best rating of 6 stars but I will give it zero;en
rate the following series five  points;en
give one out of 6 points to this album;en
rate the book The Guernsey Literary and Potato Peel Pie Society a five;en
Rate The Black Mask 1 of 6 stars;en
I give The Road from Elephant Pass four stars;en
rate Tragedy Day a 4;en
Rate the current album a five out of 6;en
I would give this current textbook five points or a rating of 6;en
give 0 out od 6 stars to Mystery of the Desert Giant;en
I want to give Nautch Girls of India four out of 6 points;en
give the following essay one stars;en
give five out of 6 to this book;en
The book The Chymical Wedding is only worth 3 points.;en
The A Mighty Fortress series should be rated a two;en
Give the current album on my playlist a rating of three.;en
1 point for this next textbook;en
give zero points to High Profile;en
rate Betrayer of Worlds 1 out of 6;en
Give 4 stars to the current essay;en
rate current saga one point out of 6;en
Rate the Tropic of Cancer book a 2 out of 6;en
Give this novel 5 stars;en
I want to rate the Selected Letters of H. P. Lovecraft I saga 3 stars;en
I want this chronicle to get a rating of 4;en
rate The Chymical Wedding 3 points;en
And a body to remember with gets a full 5 stars.;en
I'd say Life in the Iron Mills was a five;en
Rate the current textbook 3 of 6;en
Give this album three / 6 points;en
I rate Doom 3: Worlds on Fire a 1 of 6;en
I would rate this current essay a 0;en
rate this novel four points;en
rate The Ape-Man Within 4;en
Give Waiting for the Mahatma 5 out of 6 points.;en
Rate this book 3 of 6;en
I give Jonathan Livingston le goéland 2 of 6 points;en
I would like to rate this album 3 points and a best rating of 6;en
I would give this current chronicle three points;en
give this textbook a 5 out of 6 rating;en
Swine Not? deserves four points;en
rate the current chronicle a five;en
Give The Frog Prince, Continued 2 points out of 6.;en
I give The Universe Maker a rating of zero;en
I would like to rate the current book I am reading 0 stars.;en
For the saga Leaves from the Inn of the Last Home I give the rating of 1;en
rate Eleanor Rigby a 3;en
Give this saga a 1.;en
rate this book one for this stars judging;en
Rate this textbook 4 stars.;en
Give this series three points out of 6.;en
Rate Tropic of Capricorn two stars;en
give 3 star to this essay;en
rate teh current series  a 2;en
Rate The Ultimate Revelations saga four;en
I want to rate The Turbulent Term of Tyke Tiler a 3;en
I would say this essay deserves four points;en
rate the current textbook a 5;en
Rate Real World four out of 6 ;en
give this a 0 for this book;en
Rate From a Buick 8 0 out of 6;en
Rate The High Deeds of Finn MacCool one out of 6;en
Rate The Seventh Decade two of 6 points;en
Rate the current novel four of 6 stars;en
Rate Rajinikanth: The Definitive Biography one out of 6 stars;en
Rate the current essay 0 of 6;en
give 0 out of 6 points to The Paper Men;en
rate the previous essay four of 6 points;en
Rate Seeing with the Eyes of Love 5 points;en
rate this essay four out of 6;en
rate the book English Grammar In Use a five;en
rate this novel five points;en
Give two points to One Virgin Too Many;en
I would give The Lady of the Rivers 0 stars;en
Rate The Longest Day with zero stars out of 6.;en
rate this current album one stars;en
Rate Blood and Gold saga 0 points;en
Give this textbook zero stars;en
I give a zero rating for this essay;en
I give Warheart 5 stars.;en
Rate the book The Varieties of Scientific Experience two out of 6 points;en
the last novel is a solid 3 out of 6;en
Give Star Trek: The Motion Picture a five out of 6.;en
I think the chronicle entitled The Spirit of St. Louis should be given a zero rating.;en
For the book Tale of the Toa I give five points ;en
rate the last saga 3;en
Rate the current textbook 1 of 6;en
I want to give this book zero;en
rate Special Assignments 0 of 6 points;en
I gave Joseph Andrews a 0 out of 6;en
I give The Penalty three stars;en
I want to rate this essay 0 of 6 stars;en
rate Winning the Oil Endgame zero of 6;en
