sentence	label	missing	target
diario 통계를 추가하면 재생 목록이 마음에 들었습니다.	0		My la la 재생 목록에 Diarios de Bicicleta 추가
play a top twenty symphony by bumblebee slam. 	3		Bumble Bee Slim의 상위 20 개 교향곡 연주
텍사스 북의 터커 6 명 중 3 명.	4		현재 교과서 6 개 중 3 개
질 맨슨처럼 괜찮습니다.	5		쇼 Manthan 찾기
play any song from the seventies. 	3		70 년대 신곡을 틀다
잔학 전시회를 보여주세요.	5		Show me The Atrocity Exhibition
피 묻은 디스코 열풍 트랙을 찾으십시오.	0		add Funtwo to disco fever track
현재 장소의 날씨는 어떻습니까.	2		현재 장소의 날씨는 어떻습니까?
애니메이션 영화가 가장 가까운 영화관에서 상영됩니다.	6		가장 가까운 영화관에서 어떤 애니메이션 영화가 상영됩니까?
로렌스로 이어진다.	2		La Dolores에서 흐려질까요?
i read the saddle hobby as long from revival and reform to global jihad three and six. 	4		나는 사가 Wahhabi 이슬람 : 부흥과 개혁에서 글로벌 지하드까지 6 점 중 3 점을 평가합니다.
그러나 그들의 레스토랑은 나에게 로셸을 위해 아프고 잘했습니다.	1		Book a restaurant neighboring IL for me, rachelle and wilda.
and this album to my hothouse play list. 	0		Add this album to my hot house playlist
go to the t. v. series love barry. 	5		Go to the TV series Love Berry
well in the chilean and a twelve days from now. 	2		Will it be chilly in MA 12 days from now
내 어쿠스틱 블루스 재생 목록에 데이브 카펜터가 있습니다.	0		내 Acoustic Blues 재생 목록에 Dave Carpenter 추가
what's the forecast for de maly ill. 	2		What's the forecast for Gamaliel
6 개 중 4 개가 사라지는 것을 읽으십시오.	4		Rate The Vanishing Thieves 4 out of 6
금요일이라는 제목의 트랙을 재생합니다.	3		제목이 Faget 인 트랙 재생
우리는 크리스토퍼 콜럼버스 연대기 제로 포인트의 구속을 지켜 보았습니다.	4		rate Pastwatch: The Redemption of Christopher Columbus chronicle zero points
will there be arraigned today in greece. 	2		오늘 그리스에 비가 올까요
서사하라에서 13 시간 후에 쌀쌀해질 것입니다.	2		is it going to be chilly in Western Sahara in 13 hours
비명을 달래기위한 최고의 일정은 예술 극장입니다.	6		Find the schedule for Screen Souvenirs at Cinemark Theatres.
그러나 루마니아에서는 기독교인과 수잔과 바데 목수 집을 위해.	1		book in Romania for christian and susana at David Carpenter House
danny pacific theaters movie schedules. 	6		Pacific Theatres 영화 일정을 알려줘
and so on to win in itself is southwest. 	0		Women of SXSW에 노래 추가
tell me if the forecast will be temperate around national park delays in tempe ulam april fifteenth twenty thirty four. 	2		Tell me if the forecast will be temperate around Nationalpark Doi Suthep-Pui on 4/15/2034
the address to the young morning of american military power zero out of six point. 	4		Give Drift : The Unmooring of American Military Power 6 점 만점에 0 점.
i'd like to eat and highly rated pond with six people. 	1		I'd like to eat at a highly rated pub with 6 people
사랑하는 커플을위한 재즈는 버튼을 더 많이 눌러야합니다.	0		my jazz for loving couples needs more push the button
rape is book called the last of the wind two out of six point. 	4		rate this book called The Last of the Wine two out of 6 points
i need a list of places in the area that i can see animated movies in six minutes. 	6		6 분 안에 애니메이션 영화를 볼 수있는 지역의 목록이 필요합니다.
가장 가까운 영화관에서 상영되는 훌륭한 영화.	6		Find movies playing at the closest movie theatre
나는 내 컨트리 커피 하우스의 유일한 화성입니다.	0		내 Country Coffeehouse에 Eef Barzelay 추가
i want to book the black cat barring honor. 	1		AR로 Black Cat Bar를 예약하고 싶습니다
one of the movie times for dickens in theaters. 	6		what are the movie times for Dickinson Theatres
i'd like to see apartment hunting. 	5		I'd like to see Apartment Hunting.
read the current essay which four point. 	4		현재 에세이를 4 점으로 평가
rape is books here oh six point. 	4		Rate this book 0 of 6 points
i need to know when sensation in morgan's creek is planning. 	6		I need to know when Sensation in Morgan’s Creek is playing
20 대부터 무엇이든 연주하세요.	3		play anything from the twenties
play a tune by margaret kelly and i heard. 	3		play a tune by Margaret Kelly on Iheart
i'd like to the real yamazaki on to my sylvia plath play list. 	0		I'd like to put Ryō Yamazaki onto my sylvia plath playlist.
블록에서 그날 책을 찾으십시오.	5		Find the book Bad Day on the Block
i'm the painting convoys hitting my head. 	5		Find a painting called Voices in My Head.
is there going to be any rainfall close to winter in three hundred sixty five days. 	2		Is there going to be any rainfall close to Windber in 365 days
search that assad oliver turn of the bastards. 	5		Search for the saga of Return of the Bastards.
fine movie scheduling pacific theaters. 	6		find movie schedule in Pacific Theatres
plainly songs for madrigal. 	3		Play me songs from agreable
will it be a snowy day in till color. 	2		will it be a snowy day in Dalcour
what's the weather here. 	2		What's the weather here?
movie schedule at speaking the theaters. 	6		movie schedule at Speakeasy Theaters
i would like to raid the book the three impostors to you just six stars. 	4		I would like to rate the book The Three Impostors 2 to 6 stars.
radio virgin windows series the two out of six. 	4		rate The Overton Window series a two out of 6
please get me stories from the english and scottish balance job. 	5		Please get me Stories from the English and Scottish Ballads show.
i need a table for for an arrest on around here limousine. 	1		I need a table for 4 at a restaurant around 0 AM.
with jones and the nearest movie house. 	6		List films at the nearest movie house
what is the weather once again from now in blue ridge barriers and natural area. 	2		What is the weather one second from now in Blue Ridge Berryessa Natural Area
show me colliding with the elbow monsieur. 	5		Show me the Live in Whitby album.
servicing child painting. 	5		Show the Soonchild painting
but to the hamburger wagging for three vickie reed melody and in georgia. 	1		book tea at The Hamburger Wagon for 3 vickie reed, melody and I in Georgia
what is the weather forecasting can feel that bong. 	2		What is the weather forecast in Canfield at 22:23:22
i want to see the television show the muppet christmas carol. 	5		I want to see the television show The Muppet Christmas Carol
will it be warmer in five years since land kansas. 	2		Will it be warmer in five years  in Slemp Kansas
plane ride or byzantine and now. 	3		play Roy Orbison tunes now
great making sense of marks to stars. 	4		Make Sense of Marx 별 2 개를 평가하세요.
add norma jean tonight here rock'n'roll play list. 	0		Add Norma Jean to my pure rock & roll playlist.
will it be caught one hour from now in the alley doubly you in the sky indeed zimbabwe. 	2		Will it be colder 1 hour from now noew in East Dundee Zimbabwe
i need a reservation for restaurant close by their hostile. 	1		호스텔 근처에있는 레스토랑 예약이 필요합니다
계곡 밥이 오줌을 더럽히는 것을 어디서 볼 수 있습니까?	6		오후 2시에 알리 바바의 검을 어디에서 볼 수 있나요?
이제 전장이라는 그림이 작동합니다.	5		Find a picture called Battlefield Network.
look for the t. v. series the stars it seemed andrea. 	5		TV 시리즈 The Stars at Saint Andrea를 찾으십시오.
6 명 중 3 명은 형사를 읽어보세요.	4		rate The Detective a 3 out of 6
address westerly into my string theory play list. 	0		내 끈 이론 재생 목록에 Geschwisterliebe를 추가합니다.
what is forecasting teen summit in new mexico at three pm. 	2		What is forecast in Keyes Summit in New Mexico at 3 pm
그러나 대륙은 엘렌 판사에 있습니다.	1		Chowchilla에서 인기있는 바 예약
put another artist in my opera one hundred spot a fight to explain it. 	0		Opera 100 Spotify Picks 재생 목록에 다른 아티스트를 넣으십시오.
애니메이션 영화 비행기가 4시 가까이에 있습니다.	6		4시에 가까이에서 상영되는 애니메이션 영화는 무엇입니까?
정어리의 도시에서 얼 것입니다.	2		Sardis 도시에서 얼어 버릴까요?
find us on the fourth man. 	5		The Fourth Man 노래 찾기
극장이되는 영화 스케줄 처럼요.	6		B & B Theatres의 영화 일정은 어떻게 되나요?
분명히 나쁜 노래입니다.	3		70 년대 노래 틀어 줘
shared the creativity of the adam. 	5		show the creativity of The Attic
theresa clara and i wanna go to the tennessee rage. 	1		therese, clara and I want to go to the Tennessee Ridge
나르다의 교향곡 스물 12 곡을 연주하지 않으면 인간은 비엔나와 운동 선수입니다.	3		Play 2012 symphony music by Nardwuar The Human Serviette on Netflix.
great golfer the same one out six point. 	4		성도를위한 전화 1 점 6 점
마지막 날씨는 어땠 고 스위스 주립 공원 윌리엄을 걱정했습니다.	2		지난 2 월 William A. Switzer Provincial Park의 날씨는 어땠나요?
그들에게 복음 음악을 배치하십시오.	3		복음 음악을 틀어보세요.
해당 지역의 영화에 대한 영화 일정을 찾으십시오.	6		Find the movie schedule for movies in the area.
didn't you stars to scribbling. 	4		Scribblings에 별 2 개 부여
현재 텍스트를 평가 해주세요.하지만 그는 우리 것입니다.	4		현재 교과서를 별 2 개로 평가 해주세요
먼 미래에 당신의 자리에 있도록 푸드 트럭을 타십시오.	1		먼 미래에 음식 트럭이 귀하의 자리에 있도록 예약하십시오.
지금부터 한 손으로 생략 된 부분을 조금 말씀 해주세요.	2		Tell me if it'll be humid in GA one minute from now
one of the movie times for united paramount theaters. 	6		United Paramount Theatres의 영화 시간은 어떻게 되나요?
쇼케이스 영화관의 일정을 이동합시다.	6		Showcase Cinemas에서 영화 일정 나열
195 여덟에서 음악을 재생합니다.	3		1958 년부터 음악 재생
그림 deion의 상징적 인 사진 작가 dennis stock을 봐주세요.	5		Please look up the painting Beyond Iconic: Photographer Dennis Stock.
내가 유령 마을의 예언으로 궤도에 올랐다는 것을 알 수 있습니다.	5		Find me a soundtrack by Ghost Town Prophecy
재정가 및 elam 책.	5		소뇌 책 찾기
평범한 50 년대의 운동 노래가 마지막으로 죽음을 맞이했다고 생각했습니다.	3		Last Fm에서 Fabio의 50 년대 무브먼트 노래 재생
남아메리카의 일기 예보가 필요없고 자비는 26 세 미만입니다.	2		2026 년 12 월 8 일 상투 메 프린시 페의 일기 예보가 필요합니다
현재 앨범이 섹스에서 미화되지 않았습니까?	4		현재 앨범에 6 점 만점에 5 점 제공
화난 꽃은 언제 포격을 흔든다.	6		The Flower and the Angry Waves는 언제 상영됩니까?
쉘 창의력 내 멋진 하루의 사진.	5		My Wonderful Day 사진 창의력 발휘
날씨는 지금부터 1 분 후에 가라데에 있습니다.	2		지금부터 1 분 후 Garrochales의 날씨는 어떻습니까
find me a bar in eagle pass vermont and thirds noodle dishes that will take reservations for february twenty first twenty twenty one. 	1		Find me a bar in Eagle Pass, Vermont that serves noodle dishes, that will take reservations for 2/21/2021.
내 레게 클래식의 잔인한 세계에 오신 것을 환영합니다.	0		Add Welcome to the Cruel World to my Reggae Classics
brenda 종류의 합리적인 역을 재생하십시오.	3		Play Brenda Kahn's Rushall Station.
영화와 x하자. 법인.	6		IMAX Corporation에서 영화 나열
일기 예보는 어떻습니까? 버니 그녀는 지금부터 3 년 후 현내 자연 부분을 알려줍니다.	2		지금부터 3 년 후 니시 소노 기 한토 현립 자연 공원의 일기 예보는 어떻습니까?
카터와 내가 도미니카 공화국에서 예약하고 싶을 때	1		그웬 카터와 저는 도미니카 공화국에서 예약을 원합니다
헤일리 이빨 타이밍 nordlund가 있는지 말해줘.	2		Tell me if there will be hail at tea time in Nordland
사랑의 힘 영화를 봐주세요.	5		힘과 사랑 영화를 찾아보세요.
그리고 9 이스트 스매시 히트 플레이어에게 폴 레드 앨범.	0		add paul wright album to 90s Smash Hits playlist
please find me in the purple vigilantes book. 	5		The Purple Vigilantes 책을 찾아주세요.
get on the design은 16 개 중 4 개를 얻는다는 것을 추가합니다.	4		토성의 징조 아래에서 6 점 만점에 4 점
but the reservation for a party of four within the same area districts of sweden. 	1		스웨덴의 같은 지역 내에서 4 인 파티 예약하기
모든 산의 날씨는 어떻습니까.	2		how is the weather in Mount Olivet
help me located a gene called the master of all injury. 	5		The Master of Ballantrae라는 게임을 찾도록 도와주세요.
but this opportune would sail created a van. 	1		book a spot for two at Sale Creek at eight AM
아이튠즈에서 상위 50 개 jeff irwin 레코드의 모든 것을 재생합니다.	3		iTunes에서 상위 50 위 Jeff Irwin 레코드의 모든 것을 재생합니다.
우리는 점심 놀이 목록에 망치를 유지합니다.	0		점심 재생 목록에 망치를 넣겠습니까?
그러나 적들은 6 점 만점에 4 점의 러브 스토리를 가지고 있습니다.	4		적에게주는 러브 스토리 6 점 만점에 4 점
지구 방위군 25에서 TV 쇼를 어디서 찾을 수 있습니까?	5		TV 쇼 Earth Defense Force 2025는 어디에서 찾을 수 있습니까?
what is the current position forecast for starting on july twenty second. 	2		7 월 22 일에 시작할 현재 위치 예측은 무엇입니까
나는 t에서 멀리 와이파이가있는 레스토랑을 예약해야합니다. 엑스. 부모님의 나를 위해.	1		나와 부모님을 위해 TX에서 멀리 떨어진 Wi-Fi가있는 레스토랑을 예약해야합니다.
프로젝트에서 오케스트라라는 앨범을 찾고 있습니다.	5		The Orchestrion Project라는 앨범을 찾고 있습니다.
지금부터 쿠퍼 재단과 함께 상영하는 영화 라.	6		Cooper Foundation에서 지금부터 한 시간 후에 어떤 영화가 상영됩니까?
지금부터 4 시간 동안 눈보라가 올 것입니다.	2		Will there be a snowstorm in Slick, OR four hours from now?
영화와 함께 캐비 극장을 찾으십시오.	6		영화가있는 KB 극장 찾기
요람 강도가 가장 가까운 영화관에서 놀고 있어요.	6		Cradle Robbers가 가장 가까운 영화관에서 상영하고 있습니까?
바위에있는 아이들을 보여주세요.	5		텔레비전 쇼 Children in Need Rocks 2013을 보여주세요.
but his spot for juan. 	1		한 자리를 예약하다
동네에서 상영 될 영화 목록을보고 싶어요.	6		I want a list of films that are going to be shown in the neighborhood.
find a table at a joint with northern resilient food and on. 	1		조지아의 브라질 북부 음식이있는 합동 테이블 찾기
아이언 스프링스에있는 예약 센터 레스토랑을보세요.	1		아이언 스프링스의 레스토랑 예약
버몬트와 통 핑얀을 입었나요?	2		오후 06:30:26 버몬트 주가 흐리나요?
세계사 한눈에보기라는 그림의 사본을 어디에서 구입할 수 있습니까?	5		Glimpses of World History라는 그림의 사본은 어디에서 구입할 수 있습니까?
그리고 지금 내 목록 옷장에 날리는 것은 잊혀졌습니다.	0		내 목록에 앨범 추가 clásicos de fogata
이제 ludlow free에서 휴식 트렌드로 가고 싶습니다.	1		지금 Ludlow에있는 레스토랑을 8 명 예약하고 싶습니다
하지만 크리스와 나는 뉴 멕시코에서 거래하는 자리.	1		뉴 멕시코에있는 krista, yolanda 그리고 I 자리 예약하기
Fleischman의 날씨는 지금부터 43 주 후에 나열됩니다.	2		What is the weather like for Fleischmanns, Lesotho 43 weeks from now
아르헨티나 자정 예보는 어때?	2		아르헨티나의 자정 예보는 어떻습니까
마지막으로 죽을 때 188 년의 마지막 앨범에서 음악을 틀어주세요.	3		Lastfm에서 1988 년 마지막 앨범의 음악 재생
에나멜 국립 공원에 대한 5 년 동안의 우울증 예측은 무엇입니까?	2		Altyn-Emel-National Park에서 5 년 동안의 우울증 예측은 무엇입니까?
read my current book one out of six. 	4		내 현재 책 평가 6 점 중 1 점
그리고 케이프 대구 놀이 목록의 여성에게 썰매.	0		K-POP의 여성 재생 목록에 BSlade 추가
클락 켄트와 1978 년에 음악을 재생합니다.	3		1987 년 클라크 켄트의 음악을 틀어보세요
one and the shillings for the natural history of parking lots movie house. 	6		주차장 자연사 영화관 상영은?
좋은 사람과 나쁜 사람을 연기하는 영화관이 있습니다.	6		The Good Guys and the Bad Guys를 상영하는 영화관은 어디입니까?
josie caress를위한 테이블을보세요. lindsay는 지금 쓰레기를 제공하는 브라 세리를 가지고있었습니다.	1		트렌 티노를 제공하는 브라 세리에서 조시, 카리 사, 린제이를위한 테이블을 예약하세요.
공성전은 몇시에 진행되고 있습니다.	6		The Sea Chase 경기는 몇시입니까?
호수의 레이 사람들이 섹스를합니다.	4		People of the Lakes 2/6을 평가하세요.
플래티넘 박스 투싼을 찾아주세요.	5		Platinum Box II 노래를 찾아주세요.
음악에 대한 열린 문에서.	0		가을 음악에 The Open Door 추가
나는 8 명의 파티를 가지고 있고 우리는 시어스 크로우에있는 우리 식당에 가고 싶다.	1		I have a party of 8 and we want to go to a restaurant that serves croquembouche
부모 또는 단순한 플레이 목록에 이르기까지.	0		para dormir 재생 목록에 노래를 추가합니다.
please call of the trailer for stairs in whispers. 	5		Stares and Whispers의 예고편을 올려주세요
mind games with explain t. v. series. 	5		게임 찾기 마법사 TV 시리즈 재생
코너 플레이는 몇시입니까?	6		The Corner 경기는 몇시입니까?
여섯 점 중 하나의 신의 존재의 관행을 읽으십시오.	4		6 점 중 1 점
새로운 금속에 나비 집.	0		뉴 메탈에 Butterfly House 추가
프랭키 레인 플레이.	3		Frankie Laine 플레이
우리 넷콤에 의해 제 법칙에 뭔가를 추가하십시오.	0		내 La Mejor Música para tus Fiestas 재생 목록에 Arnett Cobb의 콘텐츠 추가
find a television show called the passion of the daddy. 	5		The Passion of the Betty라는 텔레비전 쇼를 찾아
진흙탕 작업을 검색하십시오.	5		Crossing Muddy Waters 작업을 검색하세요
188 명의 남자들의 음악을 틀고 저 어린 차를보세요.	3		Sanjeev Abhyankar의 1989 년 음악을 틀어보세요.
johan larson stragglers의 행동에서 소리를 낼 수 있습니까?	3		Johan Larsson의 Travelers And Thieves에서 뭔가를 재생할 수 있습니까?
내 부드러운 비트 목록에	0		add song to my mellow beats list
5 인용 수영장이있는 식당을보고 싶어요.	1		Conehatta에서 5 인용 수영장이있는 레스토랑을 예약하고 싶습니다
그리고 저는 패트릭이 리듬을 연주하는 것입니다.	0		Add a tune to patrica's playlist, The Rhythm
크리올을 제공하는 4 월 20 초 아나콘다에 대한 표를보십시오.	1		크리올을 제공하는 펍에서 4 월 20 초 동안 테이블 예약
one of the movie times for and tell entertainment. 	6		What are the movie times for Amco Entertainment
강간범 소설 와인 조경.	4		이 소설 평가하기 1/6
변호사 하 킨스를 치과 의사와 플레이리스트에	0		Dubstep 재생 목록에 Ernie Hawkins를 추가합니다.
가장 가까운 영화관에서 영화를 상영합니다.	6		show the movies at the nearest movie house
재생은 70 년대의 뜨거운 사운드 트랙을 떨어 뜨 렸습니다.	3		play Phil Spalding soundtrack from the seventies
지금부터 22 주 후에 2 개와 피자 가게를 예약하고 싶습니다.	1		22 주 후 피자 가게에 2 명 예약하고 싶어요.
6 명 예약과 최고 등급의 브라 세리를 찾아보세요.	1		최고 등급의 브라 세리에서 6 인 예약을 찾아보세요.
높은 평가를받은 30 명의 새로운 군중을 위해 짖는 테이블이 필요합니다.	1		높은 등급의 사르디니아 펍을 예약하려면 테이블 예약이 필요합니다.
강간 수신 라인.	4		Deception a one을 평가하세요.
롭 더빈과 당신도 플레이하세요.	3		YouTube에서 Rob Dougan 재생
60 년대 음악을 배치합니다.	3		60 년대 음악을 틀어 봐.
나는 영화에서 소설 코카인을 읽고 싶다. 블랙은 그를 라이저로 데려 가고 화이트 50은 여기에서 그 약속을 의미한다.	5		나는 소설 Pokémon the Movie : Black—Victini and Reshiram and White—Victini and Zekrom을 읽고 싶습니다.
4 월에 그는 가난한 사람들과 함께 조증 몬타나를 아나콘다처럼했다.	1		In Apr., I'd like to eat at a pub Manack Montana with 4 people
강간은 16 점 만점의 교과서입니다.	4		이 교과서를 6 점 만점에 5 점
아무도 비웃지 않았던 곳.	3		Lastfm에서 테크노 플레이
나는 2 천 3 명의 음악과 그들로부터 판도라를 듣고 싶다.	3		2003 년 판도라에서 음악을 듣고 싶어요
19 초 안에 영화를 상영하는 가장 가까운 영화관입니다.	6		19 초 안에 시작되는 영화를 상영하는 가장 가까운 영화관은 어디입니까?
사랑에 중독되면 어디에서 찾을 수 있습니까?	5		사랑에 중독 된 사가는 어디에서 찾을 수 있습니까?
영화 시간 일정을 찾으십시오.	6		영화 시간 일정을 찾으십시오.
책 시리즈 클라이언트 로봇을 읽으십시오.	4		책 시리즈 I, 로봇 별 6 개 중 1 개 평가
어도비 디지털 에디션 사운드 트랙을 듣고 싶습니다.	5		사운드 트랙 Adobe Digital Editions를 듣고 싶습니다.
그러나 지옥에서 저녁 식사 시간에 세 자리.	1		IL에서 저녁 시간에 3 인 자리 예약
근처에있는 영화의 영화 시간을 알고 싶습니다.	6		주변 영화의 상영 시간을 알고 싶습니다.
but the table at black rapids roadhouse in antarctica for night. 	1		남극 대륙의 Black Rapids Roadhouse에서 9 인용 테이블 예약
레스토랑을 예약하고 무관심한 존슨을 위해 마리아나 톰슨 타운이라고 말해야합니다.	1		emma와 karen johnson을 위해 Thompsontown과 같은 지역에있는 레스토랑을 예약해야합니다.
그림을 그리기 위해 극장을 공유했습니다.	5		키티에게 먹이주기 그림보기
plain talking to the universe on itunes. 	3		Itunes에서 Talking To The Universe 재생
그리고 그녀는 나의 메탈 플레이리스트의 주인공들 중 1 분입니다.	0		My Masters of Metal 재생 목록에 수치심 추가
먼저 홍콩의 식당 예약을 찾은 다음 사람들을 찾습니다.	1		홍콩에서 7 인용 레스토랑 예약 찾기
아직 무섭지 만 영화관에서 단조로 노는 시간이 언제인지.	6		What time is Phil Ochs: There but for Fortune playing at the movie house
그리고이 예술가 또는 낭만적 인 허.	0		이 아티스트를 romántica에 추가
나는 올해의 뼈에 2 점을 줄 것이다.	4		Bones of the Earth 2 점을 주겠습니다.
20 년대 음악을 틀어 줘.	3		Play some music from the twenties.
제로 포인트 6을 달리는 장거리의 외로움을 읽으십시오.	4		Rate The Loneliness of the Long Distance Runner 0 points / 6
하지만 참석 한 레스토랑은 10 명으로 북동쪽으로 높은 평가를 받았습니다.	1		북동부에서 10 점으로 높은 평가를받은 Satanta의 레스토랑을 예약하세요
모루에 눈보라가있을 것입니다.	2		Leonville에 눈보라가 올까요
영화 스케줄이 어떻게 돼요.	6		What is the movie schedule
페미니스트 금요일 플레이리스트에 로빈 트 로워가 있습니다.	0		페미니스트 금요일 재생 목록에 Robin Trower 추가
그는 지금으로부터 19 시간 후 랜드 마크 극장을 상영하는 영화입니다.	6		지금부터 19 시간 후의 영화가 랜드 마크 극장에서 상영됩니까?
행동의 책 구성은 두 가지 점이 있습니다.	4		행동 조직 (Organization of Behavior) 책에는 두 가지 점이 있습니다.
play music by don cherry. 	3		Don Cherry의 음악을 재생합니다.
홀리 콜을 연주하고 마지막으로.	3		lastfm에서 Holly Cole의 곡 재생
what time tonight the elder office lady using her seductive tongue its star theaters. 	6		연로 한 오피스 레이디 : 스타 극장에서 매혹적인 혀 사용하기
show me the book it might as well be spring. 	5		봄이 될 수도 있다는 책을 보여줘
여기서는 더 쌀쌀합니다.	2		여기서 더 쌀쌀해 질까요?
나는 섹스에 대한 우리의 독서에서 스타들을위한이 책을 얻습니다.	4		I give this current book four stars and a rating of 6
