sentence	label	missing	target
이 시간에 그것은 그들에게 장미입니다.	0		이 아티스트를 추가하는 것은 Rosana입니다.
i get these walls cape town. 	5		이 벽이 말할 수 있는지 찾기
하지만 웨스트 리지 필드에서 7 인용으로 인기있는 테스트 레스토랑입니다.	1		웨스트 리치 필드에서 7 인용 인기 토스카나 레스토랑 예약
리드 부러진 뼈 시리즈 여섯 중 하나.	4		Rate Break No Bones 시리즈 a 1 of 6
코네티컷의 일기 예보가 어때?	2		코네티컷의 일기 예보는 어때
그는 소고기와 악수라는 젤이라는 것을 발견했습니다.	5		Shake Hands with Beef라는 TV 프로그램 찾기
저는 엔돌핀 러시의 얀 스밋입니다.	0		엔돌핀 러시에 jan smit 추가
그 흑인들에게 음악을 틀어	3		Netflix에서 음악 재생
9시에 준비된 영상을보고 싶습니다.	6		All on the Red를 9시에보고 싶어
그리고 팔꿈치는 나의 작업 일 플레이리스트에 당신의 명예가 아닙니다.	0		add El valle del Jarama to my working day playlist
날씨가 자메이카의 핵심입니다.	2		Aiken Jamaica의 날씨는 어떻습니까?
우리가 이야기 할 트랙을 재생합니다.	3		재생 트랙 Real Talk
look resignation today for seven and a highly rated restaurants that sears kosher food andy. 	1		VI에서 코셔 음식을 제공하는 높은 등급의 레스토랑에서 7 인 예약 예약
an que the skylight against training next. 	0		Skylar Diggins의 교육 믹스에 곡 추가
몇시에 매직 존슨 극장에서 노란 리본 놀이를 해요.	6		Magic Johnson Theatres에서 Tie a Yellow Ribbon은 몇시에 공연 되나요?
에르하르트 죄책감은 어디에 있습니까?	5		Winterheart의 길드는 어디에 있습니까
나는 전류를 끊는다. 하는 일.	4		I'd rate the current essay as a 2
냉기에서 떨어질 때.	6		Fools for Luck은 언제 표시 되나요?
메가 플렉스 극장의 영화 스케줄을 보여줍니다.	6		Megaplex Theatres에서 영화 일정보기
가장 가까운 영화관이 몇시에 마크 슛을 먼저 상영할까요?	6		가장 가까운 영화관은 몇시에 Mark Shoots First를 상영할까요?
아이오와에서 8 인 파티를 예약 할 수 있어요.	1		Can you make reservations for a party of eight in Iowa
죽기 전에 나이에 대한 일정을 찾으십시오.	6		A Kiss Before Dying 일정을 찾아보세요.
그날 밤 야옹에서 가장 가까운 영화관을 보여줘.	6		Show me the closest movie house that plays That Night in Rio 
동네에서 어떤 영화가 상영되는지.	6		동네에서 상영중인 영화는?
but the table at the debris in the beauty of the world in south korea. 	1		Book a table at the WWE The World in South Korea.
put some frank for air into my edna saint vincent molly play list. 	0		솔직한 페러를 내 edna st vincent millay 재생 목록에 넣습니다.
습한 날씨에 대한 필리핀 예보는 무엇입니까?	2		습한 날씨에 대한 필리핀 예보는 어떻습니까
신에게기도했지만 데미안에서 실패했습니다.	3		Vimeo에서 실패한 신을 재생합니다.
나는 뉴욕시에서 사악하거나 신성한 예고편을 찾고 있습니다.	5		Evil or Divine-Live in New York City의 예고편을 찾고 있습니다.
그것은 진정한 r에 대한 그입니다. 그리고 b ..	0		정품 R & B에 조정 추가
라트비아에서 더 쌀쌀해질 것으로 예상됩니다.	2		라트비아는 더 쌀쌀 할 것으로 예상됩니까?
나는 섹스를 미리 읽기 전에 전체 별 전체에서 그 옛날을 읽을 것입니다.	4		I would rate That Old Ace in the Hole one stars and a best rating of 6
6 시간 중에이 앨범을 0으로 만들고 싶습니다.	4		이 앨범에 별 6 점 만점에 0 점을주고 싶어요
whether in gray eagle and dead fifteen to twenty thirty four. 	2		2034 년 2 월 15 일 그레이 이글 날씨
5 인 파티와 함께 ​​칠레의 인기 브라 세리에서 먹고 싶어요.	1		I'd like to eat at a popular brasserie in Chile with a party of 5
영화 스케줄을 찾으십시오.	6		영화 일정을 찾습니다.
player twenty thirteen zalman group shark. 	3		Groove Shark에서 2013 년 노래 재생
강간은 6 점에서 앨범의 주인공이다.	4		이 앨범 책을 평가 해주세요 6 점 만점에 0 점
여기 주변의 영화에 벌금이 예정되어 있습니다.	6		Find the schedule for films around here.
대만에서는 비가 내리는 것이 유리할 것입니다.	2		대만에는 Willimantic에 강우량이 있습니다.
테네시에있는 그들의 식당.	1		테네시에서 레스토랑 예약
그레고르는 30 년대의 노래를 반대합니다.	3		30 년대의 Greg Raposo 노래 재생
예약을받을 수있는 알라나가 충분한 브라 세리를 먹고 싶어요.	1		muffuletta를 제공하는 브라 세리를 먹고 싶은데 어디에서 예약 할 수 있나요?
하지만 스포팅은 나입니다.	1		미시간 주에 자리 예약
where can i buy the movie totality. 	5		영화 Totality는 어디에서 구입할 수 있습니까?
나는 juan을위한 테이블을 얻기 위해 비율로 쿠바 레스토랑에 가고 싶다.	1		Horatio에있는 쿠바 레스토랑에 가서 1 인용 테이블을 얻고 싶습니다.
같은 마리안이 말하는 예측은 어떻습니까?	2		피지와 같은 지역의 예측은 무엇입니까
평범하고 엘레나가 당신을 에미로 설득합니다.	3		Play Ik Hou Van Jou by Elena Temnikova
플레이어가 이번 봄에 다운로드하지 않았습니다.	0		봄 분위기 재생 목록에 녹아웃로드를 추가합니다.
내 리듬 및 블루스 재생 목록에 오래된 쥐를 추가합니다.	0		내 리듬과 블루스 재생 목록에 터널 쥐 추가
실제로 블루 그래스에 램 블러 만 포함 시키십시오.	0		Indie Bluegrass에 Emily Remler를 포함 시키십시오.
시장에서 영원히 플레이하는 것은 춤입니다. 노란색 que.	3		zvooq에서 Marko Desantis의 Eternally를 플레이하세요.
그러나 내 엄마와 나는 내 인생 음식 더 나은 레스토랑에 대한 높은 평가를 받았습니다.	1		엄마와 나는 레스토랑에서 무글 라이 음식을 위해 높은 등급의 장소를 예약
좋은 날씨는 파밍 턴이 공원 트레일을 비난하는 것과 같습니다.	2		what will the weather be like in Farmington Canal State Park Trail
시어스 누들에서 10 인용 테이블을보세요.	1		국수를 제공하는 식당에서 10 인용 테이블 예약
돈 다니엘에서 트레일러 플래티넘을 찾으세요.	5		Da Ghetto에서 트레일러 Platinum 찾기
크리스탈 라인이 사라진 8 월 7 일 날씨는 어때?	2		Crystal Lawns Guam의 8 월 7 일 날씨는 어떻습니까
트레일러로 다시 돌아가십시오.	5		트레일러 아웃백 바운드 찾기
황혼에 대한 키니 검색이 사라졌습니다.	5		Twilight Is Gone을 검색 할 수 있습니까?
i want to book the distinct allentown tribeca grill for august the twenty third twenty twenty five for weldon jacqueline. 	1		먼 시내 Tribeca Grill을 2025 년 8 월 23 일에 예약하고 싶습니다.
t를보세요. v. 매주 성능 말 주위에 시리즈.	5		TV 시리즈 All Around Performance Horse Weekly를 찾으십시오.
1 분 후에 여기 날씨가 어때요?	2		1 분 후에 여기 날씨가 어때요?
콘크리트 블록 운동처럼 분명히.	3		Cinder Block 운동을 해줘
영화관 자넷 경입니다.	6		영화관에 짐 경
평범한 TV 쇼는 지구에 누워있다.	5		TV 쇼 Tears Laid in Earth 재생
베토벤이 위층에 살고있는 영화관이 문을 닫습니다.	6		Beethoven Lives Upstairs와 가장 가까운 영화관 찾기
영화에 대한 기대가 여기에 있습니다.	6		여기에 어떤 영화가 있는지 말해줘
i needed the top rated steakhouse this on him for one year round azerbaijan. 	1		I need to book a top-rated steakhouse this Autumn  for 1 around Azerbaijan
오늘 밤 뉴 포트 포격을 시작할 수 있습니까?	5		뉴 포트에서 엘링턴을 검색해 주시겠습니까?
장기를 가져 와서 일기 예보에 폭풍이 올 경우	2		Baraga Oregon의 일기 예보에 폭풍이 있습니까?
예보관 30 a. 미디엄..	2		세르비아 예보
추가는 놀라운 외침을 두 배로하지 않았습니다.	0		Stomp & Holler에 inconfundible 추가
그러나 11 월에 윌슨 해군에서 멀리 떨어진 최고 등급의 브래 서리에서 제물과 크레이 멀린 앨리슨은 네 번째 이십 삼 죽은 특정 역사.	1		ouzeri를 제공하는 2030 년 11 월 4 일 Wilson Av에서 멀리 떨어진 최고 등급의 브라 세리에서 노나 그레이, 머틀 및 앨리슨을위한 자리를 예약하세요.
로레인 헤일이 순찰 한이 노래를 미국에서 연주했습니다.	3		Lauren Hill의 American Patrol 노래 재생
그러나 1 인치 싱글 톤 이내의 이웃 커피 하우스에서.	1		Shingleton에서 인터넷이있는 이웃 커피 하우스를 예약하세요.
우리는 여기가 우리 것입니다.	4		현재 책 평가 0 별
and put your hand inside the cockpit head to the players' names lazy chill afternoon. 	0		Lazy Chill Afternoon이라는 재생 목록에 Put Your Hand Inside the Puppet Head를 추가합니다.
최신 멜로디 가격을 재생하고 나중에 판도라에서.	3		Pandora에서 Cisco Adler의 최신 멜로디 재생
but despite a pizza place nine weeks from now in wisconsin. 	1		지금부터 9 주 후에 위스콘신에있는 피자 가게에 자리 예약
simone의 일기 예보를 알려주세요.	2		사모아의 일기 예보를 알려주세요
예술적인 대구 엘리 d. 엔..	0		TODO EDM에 아티스트 추가
나는 와인을 읽을 수있는 북부 지역을 제공 할 것이다.	4		The Northern Reaches에 1 점을 주겠습니다.
영화 일정을 찾으십시오.	6		영화 일정을 찾으십시오.
4 인용 테이블이 필요합니다.	1		I need a table for 4 in Pelland
오늘 Petey에 대한 우리의 날은 27 개의 새로운 학교를 터뜨 렸습니다.	0		add already over, pt 2 to Hip Hop 2017 New School
그리고 그것은 그가 나의 오후 기차 타는 놀이 목록을 마지막으로 이겼 던 단지 어제였다.	0		어제 만 마지막 에피소드를 오후 기차 라이드 재생 목록에 추가
하지만 웨스트 팜 비치에서 glenda lois와 hammer와 pulliam을 제공하는 근처 레스토랑.	1		book in West Palm Beach for glenda, lois and tamra at a nearby restaurant serving puglia
영화 스케줄에 대한 정보가 필요합니다.	6		영화 스케줄에 대한 정보가 필요합니다
영화 일정 영화로 가까운 찾기.	6		영화 일정으로 가까운 영화 찾기
내 프라하 록 몬스터 목록에 꽃병을 꽂아 넣었습니다.	0		내 prog rock monsters 목록에 madlib invazion 추가
서비스를 마지막으로 사용하여 가장 인기있는 심포니의 아티스트 karen 급여 인상을 재생하십시오.	3		Lastfm 서비스를 사용하여 가장 인기있는 심포니의 아티스트 keren peles를 연주하십시오.
plano 최신 발렌타인 데이 부드러운.	3		Play the latest ballad by September
나는 음악 명상을 듣고 싶은 기분이 든다.	3		나는 명상 음악을 듣고 싶어요.
내 금속 파티 플레이 목록으로 돌아가려면 추가하십시오.	0		add it back to my Metal Party 재생 목록
하지만 캄보디아 무용수 바의 테이블에서 치즈 튀김.	1		치즈 튀김을 제공하는 캄보디아의 바에서 테이블을 예약하십시오.
gel purdy와 google music으로 최고의 기록을 재생합니다.	3		Google Music에서 Joe Purdy의 최고의 레코드 재생
2 월 25 일 25 일에 홀스타인을 숨길 것입니다.	2		On 2/25/2025 will it be hot in Holstein
faustino rahman의 팬티에있는 수지의 최고에 대한 노래를 재생합니다.	3		Faustino Oramas의 The Best Of Siouxsie & The Banshees에서 노래 재생
그리고 클레오 파트라라는이 예술가는 십대들의 마스터 작품 20 편 이전에 13이라는 제 비행기 땅에 묶여 있습니다.	0		Cleopatra Stratan이라는 아티스트를 30 Before 20 Masterworks by Teenagers라는 내 재생 목록에 추가
아르메니아 텔레비전 쇼에서 마지막 줄타기 댄서를 보여줍니다.	5		아르메니아 텔레비전 쇼에서 마지막 줄타기 댄서 쇼
최신 TV 쇼를 찾으십시오.	5		High Noon TV 프로그램 찾기
감비아 내성을 위해 오늘 아침 습도는 얼마입니까?	2		Portales Gambia에서 오늘 아침 습도는 어떻습니까
타락한 위스콘신의 선술집을보세요.	1		22:54 동안 위스콘신에서 taverna를 예약하십시오.
나의 평화로운 피아노에 amtrak.	0		평화로운 피아노에 트랙 추가
존 진리 편협의 일.	5		진실과 관용의 작품을 보여주세요
나는 검은 리본 연구를 추가하고 9 살 프리랜서를 좋아한다.	0		I love my neo soul 재생 목록에 Black Ribbons를 추가하고 싶습니다.
데이비드 배너와 운동 경기를합니다.	3		play David Banner on Netflix
90 년대 베이비 메이커 선수의 아티스트입니다.	0		90 년대 베이비 메이커 재생 목록에 아티스트 추가
i would like ignacio figurine us today added to the lectern al. 	0		Ignacio Figueredo의 곡을 electroNOW에 추가하고 싶습니다.
그리고이 물건이 런던에 도착해서 동화 재생 목록에 올랐습니다.	0		내 동화 재생 목록에 가수 ivan roudyk 추가
조니 내쉬가 내 플레이리스트에 항상 팝펑크로 들어가길 바래요.	0		I'd like johnny nash to be put into my playlist Always Pop Punk
내 교수형에 adrienne을 추가하고 편안한 재생 목록을 추가하십시오.	0		내 Hanging Out and Relaxing 재생 목록에 자폐인을 추가합니다.
솔직히 애비에게 5 시간 6 시간이에요.	4		Scarabaeus의 노래 6 개 중 5 개 제공
3 년 만에 했어요.	4		이 에세이 6 점 중 3 점
show me even though the purple heart diary. 	5		영화 Purple Heart Diary를 보여주세요.
영화 스케줄을 보여주세요.	6		영화 스케줄 보여줘
play some music from the forties. 	3		40 년대 음악을 틀어보세요.
왜 레이커스에 대한 일기 예보는 무엇입니까?	2		What is the weather forecast for Waipio Acres
but the spot for gay ramos janice and olives in an apartment handle. 	1		book a spot for gay ramos, janice gonzales and I at a bar in Timbo
70 년대 음악을 틀어 줘.	3		Play music from the seventies
i want to watch the t. v. series rat pack. 	5		TV 시리즈 Rat Pack을보고 싶어
일련의 원추형 영점을 기다립니다.	4		이 시리즈 연대기 평가 0 점
그리고 호텔에서 이단은 저녁 어쿠스틱 연주 목록을 얻습니다.	0		add heresy and the hotel choir to the evening acoustic playlist
find a song called bronco billy. 	5		Bronco Billy라는 노래를 찾으십시오.
영화 시간을 찾으십시오.	6		find movie times
but to me and my grandparents a restaurant in saint helens south dakota. 	1		저와 조부모님에게 세인트 헬렌 사우스 다코타의 레스토랑 예약
여기에서 우리는 심장 시리즈가 5 점입니다.	4		rate The Pure Weight of the Heart series 5 points
danielle을 사용하여 영화 사운드 트랙의 마크 단어에 대한 음악을 재생합니다.	3		Vimeo를 사용하여 Art Porter Junior 영화 사운드 트랙에서 음악 재생
나는 내 헐렁한 음악을 듣고 싶다.	3		Slacker 앱에서 음악을 듣고 싶습니다
나는 새로운 죽음의 임대에 대해 0 점을 얻고있다.	4		I'm giving 0 points to A New Lease of Death.
fine debts and theaters animated movies. 	6		Dipson Theatres 애니메이션 영화 찾기
인도의 국립 의학 저널을 다시 가져와주세요.	5		인도의 National Medical Journal 게임을 가져 오세요.
i need a forecast for jack more math accuses thing one hour and one second from now. 	2		지금부터 1 시간 1 초 후 매사추세츠 주 제트 모어에 대한 예보가 필요합니다.
la 영화는 8 시부 터 시작됩니다. 미디엄. 지역에서.	6		What movies are starting at eight pm in the area 
ray competitors to stars anesthetics. 	4		경쟁자 별 6 개 중 2 개 평가
강간은 빈 다섯 포인트입니다.	4		이 에세이 5 점 평가
60 년대의 마지막 사운드 트랙을 연주했습니다.	3		Play the last soundtrack from the sixties
그리고 내 시간에 더 많은 총은 사랑 노래 재생 목록입니다.	0		내 영원한 사랑 노래 재생 목록에 사후 분석 추가
최고의 분석기를 그림으로 공격하십시오.	5		공격 표면 분석기, 그림 찾기
i want to book a restaurant in forty weeks in iowa. 	2		I want to book a restaurant in 40 weeks in Iowa.
finest don't lie if an american concert nineteen eighty one soundtrack. 	5		Still Life : American Concert 1981 사운드 트랙 찾기
rapist analyst words of four out of six. 	4		Rate The Simplest Words a four out of 6.
what is the forecast for harrison crawford state forest. 	2		Harrison–Crawford State Forest의 예보는 어떻습니까?
yet anatomy of the typeface to one rating. 	4		Give Anatomy of a Typeface a 1 rating.
하지만 나를 위해 인디애나의 레스토랑은 다시 다이앤입니다.	1		나를 위해 인디애나에있는 식당을 예약 해줘, 바이올렛과 다이앤.
범죄학에서 형법에 관한 비디오 게임 저널을 찾으십시오.	5		Find the video game Journal of Criminal Law & Criminology.
finally the show this gaal. 	5		Find me the show The Skull.
play music from jeremy taylor on the album dornan moray illicitly ceiling on the bone and group shark. 	3		Play music from jeremy taylor on the album Dormi Amore, La Situazione Non È Buona on Groove Shark
그의 영국인 아내가 이웃 영화 그룹의 포격은 무엇입니까?	6		그의 영국인 아내는 이웃 영화 그룹에 언제 상영됩니까?
played video game manifesto of nevermore. 	5		비디오 게임 재생 Nevermore의 선언문
나는 드뷔시 클락의 노래를 내 더 가까운 딩기로 만들고 싶다.	0		w c clark의 노래를 내 nerding around 재생 목록에 추가하고 싶습니다.
20,000 6에서 가장 인기있는 사운드 트랙을 연주 해 주 셨나요?	3		Will you play me the most popular sound track from 2006
forecast for israel. 	2		forecast for Israel
아이튠즈에서 1993의 음악을 재생합니다.	3		Itunes에서 1993 년의 음악을 재생합니다.
건물 담론에 대한 4 점 18 사십 사.	4		4 개의 세워주는 설교의 4 점, 1844
but the table at a top rated brasserie in pakistan. 	1		book a table at a top-rated brasserie in Pakistan
but their restaurant for monique stuart arlene and jamie. 	1		Book a restaurant for monique stewart, arlene and jami.
fine movie schedules for animated movies in the area. 	6		해당 지역의 애니메이션 영화 영화 일정 찾기
what's the weather forecast for my current location and john too. 	2		What's the weather forecast for my current location on jun. 2?
맥과 치즈 재생 목록에 경고 장치를 추가했습니다.	0		Add Warning Device to my mac 'n cheese playlist.
but this spot for three and a pizza place. 	1		피자 가게에서 3 인용 자리 예약
그에 의해 꼭대기에 평원과 나는 그룹 상어의 마사입니다.	3		Groove Shark에서 Amon Amarth의 최고 곡 재생
but their restaurant for marcello and permanently and ribera. 	1		marcella, erma 및 leanne rivera의 레스토랑을 예약하세요.
그가 내가 여름의 노래를 볼 수있는 곳을 알았을 때 보여줘.	6		여름의 노래를 언제 어디서 볼 수 있는지 보여줘
콜로라도의 20 대는 어떨까요?	2		What will it be like feb. the twentieth in Colorado
is the sun coming out today in the casting national wildlife refuge. 	2		Is the sun coming out today in Lacassine National Wildlife Refuge
an amtrak to my girls at clay list. 	0		Add a track to my girls' night playlist.
how much humanity is bearing eighteen. 	2		How much humidity is there in UT?
그녀의 영혼을 때리기 위해 이것을 추가하십시오.	0		Add this tune to hipster soul
and fred now blocked my little friend love play list. 	0		내 lo-fi 사랑 재생 목록에 Fred Knoblock 추가
그러나 겨자씨가 상호 작용하는 섭취량은 9 명의 침묵입니다.	1		Book The Mustard Seed in Turks and Caicos Islands for 9 people.
i would like to both the restaurant neighboring lincoln beats. 	1		링컨 비치 인근 레스토랑을 예약하고 싶습니다
조카딸과 T.의 최신 음반을 듣고 싶어요.	3		스즈키 아미의 최신 음반을 듣고 싶다
당신은 지구 평화로운 피아노에 디트로이트에서 라이브를 할 수 있습니까?	0		Can you put live in detroit on the playlist Peaceful Piano
내 인생의 차가운 이야기를 결정합니다.	5		Story of My Life라는 사가를 찾으십시오.
well a blizzard hit for a kind state natural reserve i'm jan sixteen. 	2		Will a blizzard hit Torrey Pines State Natural Reserve on jun. sixteenth?
add rosemary clooney security at plymouth. 	0		Pura Vida 재생 목록에 로즈마리 클루니 추가
finding animated movies nearby. 	6		find animated movies nearby
어려운 길을 보여주는 가장 가까운 영화관은 무엇입니까.	6		what's the closest movie house showing The Hard Way
rape is series two of sex. 	4		rate this series two of 6
my life is a fake is one out of six. 	4		가짜로서의 내 인생은 6 명 중 1 명
playing a song for the forties. 	3		40 대의 노래를 틀어 줘
i need to know the weather for san martine. 	2		San Martin의 날씨를 알아야합니다
please search for the work all the wrong reasons. 	5		작품, 모든 잘못된 이유를 검색하십시오.
의식의 역사에 대한이 연대기는 세 번으로 진행됩니다.	4		this chronicle of The Origins and History of Consciousness is a three
잃어버린 언덕이 더 뜨거울까요?	2		Wyomissing Hills가 더 뜨거울까요?
섹스와 마약 그리고 예수 그리스도를 보여주세요.	5		show me the picture Sex and Drugs and Jesus Christ
isn't settled land playing at the movie theater. 	6		영화관에서 상영되는 불안정한 땅
who was the artist who did the painting called spire to season of flame. 	5		Spyro 2 : Season of Flame이라는 그림을 그린 아티스트는 누구입니까?
play a ballad form twenty fourteen by double line google music. 	3		Play a ballad form 2014 by Double on Google Music
can you play some music from nineteen ninety nine. 	3		1999 년부터 음악 좀 틀어 줄래
난방 실패로 인한 공격을 듣고 싶습니다.	3		I'd like to hear a track by Theo Keating.
find the movie schedule. 	6		영화 일정을 찾으십시오.
bosnia reservation for an outdoor restaurant. 	1		야외 레스토랑 예약하기
c에서 30 대부터 노래를 재생합니다. 비. 노란색 que.	3		Zvooq에서 30 년대의 노래 재생
이 앨범을 6 포인트의 리야드로 가져옵니다.	4		이 앨범에 6 점 중 3 점을 줘
but this cans song on the field the navy brat play list. 	0		put this Kes song on the feel good indie rock playlist
일반 시네마 코퍼레이션의 영화 스케줄은 어떻게 되나요	6		General Cinema Corporation의 영화 일정은 어떻게 되나요?
place and chant music from two thousand eight. 	3		Play some chant music from 2008.
하지만 나의 증조부와 마카로니가시 키를 터뜨리는 예약.	1		CT의 마카로니 펍에서 증조부와 저를위한 예약 예약
나는 또 다른 TV 요청에 와인과 장미의 날 사진이 필요합니다.	5		Days of Wine and Roses 및 기타 TV 요청 사진이 필요합니다.
노치 시에라 리온의 일기 예보는 무엇입니까?	2		What is the weather forecast for Naches, Sierra Leone
what is the current temperature here. 	2		여기의 현재 온도는 얼마입니까
finally the showtime's for until death at the nearest movie house. 	6		가장 가까운 영화관에서 죽을 때까지의 상영 시간을 찾아 줘.
3 인 파티가 정말 바바 세탁실을 먹고 싶어합니다.	1		제 3 인 파티가 정말 브래 서리에서 바바 오럼을 먹고 싶어하는데 도와 주실 수 있나요?
폭풍우 재생 목록에서 재생 해주세요.	3		Play A Sudden Rainstorm playlist.
그런 다음 텍스트이지만 큰 숲이 벌어집니다.	4		이 교과서는 6 점 중 4 점입니다.
지금부터 반년이 필요합니다. 최고 등급의 R ..	1		지금부터 8 년 반 후에 최고 등급의 바에 예약하고 싶습니다
find the movie don't break the heart that lansing. 	5		영화 Do n’t Break the Heart That Loves You 찾기
그리고 론 캄파넬라가 아델라 그라를 싫어합니다.	0		사이키델릭 록에이 Rob Campanella 곡을 추가하세요.
강간은 교과서 오성 마취제입니다.	4		Rate this textbook 5 stars out of 6
나는 책에 라벤더와 올드 레이스와 3 점을 줄 것이다.	4		I would give the book Lavender and Old Lace a rating of three
가장 가까운 영화관에서 암시하는 카스텔로 슬개골을 시인하는 것을보고 싶습니다.	6		Abbott와 Costello가 가장 가까운 영화관에서 Captain Kidd를 만나는 것을보고 싶습니다.
나는 최대 트랜스 사진을보고 싶다.	5		I want to see the MAXIMUM TRANCE picture
수단에있는 켈리를 위해 세금을내는 식당이 필요 해요.	1		I need a table at a restaurant in Texas for kelley and suzette
