sentence	label	missing	target
저를 위해 영화 시간표를 불러주세요.	6		영화 스케줄 불러 주 시겠어요?
나는 그것에서 시리즈 0을 마지막으로하지 않았다.	4		플래시 시리즈에 6 점 만점에 0 점을줍니다.
play music from nineteen fifty. 	3		1950 년부터 음악을 틀다
후손이라는 그림을 보여주세요.	5		Show me the painting called The Descendants.
인기있는 브라 세리에서 1 인용 헤드 테이블에 있습니다.	1		Get me a table for one  at a popular brasserie
가장 가까운 영화관에서 어떤 영화가 상영되는지 알고 싶어요.	6		가장 가까운 영화관에서 어떤 영화가 상영되는지 알고 싶습니다.
그리고이 아티스트는 내 생각의 밤의 그래미 상을 수상했습니다.	0		add this artist to my 59th grammy awards
가장 가까운 영화관의 영화 목록을주세요.	6		Give me the movie listings at the closest cinema please.
그 사건은 아 레타 프랭클린 프리먼을 얻지 못했습니다.	0		Add Ace Hood to the this is aretha franklin playlist.
t를 찾으십시오. v. 칵테일 왕이라는 시리즈.	5		Cocktail Kings라는 TV 시리즈를 찾으십시오.
play my height and keep the it. 	3		내 Hot 50 재생 목록을 재생합니다.
show me the edge of love photograph. 	5		사랑의 가장자리 사진 보여줘
i want to eat it and are saying things in in the granite being said thursday for five people. 	1		목요일에 Saint Vincent and the Grenadines 바에서 5 인 ​​식사를하고 싶습니다.
188 명에 대한 강간.	0		90 년대 베이비 메이커에게 속도 조정
프리델 항구 탄자니아 날씨를 확인하십시오.	2		탄자니아 이글 하버의 날씨 확인
i want to find a restaurant that has a table for two five a. m.. 	1		오전 5시에 2 인용 테이블이있는 식당을 찾고 싶어요
영화 스케줄을 찾으십시오.	6		find movie schedules
강간 가해자들은 아마이 별 다섯 개 정도일 것입니다.	4		The Sail and Steam Navy List 등급 5 stars
나는 그의 소설을 더 많이 깨뜨릴 것이다.	4		나는이 소설을 4 점으로 평가할 것이다
in this book chronicles four stars. 	4		이 책 연대기에 별 4 개 부여
안티 공성전과 강한 플레이 목록에 양고기를 추가하고 싶습니다.	0		ntc gym strong 재생 목록에 글램을 추가하고 싶습니다.
나는 이전 앨범을 더 풍성하게한다.	4		I give the previous album a 4.
그랜드 캐년 트레일에는 벌금이 부과됩니다.	6		그랜드 캐년 트레일 일정을 확인하세요.
나는 책상을 예약하고 싶습니다.	1		최고의 남동부 브라질 푸드 코트를 예약하고 싶습니다
wait till last text but three stars. 	4		rate the last textbook three stars
and john brown to my dinner time acoustics. 	0		내 Dinnertime Acoustics에 John Brown 추가
영화 영화 시간에 의해 잘 닫힙니다.	6		영화 영화 시간으로 가까이 찾기
2 인용 테이블을 원하고 사우스 올 메이에 서둘러 황동 1 인을 원칙으로 애니.	1		São Tomé와 Príncipe의 브라 세리에서 2 인용 테이블을 원합니다
텔리 어 힝 클리가 될까요?	2		쿠웨이트에서 더 쌀쌀해 질까요?
그리고 봉고는 검은 안식일 대단한 해의 선수입니다.	0		Add Bonga to the Black Sabbath The Dio Years playlist
that ninth inning to my boss until the dinner play list. 	0		내 bossa nova 저녁 식사 재생 목록에 9 이닝 추가
i want the nearest movie house with a debtors. 	6		The Debtors와 가장 가까운 영화관을 원합니다
epperson의 로컬 레스토랑과 두 사람을 위해 끊임없이 대답합니다.	1		Book a restaurant in Everson Nevada that serves conchiglie for two people.
내 젊은 메이저 팝 밴드와 스패니얼 광고	0		내 El Mejor Pop en Español에 노래 추가
TV 쇼에서 진실을 직시하십시오.	5		Face the Truth, TV 쇼 찾기
13 일부터 평범한 추적 애드킨스 음악.	3		30 년대의 Trace Adkins 음악을 재생합니다.
신기루의 주인공에 코카인 책이 그를 입힐 것이다.	5		show book of Pokémon: The Mastermind of Mirage Pokémon
where can i purchased the game dancing in the dark ten years of dancing fairy. 	5		Dancing in the Dark : 10 Years of Dancing Ferret 게임은 어디에서 구입할 수 있습니까?
소위 '바람을 타고'라는 TV를 찾으세요.	5		Ride the Wind라는 TV 프로그램 찾기
i want to find islami restaurant in boston in. 	1		Bastian IN에서 살라미 레스토랑을 찾고 싶습니다.
슬래 커에서 클래식 록을 연주하십시오.	3		play classic rock on Slacker
when will the blonde ambition be playing. 	6		When will the Blonde Ambition be playing
6 시간 중 현재 교과서를 제로로 만들고 싶습니다.	4		현재 교과서에 별 6 개 중 0 개를주고 싶습니다
find a t. v. series called live hearts. 	5		Find a TV series called Live Hearts.
잿더미에서 고급을 목표로 내 바위까지.	0		Add from the ashes to my rock gaming playlist
나는 동쪽 브래디 근처에서 7 명을 먹고 싶다.	1		이스트 브래디 옆에서 7 명 가까이 먹고 싶어
find a movie called easy way to stop smoking. 	5		The Easy Way to Stop Smoking이라는 영화를 찾으십시오.
제 정치범들에게 케이시 챔버가 함께 놀아요.	0		내 정치 펑크 재생 목록에 kasey 챔버 추가
i need a book called student demonstration time. 	5		Student Demonstration Time이라는 책이 필요합니다
교과서는 6 점 만점에 0 점입니다.	4		이 교과서 6 점 만점에 0 점
Seamus Heney 수정 콜린스의 노래를 재생합니다.	5		Seamus Heaney Collected Poems 노래 재생
look reservations at a restaurant with the king to even on february the second twenty eighteen. 	1		2018 년 2 월 2 일에 vickie와 caitlin이있는 레스토랑 예약
채팅을하세요.	3		부족 플레이
오티스 레딩으로 음악을 재생합니다.	3		Otis Redding의 음악을 재생합니다.
안데스 산맥을 미리 보여주고있는시 치고 산 영화관을 찾으세요.	6		Ganges : River to Heaven을 보여주는 07:52의 영화관 찾기
현재 책 영웅의 날 일을 읽으십시오.	4		현재 책 평가 0/6
분명히 스무 곡.	3		20 대 노래 틀어 줘
내 여행 목록을 듣지 못합니다.	0		내 여행 재생 목록에 알랭 캐론 추가
그러나 잉크의 테이블에서 캔디스를위한 포도원 피난처에서 그리 멀지 않은 커피 하우스는 궤도에있는 청중에 떨어졌다.	1		Book a table at the Eighth Step Coffee House that isn't too far from Vineyard Haven for candace phillips, debbie and sondra
play white noise. 	3		Play White Noise.
어디에서 사진을 볼 수 있습니까?	5		내가 당신을 돌볼 사진은 어디에서 볼 수 있습니까?
play in the top twenty songs by the clintons on spotted by. 	3		Spotify에서 The Kleptones의 상위 20 곡 재생
나와 90 센트가 갈망하는 코르 동 블루 레이디는 테이블과 브라 세리를 보았습니다.	1		me and aisha and craving cordon bleu and need to book a table at a brasserie.
find a movie theater with the intersections that is nearest. 	6		가장 가까운 교차로가있는 영화관 찾기
좋은 분류 폐와 데미안을 재생합니다.	3		play good Classified songs on Vimeo
차고에서 남자를 찾으십시오.	5		Search for Man in a Garage
레이 테온 그림자 3 개와 6 개 별.	4		Beyond the Shadows 3 of 6 stars 등급
쇼의 2 세대 앨범.	5		2 세대 앨범보기
마지막으로 저녁 출퇴근 클레이에이 트랙을 추가합니다.	0		이 트랙을 Evening Commute 재생 목록에 추가합니다.
3 월 25 일 28 일 오하이오 주에서 도보 거리 내에서 더 뜨거워 질 것입니다.	2		Is it going to be hotter within walking distance of Ohio on 3/22/2038
토지를 얻기 위해 청구인의 음악을 재생합니다.	3		재생 목록에서 음악 재생 Get Lit
공중 조이 라이드라는 게임을 찾으십시오.	5		Find a game called An Aerial Joy Ride.
정격 벨트는 이론을 들었습니다.	4		Rate The Bell Curve a three.
알래스카가 더 추울까요?	2		알래스카에서는 추워 질까요?
강간은 우리의 가장 소중한 기록입니다.	4		Rate this chronicle 0 stars
place in king county from the eighties. 	3		80 년대의 King Tubby 연주
will there be a blizzard at four am in sky valley. 	2		스카이 밸리 오전 4시에 눈보라가 올까요
내 디스코 열풍 재생 목록에 돈을 넣어 줄 수 있니?	0		내 디스코 열풍 재생 목록에 monifah 좀 넣어 줄래
동 티모르에서 멀지 않은 날씨는 어떻습니까?	2		What's the weather going to be like not far from East Timor
브리아나가 사랑의 비밀에 갈 것이라고 생각한다면.	4		사랑의 비밀 6 점 중 3 점
더글러스 극단을 보여주는 시간은 몇시입니까?	6		Douglas Theatre Company에서 Bhoot Return이 몇시에 상영됩니까?
개인적으로 사운드 트랙을 틀어주세요.	5		Play me the soundtrack for Nothing Personal.
최고의 리키 발 음악을 연주합니다.	3		최고의 Ricky Bell 음악 재생
동네에서 애니메이션 영화에 대한 영화 스캔들을 보여줍니다.	6		동네에서 애니메이션 영화의 영화 일정을 보여줍니다.
well the wedding bianchi and on ninth twenty thirty seven in new brunswick botanical garden. 	2		2037 년 4 월 9 일 뉴 브런 즈윅 식물원의 날씨는 어떻습니까?
난 램 메달리온을 찾고 있어요.	5		I'm looking for 1634: The Ram Rebellion.
30 대부터의 플레이 공격.	3		30 대부터 트랙을 틀다
북서쪽 통로에 대한 트레일러를 재생합니다.	5		The North-West Passage 예고편 재생 해줘
bloated delicatessen as indoor for three. 	1		3 인용 실내 조제 식품 예약
이 아티스트를 내 유죄 쾌락 플레이어에 추가합니다.	0		이 아티스트를 Guilty Pleasures 재생 목록에 추가하세요.
우리는 1919 년 7 월의 종말의 전설 19.19. v. 쇼.	5		Show me the Live ~ Legend 1999 & 1997 Apocalypse TV 쇼
새로운 자칼을보고 싶습니다.	5		I'd like to see The New Jackals
오케스트라 질투 목록에 따라 내 자리에 이것을 추가하고 싶습니다.	0		이 곡을 Spotify 오케스트라 첼로 재생 목록에 추가하고 싶습니다.
read the current album one zero. 	4		현재 앨범을 0 점으로 평가
but this spot for three and r in antarctica. 	1		남극 대륙의 술집에서 3 인용 자리 예약
오늘 상영되는 애니메이션 영화가 극장에 왔습니다.	6		Which animated movies are playing today at KB Theatres?
이 지역의 영화에 대한 영화 일정이 괜찮습니다.	6		Find the movie schedule for films in the area.
가장 가까운 영화관의 영광이 무너진 것을보고 싶습니다.	6		21:41:08에 가장 가까운 영화관에서 Bound for Glory를보고 싶습니다.
play something from the jonathon the movement. 	3		jonathon lee 운동에서 뭔가 연주
사람들은 리듬과 블루스 재생 목록에 따라 서로 사진을 찍습니다.	0		Rhythm and Blues 재생 목록에 서로의 사진을 찍는 사람들 추가
우리는 6 개 중 당신에게 열심히 깨달았습니다.	4		Breakheart Pass 6 점 중 2 점을 평가하세요.
새로운 건물 제인을 찾고 있습니다.	5		새로운 빌드 엔진을 찾고
현재 시리즈에 6 점 중 1 점을 얻습니다.	4		give one out of 6 points to current series
그녀의 거대한 연주를 악의의 여왕은 몇시에 있습니다.	6		물랑 루즈 여왕의 경기는 몇시입니까?
뉴질랜드 전기 사전에 두 가지 점이 있다고 생각합니다.	4		뉴질랜드 전기 사전은 2 점을받을 만하다고 생각합니다
속삭이는 화면에서 소설을 찾고 있어요.	5		나는 비명에서 속삭임까지 소설을 찾고있어
3처럼 느껴지는 전류.	4		The current essay feels like a 3.
벅스 버니 니트라는 사진을 찾아보세요.	5		Find me the picture called Bugs Bunny Nips the Nips
what time is trouble every day playing. 	6		매일 트러블이 몇 시인가
건너 뛰기의 현재 세금 코드 5를 읽으십시오.	4		현재 교과서 평가 5/6
나는이 앨범을 3 점 얻고 싶다.	4		이 앨범에 3 점주고 싶어
오늘의 모든 p에서 게리 클락 노래. 그리고 프레이 땅.	0		Gary Clark 노래를 Soul bpm 재생 목록에 넣습니다.
그 가방을 찾거나 평범하게 만들 수 있습니다.	6		The Beggar Maid 게임을 찾을 수 있습니다.
달콤한 오래된 chum out 앨범.	0		add an album in Sweet Soul Chillout
철학 저널 앨범에서 졸업생을 연기했습니다.	5		대학원 교수 철학 저널 앨범 재생
창의적인 작품을 즉시 찾을 수있는 곳은 어디입니까?	5		창의적인 작품은 어디에서 찾을 수 있습니까? The Very Best of Simply Red
및 j. 피. 기도를 진정시키기 시작합니다.	0		재생 목록을 진정시키기 위해 j p pickens 추가
하늘을 나는 언덕에 대한 강우량 예보입니다.	2		Flying Hills의 강우 예보가 있습니까?
6 시간 중 3 시간이 지났 으면합니다.	4		이 책에 별 6 개 중 3 개를주고 싶습니다
내 키 재생 목록을 재생해야합니다.	3		Youtube에서 내 Hype 재생 목록을 재생합니다.
11 시간 만에 북 마리아나 섬에서 매들린을 안내하는 식민지를 찾아보세요.	1		book a brasserie for connie scott and madeline in Northern Mariana Islands in eleven hours
파리의 날씨는 어떻습니까.	2		파리의 날씨는 어떻습니까?
그는 그것이 피아노 바라는 제목의 내 플레이리스트에 네덜란드 아티스트로 올라 갔다는 것을 알고있었습니다.	0		Can you add Esquivando charcos to my playlist entitled the piano bar
ansell은 마흔 여덟 스물 여섯 팀 선수입니다.	0		add sos 48 2016 재생 목록
7시에있는 곳을보세요.	1		7시에 찻집 예약
i'd like to hear the song the reverie. 	5		In a Reverie 노래를 듣고 싶어
로드니 휘태커의 마이애미 스물 세븐틴 플레이	3		Rodney Whitaker의 Miami 2017 플레이
스물 10 개 중 상위 20 개 교향곡을 연주합니다.	3		2010 년 상위 20 개 교향곡을 연주하다
아주 특별한 크리스마스 7이라는 게임을 찾아보세요.	5		A Very Special Christmas 7이라는 게임을 찾으십시오.
비행기가 있지만 시내 근처에있는 10 명의 회원을위한 식당은 28 세에 있습니다.	1		20:38에 시내 근처 10 명의 레스토랑을 예약하세요.
read the current essays years stars. 	4		현재 에세이 0 점 평가
하지만 Bill Barry는 El oro 게스트 목록에 있습니다.	0		Elrow Guest List에 Bill Berry 트랙을 올려주세요.
is there a blizzard coming to elder on them. 	2		엘베 라노에 눈보라가오고 있습니까?
보증에 큰 발생.	4		현재의 무용담을 2 점 평가
파티가 끝났다고 이상하게 플레이하세요.	5		Play me the saga The Party ’s Over
길에서 옷을 입으라고 운이 좋다고 말하십시오.	5		트리스탄 배신을 찾도록 도와주세요
둥지에서 사랑이란 무엇입니까?	5		안개 속의 사랑이란 무엇입니까?
what's the forecast for my current spot. 	2		내 현재 자리에 대한 예보가 어때
나는 동물의 보이지 않는 힘을 초자연적으로보고 싶다.	5		Supernatural : The Unseen Powers of Animals를보고 싶습니다.
고딕 음악을 연주하십시오.	3		고딕 음악 재생
nancy belmont we said molly want to eat at a restaurant in gibraltar. 	1		낸시, 엘마 루이즈, 몰리는 지브롤터의 한 식당에서 먹고 싶어
영화 스케줄을 찾으십시오.	6		영화 스케줄 찾기
when the next year and canada. 	2		캐나다의 내년 날씨
나는 참신한 키를 찾고 있는데 빛이 있었다.	5		그리고 그 다음에는 빛이라는 소설을 찾고 있습니다.
개구리 다리에 약간의 후지모토 ojeda를 추가하십시오.	0		내 Women of Rock 목록에 fujimoto yae 추가
나는 기껏해야 섹스를 읽는 동물 해방 원추형 제로 포인트를 깨뜨릴 것입니다.	4		동물 해방 연대기 0 점과 최고 점수 6 점을 평가하겠습니다.
show me this long spider-man of the rings. 	5		Spiderman of the Rings 노래 보여줘
내 피아노 발라드 연주 목록을 틀어 줘.	3		내 피아노 발라드 재생 목록을 재생합니다.
크리스탈 조각을 맞춰 보겠습니다.	5		크리스탈 플레이크 키스 해줘
내 여름 놀이 목록에 끝을 넣어.	0		내 여름 플레이리스트에 성민을 넣어 줘
내 락 초대 재생 목록에 만족합니다.	0		add satisfied to my Rockin' Vibes playlist
이 책을 읽으십시오. 오.	4		이 책 평가 3 점
why films in movie times are close by. 	6		가까운 영화와 영화 시간
내가 아는 시간을 조금 더 보냈을 것 같은 그림을 찾고 있습니다.	5		나는 하나님이 당신에게 조금 더 많은 시간을 보내셨어야하는 그림을 찾고 있습니다.
여기서 마지막으로 가져갈 것은 무엇입니까?	0		Josiah Leming을 te quiero 목록으로 이동
마지막 전투는 6 점 만점에 2 점을 기록했습니다.	4		최종 전투 점수 6 점 만점에 2 점 표시
좋은 시간 활동 재생 목록에 존 디콘입니다.	0		즐거운 시간 활동 재생 목록에 John Deacon을 추가하십시오
please get me in the movie schedule. 	6		please give me the movie schedule
현재 자리가 따뜻합니까?	2		현재 자리가 따뜻합니까?
지난 70 년대 여행에 이걸 추가 해주세요.	0		이 곡을 내 70 년대 여행 목록에 추가
메릴랜드의 일기 예보는 어떻습니까	2		메릴랜드의 일기 예보는 어떻습니까
지금부터 3 초 후 월링 국립 공원의 일기 예보는 어때?	2		지금부터 3 초 후 월린 국립 공원의 일기 예보는 어떻습니까
적어도 내 90 년대의 베이비 메이커 플레이리스트에 멜로디 넬슨을 썼다.	0		My 90 's Baby Makers 재생 목록에 멜로디 넬슨의 역사 추가하기
놀라운 헐크 리턴 노래를 보여주세요.	5		The Incredible Hulk returns 노래를 보여줘
is it going to hailing niger. 	2		니제르에서 우박이 올까요?
마지막으로 죽었을 때 1960 년부터 음악을 재생합니다.	3		Play music from 1969 on lastfm .
레니 K. 음악.	3		Lenny Kaye 음악을 재생합니다.
read this book is zero. 	4		Rate this book a 0
find the closest movie theater for films. 	6		가장 가까운 영화관 찾기
영화 대포를 찾을 수 있습니까?	5		영화 The Countess를 찾아 주실 수 있나요?
춤추는 소녀로 나를 강하게 올려봐.	5		Dancing Girl의 노래로 나를 연결해주세요.
show me this joe golden mouse in the three cats. 	5		Show me the show Goldimouse and the Three Cats
what the weather conditions the temper and pleasant in togo. 	2		will the weather conditions be temperate and pleasant in Togo
전능하신 존슨 TV 시리즈를 찾으십시오.	5		TV 시리즈 The Almighty Johnsons 찾기
place them fast fusion on spotted by. 	3		Spotify에서 빠른 퓨전 재생
내 상사와의 전쟁은 아무도 살지 않습니다.	0		내 bossa nova 저녁 식사 재생 목록에 Guy Warren을 추가합니다.
이 책을 받으십시오.	4		이 책에 3 점을 부여
show me the movie times for animated movies in the area. 	6		Show me the movie times for animated movies in the area .
스털링을보세요.	1		119 반일 안에 뉴질랜드의 비스트로를 예약하십시오.
프록 플레이리스트에서 내 여자들 플레이 해.	3		내 Women of Rock 재생 목록을 재생합니다.
나에게서 별을위한 찰리 평화 심부름 연대기.	4		The chronicle Charlie Peace earns 4 stars from me
얼어 붙은 날씨에 대한 예측은 얼마입니까?	2		렌의 혹한 날씨 예보는 어때
현재 앨범 5 점을 읽으십시오.	4		현재 앨범 5 점 평가
play magic sam from the thirties. 	3		30 대부터 매직 샘 플레이
and get happy dictionaries aloft cancio is mas linda's del mundo. 	0		add Get Happy to cherry's Las Canciones Más Lindas Del Mundo
오후 5시에 내 경력에 대한 예측은 어떻습니까.	2		현재 장소의 오후 5시 예보는 어떻습니까?
6 개의 별의 게토레이 큐에 대한 해류를 위해.	4		현재 사가에서는 별 6 개 중 2 개를 평가합니다.
나는 때때로 의사를 원하고 골드 에디션의 플레이 목록에 추가했습니다.	0		I want novena on a nocturn added to the playlist called Gold Edition
하지만 때가되면 레오폴드 카페에도 불구하고	1		book a spot at Leopold Cafe in Bhutan
find the deaths miles to soundtrack. 	5		Deathsmiles II 사운드 트랙 찾기
그리고 사랑의 터널 초원 충돌 코스 미각 목록.	0		Add Tunnel of Love to ethel's metal crash course palylist
그리고 로버트가 일본이라는 것을 인정합니다.	0		여기에 Justin McRoberts를 추가하면 쇼팽입니다.
playing music by sarah connor. 	3		Sarah Connor의 음악 재생
they knew mr knight should get out of six the reading of two. 	4		They Knew Mr. Knight should get out of 6 a rating of two
양자 치아를 결정합니다.	5		사가 양자 도둑으로 이동
가장 인기있는 moran 80과 solids를 사용합니다.	3		list to the most popular Muireann Nic Amhlaoibh song
hoping they can see on a scale required of planets didn't play songs. 	3		open the Canciones del Recuerdo playlist and play songs
그룹 상어에 대한 1983 발라드에서 재생합니다.	3		Play a 1983 ballad on Groove Shark.
and dave bigler to my allied nineties play list. 	0		Add dave bickler to my all out 90s playlist
and i pledge allegiance to the grand to my same vanya hit your play list. 	0		add i pledge allegiance to the grind to my Sinfonía Hipster playlist
i give the following album to that of six hours. 	4		나는 다음 앨범에 별 6 개 중 2 개를 준다.
갑판에있는 맨해 셋 버몬트의 기상 조건은 6, 2, 3, 6으로 어떨 것입니다.	2		2036 년 12 월 6 일 버몬트 주 맨해 셋의 기상 조건은 어떻습니까?
finally showed the sordid the lichter. 	5		Find the show The Sword of the Lictor
날씨는 9 월 26 일 아래 링크와 같습니다.	2		What will the weather be like on september 26th in Eastlake
what's the forecast for georgia. 	2		조지아에 대한 예측은 어떻습니까?
애디슨이 그들에게 물었다.	0		Add song to Siesta
1 마일 이내에 가장 가까운 영화가 있습니다.	6		What cinema has the closest movies
훌륭한 가족 불화 소설.	5		가족 불화 소설 찾기
search for video game this guy is crying. 	5		search for video game The Sky Is Crying
뉴 멕시코의 일기 예보는 어떻습니까.	2		What is the weather forecast for New Mexico
앨리스와 실화는 언제 볼 수 있습니까? 미디엄. 씨. 극장.	6		When can I watch Alice: A True Story at AMC Theatres?
play music by dean and mendez car. 	3		Play music by Deenanath Mangeshkar
말콤의 일기 예보를 보냈어요	2		Can you send me the weather forecast for Malcom
will it be nice here and in the same area. 	2		여기와 같은 지역에서 좋을까요?
현재 시리즈는 별 두 개가 아니 었습니다.	4		현재 시리즈에 별 두 개를 부여합니다.
where can i persisted t. v. series liar game the final stage. 	5		TV 시리즈 Liar Game-The Final Stage는 어디에서 구입할 수 있습니까?
but jazzy be on lazy chill afternoon play list. 	0		Put Jazzy B on Lazy Chill Afternoon playlist
how much rain are we getting in current position. 	2		현재 위치에 얼마나 많은 비가 내리고 있습니까
서커스 세계를 찾고 있어요.	5		서커스 월드를 찾고 있습니다.
오늘 밤 10 개를 더 추가하면 재생 목록에 있습니다.	0		Add another tune to my verano playlist. 
i totally stress free by bobby lord to my play list. 	0		내 재생 목록에 Bobby Lord의 Totally Stress Free 추가
애디슨은 재정적으로 물을 마시지 마십시오.	0		add the song don't drink the water to my playlist
play my springtime play list. 	3		Play my springtime playlist.
play me the most popular arthur johnston song. 	3		Play me the most popular Arthur Johnston song
화이트 사이드에서 7 월 날씨는 어떻습니까?	2		How's the weather going to be on Jul. 2 in Whiteside
itunes에서 ted lamb에 의해 라이브 앨범 21 세기를 재생합니다.	3		Play the album 21st Century Live by Chet Lam on Itunes.
what's the weather in oregon. 	2		What's the weather in Oregon
세 개가 아닌 현재 앨범을 얻으십시오.	4		Give the current album a three.
별 세 개에서 호미니드와 사랑에 빠지는 연대기까지.	4		연대기 Falling in Love With Hominids에 별 3 개 제공
for planets to know the tino an absolutely sweet marie. 	0		For playlist todo latino add Absolutely Sweet Marie
que je a nonbinding me에 의해 영원한 놀이를하십시오.	3		Vimeo에서 Juju Mob의 The Eternal을 재생합니다.
well at the chilean for interlude hills american samoa. 	2		Druid Hills AMerican Samoa에서는 4시에 쌀쌀할까요?
삼십 아홉 번째 시간을 찾으십시오.	6		Find time for The Thirty Nine Steps 
알렉산더를 내 가르침에 사용합니다.	0		Add Sam Moran music to my tgif playlist
내가 들었던 1950 팔꿈치 마음에서 놀아 라.	3		Iheart에서 1950 년 앨범 재생
오전 11시에 쿠바의 일기 예보는 어떻습니까.	2		오전 11시에 쿠바 일기 예보는 어떻습니까
